2020年03月01日,中国-世卫组织联合考察报告发布！10条干货必看_荔枝网新闻,国家卫健委,2月29日，国家卫生健康委发布《中国-世界卫生组织新型冠状病毒肺炎（COVID-19）联合考察报告》，公布了对新冠肺炎的最新研究结果与应对措施。报告指出，中国采取了历史上最勇敢、最灵活、最积极的防控措施。1.病毒属性：新冠病毒是一种动物源性病毒；在武汉发现的早期病例被认为是通过动物传染到人的途径感染，截至2月25日，尚未查明动物来源。2.病毒宿主：蝙蝠似乎是该病毒的宿主，但中间宿主尚未查明。3.病毒特点：新型冠状病毒是一种新出现的病原体，传染性强、传播速度快。它既不是SARS，也不是流感。4.传播途径：新冠肺炎在无防护下通过飞沫和密切接触在感染者和被感染者之间发生传播，在医疗机构中或可存在因医疗操作产生气溶胶而发生空气传播的可能，粪-口传播似乎并不是主要传播方式。5.传播来源：到目前为止，绝大多数病例是来自武汉或湖北或与之有直接联系。社区传播非常有限，人际传播主要在家庭中发生。6.易感人群：新冠肺炎病毒几乎人人易感，感染后是否具有免疫力需进一步研究；真正的无症状感染者比例尚不明确，但相对较罕见，也不是传播的主要驱动因素。7.患者特征：新冠肺炎患者通常在感染后平均5至6天（平均潜伏期5至6天，范围1至14天）出现轻度呼吸道症状和发热等症状，多数患者为轻症可痊愈，重症和死亡高危人群为年龄60岁以上。8.医务人员感染：流调显示，许多医务人员病例可能是在家庭内而非医院感染的。湖北以外地区的医务人员感染很少见。医疗机构医务人员感染并不是新冠肺炎在中国的主要传播特征。9.中国措施：中国采取了坚定有力的综合性非药物性干预措施，非常有效地切断病毒传播途径，为全球应对新冠肺炎提供了重要经验。这些措施包括：开展积极主动监测，迅速发现并立即诊断、隔离病例，严格追踪并隔离密切接触者，引导民众理解并接受上述措施。10.公众建议：认识到新冠肺炎是一种全新出现的令人关注的传染性疾病，但只要采取正确的应对措施，疫情暴发就可以得到控制，患者大都能够康复；立即采取并落实最为严格的预防措施，勤洗手，打喷嚏或咳嗽时掩住口鼻；时时关注新冠肺炎及其体征和症状（如发热、干咳）的最新信息，不断调整应对策略；人人做好准备，通过各种方式积极参与到疫情防控中来，严格保持“社交距离”，努力帮助老年人等高危人群。
2020年03月01日,苹果CEO库克：中国正在控制住疫情 供应链已恢复工作_荔枝网新闻,新华网,新华社旧金山2月28日电美国苹果公司首席执行官蒂姆·库克日前表示，他对中国控制住新冠肺炎疫情非常乐观。据美国当地媒体28日报道，库克日前接受福克斯商业新闻电视台采访时说：“我感觉中国正在控制住疫情，中国的（确诊病例等）数据正在逐日下降。因此我非常乐观。”库克表示，苹果公司在中国的供应链非常重要，他很高兴看到中国的供应链已经恢复工作。苹果公司在中国的商店正陆续恢复营业，苹果手机工厂也正在复工，目前“处于爬坡阶段，还需要一些时间”。他表示，苹果公司目前的供应链能够应对新冠肺炎疫情的挑战。被问及苹果公司是否考虑将其供应链从中国转移时，库克回应说，他目前的观点是，如果有变化也是一些微调，而不是根本的改变。库克指出，苹果公司选择在中国生产的原因并不仅是成本，还有产品质量、上市时间和制造能力等方面。在其他国家或地区建厂需要满足上述一系列要求。苹果公司近期下调了今年一季度营收预期，公司股价较之前高位大幅下跌。库克认为影响“是暂时的，而不是长期的”。他表示并不特别关注市场的短期波动。“现在是2月，有理由乐观，让我们拭目以待。”
2020年03月01日,黑龙江省新冠肺炎确诊病例无新增 出院35例_荔枝网新闻,荔枝新闻,trog荔枝新闻讯trog据黑龙江省市卫生健康委员会通报，2月29日0-24时，黑龙江省无新增确诊病例。无新增疑似病例。新增治愈出院病例35例。无新增死亡病例。截至2月29日24时，黑龙江省报告新型冠状病毒肺炎现有治愈出院病例330例，其中：哈尔滨市123例、绥化市35例、双鸭山市36例、齐齐哈尔市33例、鸡西市31例、大庆市17例、佳木斯市15例、七台河市13例、黑河市11例、牡丹江市9例、鹤岗市4例、大兴安岭地区2例、伊春市1例。现有确诊病例137例，其中：哈尔滨市71例、鸡西市15例、双鸭山市13例、齐齐哈尔市9例、大庆市8例、绥化市8例、牡丹江市5例、七台河市4例、黑河市3例、鹤岗市1例。现有重症病例54例。无疑似病例。死亡确诊病例13例。全省当日发热门诊诊疗人数1695人。目前追踪到密切接触者16210人，已解除医学观察15458人，尚有623人正在接受医学观察。
2020年03月01日,山东无新增新冠肺炎确诊病例 累计确诊756例_荔枝网新闻,荔枝新闻,trog荔枝新闻讯trog据山东省卫生健康委员会通报，2月29日12-24时，山东省无新冠肺炎疑似病例；无新增确诊病例，累计确诊病例756例(其中，重症病例8例，危重症病例2例，死亡病例6例)；新增治愈出院14例，累计治愈出院431例。截至目前，追踪到密切接触者16852人，已解除医学观察15781人，诊断为疑似或确诊病例291例，尚有780人正在接受医学观察。详见下表(单位：例)：
2020年03月01日,贵州无新增新冠肺炎确诊病例 累计确诊146例_荔枝网新闻,荔枝新闻,trog荔枝新闻讯trog据贵州省卫生健康委员会通报，2020年2月29日12—24时，全省新型冠状病毒肺炎无新增确诊病例。截至2月29日24时，全省累计报告新型冠状病毒肺炎病例146例。其中，51例有武汉旅居史，14例有武汉外湖北其他地区旅居史，15例有湖北以外地区旅居史；治愈出院112例，在院治疗32例（轻症及普通型29例，重症1例，危重症2例），死亡2例；男性74例，女性72例；年龄最大87岁，最小1个月（确诊时间）；贵阳市36例（治愈27例，死亡1例），遵义市32例（治愈19例），六盘水市10例（治愈8例,死亡1例），安顺市4例(治愈4例），毕节市23例（治愈15例），铜仁市10例（治愈10例），黔东南州10例（治愈10例），黔南州17例（治愈15例），黔西南州4例（治愈4例）。现有疑似病例1例。累计追踪密切接触者2574人，已解除医学观察2465人，尚在接受医学观察37人。注：媒体引用时，请标注“信息来自贵州省卫生健康委员会官方网站”。
2020年03月01日,湖南无新增确诊病例累计1018例 新增出院12例_荔枝网新闻,荔枝新闻,trog荔枝新闻讯trog据湖南省卫生健康委员会通报，2020年2月29日0一24时，湖南省报告新型冠状病毒肺炎新增确诊病例0例，新增重症病例0例，新增死亡病例0例，新增出院病例12例。其中：新增出院病例中，长沙市4例、衡阳市2例、湘潭市1例、岳阳市1例、益阳市1例、郴州市1例、娄底市2例。截至2月29日24时，湖南省累计报告新型冠状病毒肺炎确诊病例1018例，累计报告重症病例147例，现有重症病例18例，死亡病例4例，出院病例853例，在院治疗161例。其中：确诊病例中，长沙市242例、衡阳市48例、株洲市80例、湘潭市36例、邵阳市102例、岳阳市156例、常德市82例、张家界市5例、益阳市60例、郴州市39例、永州市44例、怀化市40例、娄底市76例、湘西自治州8例。现有重症病例中，长沙市6例、株洲市4例、邵阳市2例、常德市2例、益阳市1例、娄底市3例。死亡病例中，长沙市2例、邵阳市1例、岳阳市1例。出院病例中，长沙市178例、衡阳市46例、株洲市62例、湘潭市34例、邵阳市95例、岳阳市115例、常德市72例、张家界市5例、益阳市59例、郴州市35例、永州市42例、怀化市40例、娄底市62例、湘西自治州8例。目前追踪到密切接触者26892人，已解除医学观察26491人，尚有401人正在接受医学观察。
2020年03月01日,多部门联动，扬州广陵真实“再现”疫情防控大场景……_荔枝网新闻,荔枝新闻,当下，新冠肺炎疫情拐点还没有真正来到，个别地区疫情依然严重。尽管大多数地区疫情趋于平稳缓和，但越是这个时候，头脑越要清醒，越要防止出事。今天下午4点半，扬州市广陵区专门针对新冠肺炎疫情防控启动应急演练。记者现场见证和记录了演练的全过程。“报告区新冠肺炎防控指挥部，我单位一名员工，系外省回扬人员，出现发热、咳嗽等症状，已被隔离至单位隔离观察室，请求给予进一步排查。”指挥部随即要求这个工厂启动应急预案，暂时停工，关闭厂门，禁止出入。演练现场，急救中心接到指令后，派遣急救转运人员穿着二级个人防护装备，在企业人员指引下，把可疑病例转到负压救护车，驶离企业。“立即启动流调工作，防止疫情蔓延和传播。”指挥部再次发出指令后，记者看到，在演练现场，公安封控现场，街道社区参与排查，全车间56人中52人集中居住厂集体宿舍。随后，疾控中心工作人员对可能污染区域消毒处理，对救护车及其他可能污染区域消毒处理……现场演练中，从“疫情”的发现和报告、病例转运、现场处置、采样与送检、消毒处置到流行病学调查完成与报告、卫生监督执法以及密切管理、医学观察人员等10多个环节逐一进行，各小组配合默契，防控秩序井然，很好地控制住了“疫情”蔓延。扬州市卫健委主任赵国祥现场观摩后表示，这场演练选题精准，要素完整，注重实战，演练全流程呈现了企业突发疫情的应急处置经过，信息报告、指挥运转、医疗救治、现场处置、流调隔离、场所消毒等情景设置科学合理，演练过程很好地体现了突发公共卫生事件应急管理的原则和要求，把“早发现、早报告、早隔离、早治疗”的“四早”原则贯穿始终。扬州市广陵区区委书记、区新冠肺炎防控指挥部总指挥潘学元接受记者采访时表示，当天的演练达到了预期的效果，当下，抗役阻击战尽管取得了很大的成绩，但成绩只能说明过去，要取得彻底胜利，还需要咬紧牙关，忍耐坚持。“打好疫情防控阻击战，同时，要牢牢抓好安全生产工作，做到两手抓、两促进。”广陵区区长徐长金说。对于当下的疫情防控，此前，扬州大学文学院特约研究员李广春在《瞭望》客户端撰文指出，在疫情防控与统筹发展之间的多项选择题中，全答对，才算对。地方政府应科学研判，精准防控，学会“戴着口罩”抓发展，善于化危为机，勇于迎难而上，敢于与时间赛跑，把失去的损失夺回来。要尊重企业家的主体地位，对出台的惠企政策不开空头支票，把为企业解决困难作为分内事，积极为企业在资金融通、人才招聘、要素调配、货物出关、安全生产、职工生活、防护措施落实等方面提供全方位的服务。要做有情的“店小二”，真正让工地火起来，机器转起来，交通畅起来，城市活起来，不让人民群众的美好生活因暂时的疫情而窘迫。 （来源：江苏广电扬州中心站王泽坤通讯员广宣张丽编辑俞思琼）
2020年03月01日,四川无新增新冠肺炎确诊病例 新增出院病例13例_荔枝网新闻,荔枝新闻,trog荔枝新闻讯trog据四川省卫生健康委员会通报，2月29日0-24时，四川省新型冠状病毒肺炎无新增确诊病例，新增治愈出院病例13例，新增疑似病例1例，无新增死亡病例。截至3月1日0时，我省累计报告新型冠状病毒肺炎确诊病例538例，涉及21个市（州）。全省现有无现症病例区（低风险县&lt;市、区&gt;）123个、散发病例区（中风险县&lt;市、区&gt;）59个、社区暴发和局部流行区（高风险县&lt;市、区&gt;）1个（过去24小时全省183个县&lt;市、区&gt;疫情分区分级情况较前一日无变化）。538名确诊患者中，正在住院隔离治疗172人（其中危重5人），已治愈出院363人，死亡3人。现有疑似病例15例。当日解除医学观察96人，现有1081人正在接受医学观察。
2020年03月01日,陕西无新增确诊病例累计245例 无新增疑似病例_荔枝网新闻,荔枝新闻,trog荔枝新闻讯trog据陕西省卫生健康委员会通报，2020年2月29日8时至3月1日8时，陕西无新增新冠肺炎确诊病例，新增疑似病例0例。截至3月1日8时，陕西累计报告新冠肺炎确诊病例245例（207例治愈出院，1例死亡），其中输入性病例116例，密切接触者114例，无明确接触史病例15例。累计确诊病例中，西安市120例、宝鸡市13例、咸阳市17例、铜川市8例、渭南市15例、延安市8例、榆林市3例、汉中市26例、安康市26例、商洛市7例、杨凌示范区1例，韩城市1例。全省现有疑似病例0例。全省新增密切接触者7人，累计18933人，均集中医学观察。新增解除密切接触者587人，累计解除密切接触者17548人。
2020年03月01日,海南无新增确诊病例累计168例 新增治愈12例_荔枝网新闻,荔枝新闻,trog荔枝新闻讯trog据海南省卫生健康委员会通报，2月29日0—24时，海南省报告新冠肺炎新增确诊病例0例，新增重症病例0例，新增死亡病例0例，新增出院病例12例。新增出院病例中，海口市2例、三亚市7例、保亭县2例、昌江县1例。截至2月29日24时，海南省累计报告新冠肺炎确诊病例168例，重症病例2例，死亡病例5例，出院病例148例。确诊病例中，海口市39例、三亚市54例、儋州市15例、文昌市3例、琼海市6例、万宁市13例、东方市3例、澄迈县9例、临高县6例、昌江县7例、陵水县4例、定安县3例、保亭县3例、乐东县2例、琼中县1例。截至2月29日24时，追踪到密切接触者6199人，已解除医学观察5886人，尚有313人正在接受集中医学观察。
2020年03月01日,3月1日最新发布：2月29日江苏无新增新型冠状病毒肺炎确诊病例_荔枝网新闻,我苏网,trog我苏网讯trog 据江苏省卫健委3月1日权威发布，2020年2月29日0-24时，江苏省无新增新型冠状病毒肺炎确诊病例。新增出院病例10例。截至2月29日24时，江苏省累计报告新型冠状病毒肺炎确诊病例631例。其中，南京市93例、无锡市55例、徐州市79例、常州市51例、苏州市87例、南通市40例、连云港市48例、淮安市66例、盐城市27例、扬州市23例、镇江市12例、泰州市37例、宿迁市13例。累计确诊病例中，在院病例102例。其中，轻型病例9例；普通型病例90例；重型病例1例（南京市1例）；危重型病例2例（无锡市1例、连云港市1例）。出院病例529例。其中，南京市58例、无锡市49例、徐州市71例、常州市48例、苏州市64例、南通市37例、连云港市37例、淮安市55例、盐城市27例、扬州市23例、镇江市11例、泰州市37例、宿迁市12例。目前，江苏省追踪到密切接触者12633人，已解除医学观察12503人，尚有130人正在接受医学观察。专家提醒：当前疫情形势依然严峻复杂。随着我省响应级别调整，各项限制性措施逐步解除，人群流动将逐渐恢复常态，暴露于传染源的机会大大增加，公众仍须注意加强自我防护。要继续保持防范意识，减少社会交流活动，减少不必要的人群聚集；家庭及办公场所要勤通风；出行时佩戴口罩，尤其是去往人群密集的公共场所时；要勤洗手，注意饮食卫生，养成健康的生活方式。（来源：健康江苏）
2020年03月01日,易方达基金范冰：黄金仍是资产配置重要一环_荔枝网新闻,中国证券报,2月20日以来，美股以及全球股市出现大幅下跌，在本轮美股下跌中，黄金先涨后跌，本周与标普500指数一起走弱。对此，易方达基金经理范冰2月29日表示，美股在大幅回调后可能企稳，黄金也大概率随之迎来反弹，黄金仍是资产配置中重要的一环。范冰分析，美股断崖式下跌背后的主要原因是：大跌之前，美股估值从各个维度看都处于历史高位；最新的财报显示标普500指数整体盈利很可能没有增长；新冠肺炎疫情在全球范围内的蔓延；被动式投资应对赎回的压力以及算法交易，增大了下跌动能，加剧了抛压。作为传统的避险工具，在本轮美股下跌中，黄金的走势一波三折，先涨后跌，本周更是与标普500指数一起走弱。分析过去20年美股的几次大跌，范冰指出，美股快速下跌时波动率都是同步拉升，但美元指数和黄金并不完全与美股同步，而黄金更多的是与美元指数负相关。他表示，本次美股大跌，黄金的表现与2008年金融危机期间的金价表现类似，在危机爆发时金价大涨，但是随着美股的深跌，黄金价格也出现了明显回调，当黄金的超买遇到了美股的超卖，投资人不得不了结黄金的头寸，来应对股票头寸的流动性紧张。其他主要经济体由于新冠肺炎疫情造成的需求放缓，作为经济活动的风向标，布伦特原油跌破50美元，美油更是跌破45美元，拉低了对通胀的预期，进一步影响到金价。范冰认为，如果判断新冠肺炎疫情蔓延对全球的冲击烈度不会高于2008年金融危机，美国经济短期不会进入全面衰退，则美股在大幅回调后可能企稳，黄金也大概率随之迎来反弹。中长期看，全球货币宽松及债务的不断增加、美元和美国实际利率的走弱、全球地缘政治等因素，仍将利好黄金，使之成为资产配置中重要的一环。
2020年03月01日,福建无新增新冠肺炎确诊病例 新增治愈出院病例2例_荔枝网新闻,荔枝新闻,trog荔枝新闻讯trog据福建省卫生健康委员会通报，2月29日0—24时，福建省报告新增新型冠状病毒肺炎确诊病例0例，新增治愈出院病例2例。报告新增新型冠状病毒肺炎疑似病例0例。截至2月29日24时，福建省累计报告新型冠状病毒肺炎确诊病例296例（危重型1例、重型1例，死亡病例1例）。其中：福州市72例（鼓楼区2例、仓山区10例、晋安区11例、长乐区8例、闽侯县4例、连江县8例、罗源县1例、闽清县7例、永泰县2例、福清市16例、宁德市古田县1例、湖北省武汉市2例）；厦门市35例（思明区13例、海沧区2例、湖里区3例、集美区4例、翔安区3例、泉州市石狮市1例、湖北省武汉市9例）；漳州市20例（芗城区9例、龙文区1例、云霄县2例、诏安县2例、长泰县3例、东山县1例、南靖县1例、龙海市1例）；泉州市47例（鲤城区1例、丰泽区4例、洛江区1例、惠安县2例、安溪县2例、永春县2例、石狮市2例、晋江市20例、南安市13例）；三明市14例（三元区2例、宁化县1例、尤溪县2例、沙县5例、将乐县1例、永安市3例）；莆田市56例（城厢区31例、涵江区3例、荔城区8例、秀屿区6例、湄洲湾北岸3例、仙游县5例）；南平市20例（延平区4例、建阳区1例、顺昌县1例、浦城县1例、光泽县1例、松溪县5例、政和县1例、武夷山市3例、建瓯市2例、湖北省孝感市1例）；龙岩市6例（永定区5例、武平县1例）；宁德市26例（蕉城区3例、霞浦县4例、古田县11例、周宁县6例、福安市1例、福鼎市1例）。累计治愈出院病例243例，目前住院病例52例。现有报告新型冠状病毒肺炎疑似病例0例。目前，确诊、疑似病例的密切接触者已解除医学观察10664人，尚有260人正在接受医学观察。
2020年03月01日,河南无新增确诊病例累计1272例 新增死亡1例_荔枝网新闻,荔枝新闻,trog荔枝新闻讯 trog据河南省卫生健康委员会通报，2020年2月29日0-24时，河南省无新增新型冠状病毒肺炎确诊病例,新增出院24例、死亡1例。截至2月29日24时，全省累计报告新型冠状病毒肺炎确诊病例1272例，现有重症病例7例，现有危重病例4例，累计死亡病例22例，累计出院病例1185例。其中：确诊病例中，信阳市274例（含固始县31例）、郑州市157例（含巩义市9例）、南阳市156例（含邓州市17例）、驻马店市139例（含新蔡县10例）、商丘市91例（含永城市14例）、周口市76例（含鹿邑县7例）、平顶山市58例（含汝州市1例）、新乡市57例（含长垣市13例）、安阳市53例（含滑县2例）、许昌市39例、漯河市35例、焦作市32例、洛阳市31例、开封市26例（含兰考县5例）、鹤壁市19例、濮阳市17例、三门峡市7例、济源示范区5例。目前累计追踪到密切接触者39199人，2月29日已解除观察226人，共有1328人正在接受医学观察。
2020年03月01日,内蒙古无新增确诊病例新增出院5例 累计确诊75例_荔枝网新闻,荔枝新闻,trog荔枝新闻讯trog据内蒙古自治区卫生健康委员会通报，2020年2月29日7时至3月1日7时，内蒙古自治区报告无新增新冠肺炎确诊病例，无新增疑似病例，确诊病例新增出院5例，疑似病例新增出院6例。确诊病例新增出院5例为通辽市的霍林郭勒市1例、锡林郭勒盟锡林浩特市1例、鄂尔多斯市达拉特旗1例、呼伦贝尔莫力达瓦旗1例、巴彦淖尔市乌拉特中旗1例；疑似病例新增出院6例为呼伦贝尔莫力达瓦旗2例、海拉尔区1例，呼和浩特市回民区1例，锡林郭勒盟多伦县1例，通辽市库伦旗1例。截至3月1日7时，内蒙古自治区累计报告新冠肺炎确诊病例75例，现存确诊病例24例，出院病例51例，重症病例2例，危重病例3例。其中，现存确诊病例24例为：1.锡林郭勒盟6例（锡林浩特市2例、多伦县4例）2.包头市5例（土默特右旗4例、昆都仑区1例）3.通辽市的霍林郭勒市4例4.呼和浩特市3例(玉泉区2例、赛罕区1例)5.呼伦贝尔市莫力达瓦旗2例6.巴彦淖尔市临河区1例7.鄂尔多斯市达拉特旗1例8.乌兰察布市化德县1例9.赤峰市翁牛特旗1例出院病例51例为：1.鄂尔多斯市10例（东胜区1例、鄂托克前旗1例、达拉特旗8例）2.赤峰市8例（松山区2例、元宝山区2例、红山区1例、林西县1例、翁牛特旗2例）3.巴彦淖尔市7例（乌拉特中旗4例、五原县2例、临河区1例）4.包头市6例（昆都仑区2例、东河区1例、土右旗3例）5.呼伦贝尔市5例（满洲里市1例、牙克石市1例、莫力达瓦旗3例）6.呼和浩特市4例（新城区2例、玉泉区1例、回民区1例）7.锡林郭勒盟3例（锡林浩特市2例、二连浩特市1例）8.通辽市3例（经济开发区1例、霍林郭勒市2例）9.乌海市海勃湾区2例10.乌兰察布市2例（四子王旗1例、化德县1例）11.兴安盟乌兰浩特市1例重症病例2例（包头市土右旗1例，呼伦贝尔市莫力达瓦旗1例）；危重病例3例（包头市昆都仑区1例，锡林郭勒盟锡林浩特市1例，巴彦淖尔市临河区1例）。疑似病例4例（呼伦贝尔市莫力达瓦旗2例、包头市土默特右旗1例、通辽市的霍林郭勒市1例）。均在定点医院接受隔离治疗。目前，尚在接受医学观察的密切接触者160人。当日解除医学观察5人。
2020年03月01日,天津无新增确诊病例累计136例 新增出院4例_荔枝网新闻,荔枝新闻,trog荔枝新闻讯trog据天津市卫生健康委员会通报，2020年2月29日0－24时，天津市报告新型冠状病毒肺炎新增确诊病例0例，新增危重型病例0例，新增重型病例0例，新增死亡病例0例，新增治愈出院病例4例。截至2月29日24时，天津市累计报告新型冠状病毒肺炎确诊病例136例，出院病例109例，死亡病例3例。现有在院治疗确诊病例24例（危重型病例1例，重型病例5例）。其中：确诊病例中，宝坻区60例、河东区15例、河北区12例、和平区6例、南开区6例、北辰区6例、河西区4例、宁河区4例、东丽区4例、西青区4例、滨海新区3例、红桥区2例、武清区2例、津南区2例、外地来津6例；出院病例中，宝坻区45例、河东区11例、河北区10例、和平区5例、北辰区5例、河西区4例、南开区4例、西青区4例、东丽区4例、滨海新区3例、宁河区3例、红桥区2例、武清区2例、津南区1例、外地来津6例。目前追踪到密切接触者2278人，已解除医学观察1893人，尚有339人正在接受医学观察。
