2020年03月01日,美首报死亡病例 意大利确诊破千_荔枝网新闻,新华国际 ,新冠肺炎疫情近日继续在一些国家蔓延，爱尔兰、卢森堡、厄瓜多尔和卡塔尔四国首次出现确诊病例，意大利2月29日报告该国确诊病例数突破千例。trog四国首现确诊感染病例trog爱尔兰卫生部2月29日首次报告了该国首例确诊病例，这是一名曾去过意大利的男性，爱尔兰有关部门表示正在调查其密切接触者。同在欧洲的卢森堡也于2月29日报告该国首例确诊病例，这名患者也曾去过意大利旅行，目前在医院接受隔离治疗，其家人目前无症状，但也已隔离。厄瓜多尔卫生部2月29日宣布确诊首例新冠病毒感染病例，这名70岁女性患者2月14日从西班牙首都马德里返回厄第一大城市瓜亚基尔，目前病情危重。卡塔尔卫生部2月29日宣布，一名从伊朗回国的卡塔尔男性公民被确认为该国首例新冠病毒感染病例。trog欧洲：意大利病例数破千trog意大利公民保护部部长、新冠病毒应急委员会专员安杰洛·博雷利表示，截至2月29日18时，意大利现有病例数为1049例，其中约52%属于无症状或症状轻微的居家隔离患者，105例为重症病例。如果加上此前已治愈或死亡的病例，意大利累计确诊病例总数达1128例。意大利已对北部出现至少一例确诊病例的城镇采取了封闭措施。法国卫生部门报告，截至2月29日18时，全国共累计报告100例新冠病毒感染病例，其中12例已被治愈，2例死亡。法国总统马克龙当天就疫情召开紧急部长会议，决定加强疫情较严重地区的防控措施，在法国全境暂时取消所有“在密闭环境中聚集超过5000人以上的集会活动”以及部分室外活动。英国卫生部门2月29日表示，英国新增3例新冠病毒感染病例，累计确诊病例达到23例。奥地利确诊病例2月29日上升到10例，总理库尔茨原定访美行程被推迟。希腊2月29日晚宣布新增3例确诊病例，全国共有7例确诊病例。截至2月29日，罗马尼亚报告已发现3例新冠病毒感染病例。格鲁吉亚2月29日报告当天确诊第3例病例。德国截至2月29日晚10时当日新增病例超过40例，累计确诊病例已超过110例。德国卫生部长延斯·施潘当天在社交媒体推特上说，鉴于欧洲多国在过去几天内疫情“发生明显变化”，欧盟各国卫生部长将于下周开会讨论采取联合行动。trog亚洲：韩国累计确诊3736例trog韩国疾病管理本部3月1日发布最新统计数据显示，韩国新增确诊210例，新增死亡1例，累计确诊3736例，累计治愈30例。新增确诊患者中136例在大邱市，41例在庆尚北道。日本2月29日报告新增确诊病例8例，国内累计病例241例。加上“钻石公主”号邮轮乘客、船员确诊病例705例，病例总数达946例，共11人死亡，另有56人重症。日本首相安倍晋三当晚在记者会上说，将利用超过2700亿日元（约合175亿元人民币）的本年度预备经费，在今后10天左右推出第二轮紧急对策。伊朗卫生部门2月29日宣布，确诊病例数升至593例，其中43人死亡，123人被治愈。伊拉克卫生部2月29日说，当日新增5例病例，确诊总数达13例。黎巴嫩卫生部2月29日宣布，当天新增3例病例，总数达7例。trog澳大利亚：首例死亡病例trog在澳大利亚，一名新冠病毒感染者当地时间3月1日凌晨在西澳大利亚州珀斯一家医院去世，这是澳大利亚首例死亡病例。据西澳州首席卫生官安德鲁·罗伯逊介绍，该患者是一名78岁男性，此前和妻子一起从“钻石公主”号邮轮上被撤离。此外，新南威尔士州29日新增1例确诊病例，澳大利亚确诊病例总数达26例。trog美洲：美国首次公布死亡病例trog美国华盛顿州卫生官员2月29日说，该州一名新冠病毒感染病例死亡。这是美国首次公布新冠病毒感染死亡病例。华盛顿州当天宣布进入“紧急状态”并称将动用一切必要资源应对疫情。美国副总统彭斯2月28日说，美方已确诊61例新冠病毒感染病例。加拿大卫生部2月29日报告，当天又确诊4例病例，全国累计确诊病例20例。墨西哥卫生部2月29日说，当天新增1例确诊病例，目前已确诊4例。巴西卫生部2月29日说出现第2例确诊病例。另据当地媒体报道，巴西阿道弗·卢茨研究所等机构对巴西首例确诊病例身上的病毒进行了基因组测序，发现有一些地方与在武汉发现的病毒不同。研究人员说，巴西首个病例是从意大利返回巴西的，而他身上的病毒与在德国发现的病毒也有所不同。
2020年03月01日,香港新增1例新冠肺炎确诊病例 累计确诊95例_荔枝网新闻,央视新闻,3月1日，香港特区政府举行例行发布会，通报香港新冠肺炎疫情的最新变化。截至1日下午16点30分，香港新增1例确诊病例，为女患者，71岁，曾去过日前已爆出多例确诊病例的北角一佛堂“福慧精舍”。另有2例疑似病例，均为此前“钻石公主”号邮轮的返港旅客。截至目前，香港累计确诊病例95例，治愈病例33例。
2020年03月01日,文在寅呼吁跨国合作应对新冠肺炎疫情_荔枝网新闻,新华网,新华社首尔3月1日电 韩国总统文在寅1日在首尔发表纪念“三一运动”101周年讲话时表示，为应对当前不断扩散的新冠肺炎疫情，韩国应与朝鲜、中国、日本以及东南亚各国携手合作，共克时艰。文在寅呼吁全体国民相互信任和鼓励，用团结的力量克服困难，战胜新冠肺炎疫情，进一步振兴韩国经济。文在寅表示，当今世界面对越来越多的非传统安全威胁因素，如灾害、气候变化、传染病蔓延、国际恐怖主义和网络犯罪等，仅凭一国之力很难解决。“这次新冠肺炎疫情扩散，使我们再次迫切体会到需要进行跨国合作。”在谈到韩日关系时，文在寅强调，韩国不会忘记过去，但也不会拘泥于过去，希望日本也秉持这一态度。“以史为鉴，携手共进，（这）将是东亚和平与繁荣之路。让我们努力共克危机，建立面向未来的合作关系。”日本在1910年到1945年间对朝鲜半岛实施殖民统治。1919年3月1日，朝鲜半岛爆发了反抗日本殖民统治的“三一运动”。1949年，韩国政府将3月1日定为国家法定纪念日。
2020年03月01日,2名韩国艺人随行人员米兰时装周归来后被确诊 宋慧乔、IU都去过_荔枝网新闻,环球网,据韩国纽西斯通讯社1日报道，2名和韩国女歌手金请夏一起前往意大利米兰的工作人员被确诊感染新冠肺炎。据韩媒报道，韩国包括宋慧乔、韩艺瑟、李知恩（IU）、朴敏英等在内的众多艺人都曾参加该时装周。金请夏所属的MNH娱乐公司1日发表声明称，金请夏病毒检测呈阴性，但与其一起前往意大利米兰的2名工作人员被确诊。金请夏和另外一些相关工作人员，已经按照韩国疾病管理本部的要求进行居家隔离。韩联社称，金请夏2月19日前往米兰，并于当月24日返回韩国。出国时，意大利仅有3例新冠肺炎确诊病例，但此后疫情在该国迅速蔓延。韩国“ew1”新闻网站介绍，米兰时装周是国际四大著名时装周之一。除了金请夏之外，宋慧乔、韩艺瑟、李知恩（IU）、朴敏英等众多韩国艺人也出席了该时装周。此外，还有韩国时装业从业者、经纪公司工作人员和记者等前往米兰参加时装周。而在韩国娱乐圈，新冠肺炎带来的恐慌还不止在出席过米兰时装周的人中间蔓延。韩国媒体OSEN3月1日报道称，韩国演员金泰熙主演的电视剧《你好再见,妈妈》剧组中一名工作人员疑似感染新冠肺炎，目前正居家隔离等待检测结果。报道称，如果其被确诊，很可能出现集体感染事件。截至29日17时（北京时间3月1日0时），意大利共计确诊新型冠状病毒肺炎病例1128例，较前一天增加240例。此次意大利新冠肺炎疫情核心区即为米兰所在的伦巴第大区。而韩国本国的情况更加严峻。韩国中央防疫对策本部3月1日通报，截至当地时间1日下午4时，韩国较上午9时新增210例新冠肺炎确诊病例，累计确诊病例达3736例。
2020年03月01日,贵州无新增确诊病例 全省累计确诊146例_荔枝网新闻,荔枝新闻,trog荔枝新闻讯trog据贵州卫健委消息，2020年3月1日0—12时，贵州省新型冠状病毒肺炎无新增确诊病例。截至3月1日12时，全省累计报告新型冠状病毒肺炎病例146例。其中，51例有武汉旅居史，14例有武汉外湖北其他地区旅居史，15例有湖北以外地区旅居史；治愈出院112例，在院治疗32例（轻症及普通型29例，重症1例，危重症2例），死亡2例；男性74例，女性72例；年龄最大87岁，最小1个月（确诊时间）；贵阳市36例（治愈27例，死亡1例），遵义市32例（治愈19例），六盘水市10例（治愈8例,死亡1例），安顺市4例(治愈4例），毕节市23例（治愈15例），铜仁市10例（治愈10例），黔东南州10例（治愈10例），黔南州17例（治愈15例），黔西南州4例（治愈4例）。现有疑似病例1例。累计追踪密切接触者2574人，已解除医学观察2465人，尚在接受医学观察37人。注：媒体引用时，请标注“信息来自贵州省卫生健康委员会官方网站”。
2020年03月01日,涉案超百万只！江苏盐城警方捣毁制售假口罩窝点_荔枝网新闻,江苏广电融媒体新闻中心,近日，江苏盐城警方重拳出击，抽调精干力量组成17支抓捕组，历时10余天奋力侦查，挖出一个跨河南、山东等地的制假团伙，抓获犯罪嫌疑人58名。在这次疫情期间，盐城发生多起群众举报，市场上有人销售假冒伪劣的一次性医用口罩。盐城市公安局亭湖分局刑警大队民警董晖介绍案情，经侦查比对发现，该批一次性医用口罩，存在较高相似度，初步判断来自同一批货源。经缜密侦查，警方锁定并抓获市区多家售假门店的供货上线孙某、李某。并对涉案门店负责人统一收网，搜查扣押伪劣某品牌一次性医用口罩6000余只。后经专案组深挖，口罩生产于河南安阳滑县一小作坊。专案组的民警们克服疫情期间的困难，在河南安阳将小作坊老板叶某抓获，现场查扣口罩生产线三条。据叶某交代，2017年下半年，他从湖北省襄阳市购进两台口罩生产设备，还从同伙那买来仿制的某品牌外包装及产品合格证。盐城市公安局环境警察支队民警刘伟介绍，检验结果显示，这批口罩是不合格产品，其中的细菌过滤性测试显示为30%。这种问题口罩一旦流入市场，对当前流行的新冠肺炎起不到任何的防护作用。经调查，该团伙共销售假冒口罩100余万只，涉案金额50余万元。目前，该案58名犯罪嫌疑人已被采取刑事强制措施，其中17人被警方依法刑拘。该案正在进一步侦查中。江苏广电融媒体新闻中心记者虞根网赵凌翔编辑胡超（本条新闻版权归江苏省广播电视总台所有，转载请注明出处）
2020年03月01日,北京新增2例确诊病例均自伊朗入境 不涉及京内居民小区_荔枝网新闻,荔枝新闻,trog荔枝新闻讯 trog据北京市疾控中心微信公众号消息，2月29日，北京市新增2例新冠肺炎确诊病例，均为自伊朗入境的密切接触人员，入境后即进行严格的管控，并在医疗机构进行检查确认，不涉及京内居民小区。3月1日下午，在北京市新冠肺炎疫情防控工作新闻发布会上，北京市疾病预防控制中心副主任庞星火介绍了两例境外输入新冠肺炎病例的相关情况，2月29日，北京市报告2例自伊朗入境的新冠肺炎确诊病例，均为2月26日宁夏确诊病例丁某某在伊朗期间的密切接触者。现将有关流行病学调查情况介绍如下：马某某，男，27岁，户籍甘肃。2月18日在伊朗参加一个同学聚餐，确诊病例丁某某也参加了该聚餐。2月25日在伊朗出现症状。2月26日从伊朗出发，经莫斯科转机，2月27日9:50抵京。乘机场大巴抵达北京西站南广场，随即相关人员抵达现场，采取管控措施后转至集中医学观察点隔离观察。2月28日，采集咽拭子标本，检测结果为新型冠肺炎核酸阳性，当日23：00转至定点医院隔离治疗。2月29日确诊，目前病情稳定。海某某，男，30岁，户籍甘肃。2月18日在伊朗与马某某参加同学聚餐，确诊病例丁某某也参加了该聚餐。2月27日在伊朗出现症状。2月28日从伊朗出发，经莫斯科转机，2月29日8:56抵京。随即被机场检疫部门用120救护车直接送至定点医院就诊。2月29日确诊，目前在定点医院隔离治疗，病情稳定。截至目前，2名确诊病例的所有密切接触者均已集中隔离医学观察。北京市疾控中心提示，鉴于境外部分国家疫情正处于上升期，无论身处国内或境外，都要关注卫生部门的健康提醒，不聚会，不聚餐，勤洗手，戴口罩，认真做好个人防护，减少感染机会。如接触了新冠肺炎病例，应向当地卫生部门报告，并就地进行健康观察和监测，不能乘坐公共交通工具旅行，避免对其他人员带来风险。
2020年03月01日,世卫总干事：控制疫情的“窗口期”在缩小_荔枝网新闻,中国日报,彭博社刚刚报道，在美国，澳大利亚和泰国分别出现新冠肺炎死亡病例后，世界卫生组织总干事谭德塞3月1日在沙特首都利雅得表示，控制疫情的“窗口期”在缩小。他称，市场无需感到恐惧和惊慌，疫情尚未构成全球性大流行。他还表示，不能放弃控制疫情的策略，在一些国家正在奏效。 
2020年03月01日,韩国一天增加新冠肺炎确诊病例586例 累计3736例_荔枝网新闻,海外网,据韩联社报道，韩国中央防疫对策本部通报，截至3月1日下午4时，韩国较当天上午9时新增新冠肺炎确诊病例210例，累计确诊病例达3736例。与前一天下午4时相比，一天内新增确诊病例586例，累计18人死亡。 
2020年03月01日,加拿大单日新增4例确诊病例 形势出现三特点_荔枝网新闻,中国新闻网,中新社多伦多3月1日电 加拿大安大略省和卑诗省(又译不列颠哥伦比亚省)卫生部门当地时间2月29日共宣布新增4名新冠肺炎确诊病例，这是加拿大迄今单日新增病例数最多的一天。该国累计确诊病例上升至20例。安大略省卫生部门在多伦多公布3例新增确诊病例。其中有两名分别为34岁和51岁的女性，近期先后从伊朗回到多伦多，在出现症状后就诊。另一病例为后者的丈夫，近期并无伊朗旅行史。三人均在接受病毒测试后返回居所进行隔离治疗。由于确诊的34岁女性在从伊朗德黑兰经卡塔尔多哈、丹麦哥本哈根飞至多伦多的旅途中未戴口罩，卫生部门公布了她所搭乘的航班及巴士的信息，呼吁可能涉及的人士与公共卫生部门联系。卑诗省的新增病例为一名近期从伊朗德黑兰抵达温哥华地区的六旬女性。她目前也在居所接受隔离治疗。trog近期加拿大的新冠病毒确诊感染病例情况出现三方面特点。trogtrog其一，trog感染病例确诊数字增速上升，确诊频率有所加快。自1月25日安大略省发现加拿大首例感染病例后，至1月底共确诊4例。2月前20天只增加了4例，增幅略放缓。但2月21日至29日，共增加12例，且26日以来已连续4天报告新增病例。trog其二，trog报告确诊病例的地区有所增加。虽大部分病例出现在安大略省和卑诗省，但魁北克省于2月27日也首度报告感染病例。trog其三，trog患者旅行史涉及的地区扩大。前期病例近期旅行史基本都涉及中国湖北武汉，或与相关人士有密切接触，此类病例目前共8例。自2月21日以来，新增病例大多近期有伊朗旅行史，或为相关人士的密切接触者。28日出现首位近期旅行史为埃及的感染病例。尽管加拿大联邦及出现确诊病例的省市的卫生部门都表示，新冠病毒目前传播风险仍较低，但多位联邦或省级卫生官员近日坦言，卫生和疾控部门正为可能出现的病毒大流行作准备。加拿大迄今累计确诊的20例病例中，安大略省有11例，其中3例康复；卑诗省8例，该省卫生部门29日宣布已累计有4名患者治愈；魁北克省1例。目前加拿大没有死亡病例。(完)
2020年03月01日,成都发布最新疫情分区分级图：高新区由中风险降为低风险_荔枝网新闻,每日经济新闻,据成都市卫健委消息，2月29日，成都市无新增新冠肺炎确诊病例，无新增出院人数。据通报中发布的成都市区（市）县疫情分区分级地图来看，较之前日相比，截至2月29日24时，成都市高新区由中风险区变为低风险区。目前，成都全市无高风险区。根据最新的疫情分区分级地图，低风险区有成都市青羊区、高新区、金牛区、成华区、青白江区、龙泉驿区、天府新区、双流区、蒲江县、新津县、崇州市、都江堰市、彭州市13地。中风险区有成都市锦江区、武侯区、温江区、郫都区、新都区、金堂县、简阳市、大邑县、邛崃市9地。
2020年03月01日,山东3月1日最新通报：新增2例新冠肺炎确诊病例 新增出院8例_荔枝网新闻,荔枝新闻,trog荔枝新闻讯trog 据山东省卫健委网站消息，2020年3月1日0-12时，山东省无新冠肺炎疑似病例；新增确诊病例2例（均为集中隔离观察的无症状感染者，经核酸和CT等检查确诊），累计确诊病例758例（其中，重症病例8例，危重症病例2例，死亡病例6例）；新增治愈出院8例，累计治愈出院439例。截至目前，追踪到密切接触者16872人，已解除医学观察15968人，诊断为疑似或确诊病例291例，尚有613人正在接受医学观察。
2020年03月01日,韩专家预测最糟糕情况：韩国40%人口被感染，疫情持续到年末_荔枝网新闻,环球网,【环球网综合报道】“最糟糕的情况是，全国40%的人口可能会被感染（新冠肺炎）。”“疫情可能会持续到今年年底”。2月28日，韩国首尔大学医院感染内科教授崔平均（音）在当天的一次座谈会上作出上述发言。据韩联社报道，韩国在野党未来统合党28日举行的疫情相关座谈会上，该党一名议员提问：患者剧增的现象是否会在首都圈出现，这种情况会持续到什么时候？崔平均表示这“很难预测”，因为这是人类无法免疫的病毒。根据以往经验，最糟糕的情况是，全国40%的人口可能会被感染。该议员又问“听说患者人数可能达万名”，崔平均表示，事实上，如果3月内疫情不能结束，全国40%的人口被感染，要做好疫情持续到年末的准备。韩国中央防疫对策本部3月1日通报，截至当地时间1日上午9时，韩国较前一天下午4时新增376例新冠肺炎确诊病例，累计确诊病例达3526例。截至目前，韩国累计死亡病例达18例。韩国新冠病毒确诊病例2月26日超过1000例，仅时隔三天便突破3000例。自1月20日境内首次出现确诊病例以来已过40天。
2020年03月01日,中国吸引投资的能力不会受疫情制约——访国际商会秘书长约翰·丹顿_荔枝网新闻,新华网,“新冠肺炎疫情对全球贸易及其供应链产生了直接影响，但疫情结束后，中国经济和全球经济将迎来复苏。从长远来看，中国吸引投资的能力不会受到疫情制约。”国际商会秘书长约翰·丹顿日前接受新华社记者采访时说。受疫情影响，中国部分企业暂时关闭，局部地区交通运输临时受阻。对此，丹顿表示，为防控疫情，这些措施显然必要。丹顿说，2003年“非典”疫情结束后，随着贸易和正常经济活动的恢复，中国和全球经济得到强劲复苏。“所以，我们有理由深信，一旦当前疫情结束，全球经济也将随之复苏。我们注意到，与当时情况有所不同的是，现在，中国作为全球价值链中的关键合作伙伴，已经更加融入全球经济。”丹顿认为，中国一直致力于投资技术和可持续发展，这有利于未来经济发展。近年来，中国在绿色技术和可再生能源领域的大力投入令人鼓舞。丹顿说，“当疫情得到控制时，中国经济活动将稳步恢复，投资者将可以在这些领域以及其他更多领域寻找商机”。丹顿说：“当前疫情并没有削弱国际商会与中国的银行业等开展合作的信心，我们赞赏中国政府为防止新冠病毒传播和治疗患者所做的努力。同时，我们也呼吁全球科学界和企业采取坚定、积极的行动支持中国。”他表示，作为一个全球性的经济联合会，国际商会正在寻求有效方法，充分利用国际商会全球网络，尽力为寻求减轻疫情影响的各方提供协助，国际商会愿与中国一起应对疫情挑战。丹顿日前向各国国际商会发表公开信说，全球工商界正在采取行动，支持中国政府和人民为应对新冠肺炎疫情做出的努力，国际商会对中国以及其他面临疫情挑战的国家和地区的工商界给予支持。国际商会成立于1919年，总部设在巴黎，目前已在全球设立了90多个国家和地区委员会，其主要职能包括制定国际商事规则、解决贸易争议和提出政策建议等。
2020年03月01日,武汉一新冠肺炎患者私自出院散步发视频炫耀后道歉_荔枝网新闻,红星新闻,videocotrol=""durtio="0"fbl=""oter="htt:ttic.jtv.comimg2020312020311583046054329_17436.g"rc="htt:vod.v.jtv.comvideo2020312020311583045970072_151_1247.m4"webkit-lyilie=""video近日，一男子自拍视频称自己是住院隔离人员，从医院跑出散步，溜出后不仅去药房买了一瓶84消毒液，还四处游走拍视频“炫耀”，称在家隔离的人都是“苕货”，怕死。视频在网络上传播后引起不少人恐慌。随后，该男子拍摄另一段视频向公众讲述事情经过并向公众道歉，称自己的行为给武汉的形象抹黑，表示病愈之后愿意接受法律的严惩。
2020年03月01日,WHO：至2月29日17时全球新冠肺炎共确诊85403例_荔枝网新闻,荔枝新闻,荔枝新闻讯据世卫组织官微消息，截止到中部欧洲时间2月29日上午10点（北京时间下午5点），全球共确诊85403例2019冠状病毒病病例（新增1753例）。其中中国共确诊79394例（新增435例），并有2838例死亡（新增47例）。中国以外国家和地区确诊6009例（新增1318例），并有86例死亡（新增19例）。共有53个国家报告有确诊病例（昨日新增2个国家——墨西哥、圣马力诺）。
2020年03月01日,全国首例！江苏成功开展新冠肺炎转阴患者双肺移植术_荔枝网新闻,江苏广电融媒体新闻中心,videocotrol=""durtio="0"fbl=""oter=""rc="htt:vod.v.jtv.comvideo2020312020311583043634939_67_1283.m4"webkit-lyilie=""video2020年2月29日，我囯著名肺移植专家、南京医科大学附属无锡市人民医院副院长陈静瑜教授团队，在无锡成功开展全国首例新冠肺炎转阴患者双肺移植手术。该患者男性，59岁，确诊为COVID-19危重型，经气管插管呼吸机应用+ECMO维持和药物治疗后，连续核酸检测呈阴性，但双肺已严重病变受损且不可逆转。2月24日，经省级专家讨论，有肺移植手术指征，即转无锡。在江苏省卫健委统筹和省级专家会诊评估指导下，无锡市卫健委整合全市医疗资源，充分做好各项术前准备。2月29日获取外地脑死亡患者爱心捐献的肺源，经6小时高铁转运至无锡，即在无锡市第五人民医院负压手术室进行手术。历时6个多小时，顺利完成双肺移植手术，患者于23:35安返病房。目前，该患者已清醒，双肺氧合功能良好，生命体征平稳。下一步还将开展移植后抗排异、抗感染等后续治疗。（来源：“陈静瑜肺腑之言”新浪微博、无锡台编辑：任思燕、刘瑷辉）
