2020年02月29日,关于疫情 世卫组织与联合国不约而同提到了这一点_荔枝网新闻,央视新闻客户端,当地时间28日，世卫组织在日内瓦召开新冠肺炎发布会，世卫组织总干事谭德塞宣布，鉴于目前新冠肺炎在全球多个国家蔓延，部分国家疫情严重，将新冠肺炎全球风险级别从此前的“高”提至最高级别“非常高”。古特雷斯呼吁各国政府都应该站出来，尽一切所能控制疫情，并避免歧视和维护人权。近日，丹麦，爱沙尼亚，立陶宛，荷兰和尼日利亚都上报了首例新冠肺炎病例，均与意大利有关。根据各国截至28日20时上报的数据，目前14个国家的24例新冠肺炎病例与意大利有关，11个国家的97例新冠肺炎病例与伊朗有关。疫情来势汹汹，人们却因恐惧忘却了理解与关爱。正如世界卫生组织的总结，现在最大的敌人不是病毒，而是恐惧、谣言和污名化。△世卫组织卫生紧急项目负责人迈克尔·瑞安：当然我们需要了解病毒的来源以便于控制它，避免其再度来袭，而不是去责怪谁，或是哪种可怜的动物的过错，动物没有错。我们要小心自己的语言，不幸的是，污名化的语言及指责成为全球描述（用语）的一部分其实无论是谭德塞还是古特雷斯的发言，都强调了两点。新冠肺炎疫情来势汹汹，危害全球各国。个别国家反应过度，让原本紧密联系的地球村因疫情相互远离。人与人之间开始因疫情，出现罅隙。因恐惧而生的歧视、污名化也层出不穷。正如谭德塞所说，全球疫情正处于“窗口期”，各国均采取积极措施应对。隔离、防控因此不可避免。但谭德塞与古特雷斯倡议的避免“歧视、谣言和恐惧”，与中国早先所倡议的“隔离，但不隔绝爱”异曲同工。△甘肃省中医药大学附属医院护士魏苗在隔离病房持续救治新冠肺炎患者8小时下班时出现脱水症状如谭德塞与古特雷斯所言，现在最大的敌人不是病毒，而是恐惧、谣言和歧视。中国作为国际抗“疫”的排头兵，已经得出了值得借鉴的经验。△29日发布的《中国-世卫组织联合考察报告》评价中国应对疫情所采取的措施为“历史上最勇敢、最灵活、最积极的防控措施”有理由相信，在世卫组织与联合国的正确倡导以及各国的努力下，这场针对新冠肺炎疫情的全球战“疫”，人类一定能够胜利！
2020年02月29日,日本东京天空树将于明日起暂停营业至3月15日_荔枝网新闻,央视新闻,央视新闻2月29日消息，东京天空树29日宣布，由于新冠肺炎感染范围扩大，东京天空树将从3月1日至15日临时停业。
2020年02月29日,钟南山领衔发表研究论文：不要误读潜伏期中最小最大值_荔枝网新闻,环球网,当地时间2月28日，由国家卫健委高级别专家组组长、中国工程院院士钟南山领衔的“中国2019新型冠状病毒疾病的临床特征”研究论文在顶级医学期刊《新英格兰医学杂志》（NEJM）上在线公开发表。该研究纳入了来自2019年12月11日至2020年1月29日来自全国31个省(市)共552家医院的1099例确诊新冠肺炎患者。该研究的作者共有37名，作者单位包括国家呼吸系统疾病临床医学研究中心、武汉市金银潭医院、华中科技大学同济医学院附属协和医院、广州医科大学第一附属医院胸肿瘤科、黄冈市中心医院、南方医科大学器官衰竭防治国家重点实验室、香港中文大学、中国医学科学院北京协和医学院、浙江大学医学院附属第一医院传染病诊治国家重点实验室等。钟南山为通讯作者，研究团队代表中国新冠肺炎医疗专家组。此前的当地时间2月9日，该论文在向《新英格兰医学杂志》投稿的同时，也同时在预印本网站medRxiv上率先公开（当时未经同行评议），并引起了广泛关注。该项研究显示，在1099例患者中，926例为非重症，173例为重症。重症患者的年龄比非重症患者大7岁（中位数）。此外，重症患者有合并症的情况（38.7%）比非重症患者（21.0%）常见。不过，重症患者和非重症患者的暴露史相似。研究得出的中位潜伏期为4天（四分位距，2-7），重度、非重度组新冠患者各有一例患者的潜伏期达24天。不过，团队认为，单纯根据最小、最大值评估人群的潜伏期容易引起误读。值得注意的是，入院时43.8%的患者有发热，但住院期间88.7%有发热。不发热的新冠肺炎患者比例高于SARS-CoV（1%）和MERS-CoV（2%）感染患者，因此如果监测病例的定义侧重于检测发热，则不发热的患者可能会被漏诊。相对于SARS-CoV和MERS-CoV，新冠病毒的致死率较低。研究团队在这项研究中确定的病死率为1.4%，低于近期其他团队报道的病死率。他们认为，原因很可能是样本量和病例纳入标准的差异。他们同时认为，由于轻症患者和未就医患者并未纳入本研究，因此真实的病死率可能更低。研究团队还强调，尽管新冠病毒和SARS-CoV具有种属相似性，但一些临床特征可以将新冠肺炎与SARS-CoV、MERS-CoV及季节性流感区分开来。trog不能排除“超级传播者”的存在trog研究团队获得了2019年12月11日至2020年1月29日期间国家卫健委收到的，经实验室确诊的新冠肺炎住院患者和门诊患者的病历，并汇总了数据。研究数据截止日期为2020年1月31日。新冠肺炎确诊病例的定义为鼻拭子和咽拭子样本高通量测序或实时逆转录-聚合酶链反应（RT-PCR）检测结果呈阳性。仅实验室确诊病例被纳入分析。研究团队从电子病历提取了患者的近期暴露史、临床症状或体征以及入院时的实验室检查结果。影像学评估包括胸片或CT，所有实验室检查均根据患者的临床诊治需求实施。实验室评估包括全血细胞计数、血液化学分析、凝血试验、肝肾功能评估，以及电解质、C反应蛋白、降钙素原、乳酸脱氢酶和肌酸激酶测定。根据美国胸科学会（AmericThorcicSociety）的社区获得性肺炎指南，研究团队将患者入院时的新冠肺炎严重程度分为严重和非严重。截至2020年1月29日，有7736例新冠肺炎患者在552家研究中心住院治疗，研究团队获得了其中1099例患者（14.2%）的临床症状和结局数据。武汉金银潭医院收治的患者量最大（132例）。全国30个省、自治区和直辖市有1856家收治新冠肺炎患者的定点医院，该项研究纳入的医院占了其中的29.7%。该项研究纳入的患者中，3.5%为医务人员，1.9%有野生动物接触史；483例患者（43.9%）为武汉居民。在武汉外居住的患者中，72.3%有与武汉居民的接触史，其中31.3%曾去过武汉；25.9%的非武汉居民既未去过武汉，也无与武汉居民的接触史。研究团队认为，分析显示约2%的患者有野生动物直接接触史，四分之三以上的患者是武汉居民、曾去过武汉或曾有与武汉居民的接触史。这些发现与其他最新报道一致，包括家庭聚集性疫情、无症状患者传播疾病和分为三个阶段的暴发模式。他们认为，该项研究不能排除“超级传播者”的存在。在这样研究中，潜伏期定义为接触传染源（野生动物或者疑似或确诊病例）的可能最早日期与出现症状（即咳嗽、发热、乏力或肌痛）的可能最早日期之间的间隔期。研究得出的中位潜伏期为4天（四分位距，2-7）。患者中位年龄为47岁（四分位距，35-58）；15岁以下的患者占0.9%。女性占41.9%。入院时43.8%的患者有发热，但住院期间88.7%有发热。排在其后的最常见症状是咳嗽（67.8%）；恶心或呕吐（5.0%）和腹泻（3.8%）不常见。在整个人群中，23.7%有至少一种合并症（如高血压和慢性阻塞性肺疾病）。入院时，926例患者的新冠肺炎严重程度被归类为非重症，173例患者被归类为重症。重症患者的年龄比非重症患者大7岁（中位数）。此外，重症患者有合并症的情况（38.7%）比非重症患者（21.0%）常见。不过，重症患者和非重症患者的暴露史相似。从影像学和实验室检查结果来看，在入院时进行的975次CT扫描中，86.2%有异常结果。胸部CT的最常见表现为磨玻璃影（56.4%）和双肺斑片状影（51.8%）。877例非重症患者中的157例（17.9%）和173例重症患者中的5例（2.9%）无影像学或CT异常。入院时，83.2%的患者有淋巴细胞减少，36.2%有血小板减少，33.7%有白细胞减少。大部分患者的C反应蛋白水平升高；丙氨酸转氨酶、天冬氨酸转氨酶、肌酸激酶和d二聚体水平升高的情况较少见。与非重症患者相比，重症患者的实验室异常（包括淋巴细胞减少和白细胞减少）更为明显。研究团队在讨论环节提到，在新冠肺炎疫情初期，患者就诊时症状、影像学结果和疾病严重程度的多样性使疾病诊断变得复杂。值得一提的是，该项研究还发现，重度、非重度组新冠患者各有一例患者的潜伏期达24天。不过，论文的并列第一作者关伟杰、梁文华、何建行教授和钟南山教授在解读时着重提到，仔细查阅整个人群的潜伏期分布规律，发现潜伏期大于14天的共13例（12.7%），而潜伏期大于18天的仅有8例（7.3%）。他们认为，单纯根据最小、最大值评估人群的潜伏期容易引起误读。trog入院时的呼吸功能受损与结局较差相关trog新冠肺炎患者的主要复合终点是送入重症监护病房（ICU）、采用机械通气或死亡。次要终点包括死亡率，从出现症状至发生复合终点的时间，以及从出现症状至发生复合终点中各构成部分的时间。在该项研究中，67例患者（6.1%）发生了主要复合终点事件，包括送入ICU的5.0%、接受有创机械通气的2.3%和死亡的1.4%。173例重症患者中有43例（24.9%）发生了主要复合终点事件。在全部患者中，复合终点的累积风险为3.6%；在重症患者中，累积风险为20.6%。在治疗方面，大部分患者（58.0%）接受了抗生素静脉用药，35.8%接受了奥司他韦治疗；41.3%接受了吸氧治疗，6.1%接受了机械通气；重症患者接受这些治疗的比例较高。重症患者接受机械通气的比例高于非重症患者（无创通气，32.4%v.0%；有创通气，14.5%v.0%）。204例患者（18.6%）接受了全身性糖皮质激素治疗，重症患者接受该治疗的比例高于非重症患者（44.5%v.13.7%）。在这204例患者中，33例（16.2%）被送入ICU，17例（8.3%）接受了有创通气，5例（2.5%）死亡。5例重症患者（0.5%）接受了体外膜式氧合治疗。研究显示，中位住院时间为12.0天（均值，12.8）。在住院期间，大部分患者被诊断为肺炎（91.1%），其次是ARDS（3.4%）和休克（1.1%）。重症患者被诊断为肺炎的比例高于非重症患者（99.4%v.89.5%）。研究团队提到，尽管与新冠病毒相关的死亡总人数多，但病死率似乎低于SARS-CoV和MERS-CoV。而患者入院时的呼吸功能受损（疾病严重程度的主要驱动因素）与结局较差相关。值得注意的是，研究团队在这项研究中确定的病死率为1.4%，低于近期其他团队报道的病死率。他们认为，原因很可能是样本量和病例纳入标准的差异。他们同时认为，由于轻症患者和未就医患者并未纳入本研究，因此真实的病死率可能更低。trog应与SARS、MERS及季节性流感区分开来trog研究团队在讨论环节指出，SARS-CoV、MERS-CoV和高致病性流感的一般传播途径包括呼吸道飞沫传播和直接接触传播，新冠病毒的传播途径很可能也相同。但目前已在胃肠道、唾液和尿液内检出新冠病毒，因此需要对这些潜在传播途径进行研究。他们认为，与近期其他研究的结果一致，研究团队发现新冠肺炎的临床特征与SARS-CoV相似。发热和咳嗽是主要症状，胃肠道症状不常见，因此提示与SARS-CoV、MERS-CoV和季节性流感相比，新冠病毒具有不同的趋向性。不发热的新冠肺炎患者比例高于SARS-CoV（1%）和MERS-CoV（2%）感染患者，因此如果监测病例的定义侧重于检测发热，则不发热的患者可能会被漏诊。淋巴细胞减少常见，而且某些病例达到重度减少。研究团队还强调，尽管新冠病毒和SARS-CoV具有种属相似性，但一些临床特征可以将新冠肺炎与SARS-CoV、MERS-CoV及季节性流感区分开来。研究团队同时提到，研究还存在一些明显的局限性，包括部分病例的接触史和实验室检查记录不完整、非专科医院存在基础设施缺乏和医务人员培训不足、只能估算本研究中有记录信息的291例患者的潜伏期、许多患者仍在住院，数据截止时结局未知等。他们在局限性中还强调了一点，“我们无疑遗漏了无症状或居家治疗的轻症患者，因此我们的研究队列可能代表了新冠肺炎比较严重的一面。”
2020年02月29日,瑞士禁办超过1000人大型活动 日内瓦车展取消_荔枝网新闻,中新网,中新网2月29日电据欧联网援引欧联社报道，当地时间2月28日，瑞士联邦政府宣布，从即日起至3月15日，禁止举办超过1000人的大型集会活动，原定下周登场的日内瓦车展将取消。车展主办单位发表声明表示，对于出现这种情况感到遗憾，但确保所有参与者健康是我们的第一要务。据报道，日内瓦车展活动原定于3月2日起向媒体开放，并于3月5日至3月15日向公众开放。受欧洲新冠肺炎病毒疫情爆发影响，先前已经有部分车厂宣布缺席相关活动。丰田汽车较早前曾表示，只会派出负责欧洲业务的高级主管和公关人员出席。日内瓦车展是世界最大的车界盛事，根据主办单位信息，原本大约有220家参展商会出席车展，预计会有超过1万名记者和大约66万人次的观众到场参观。根据瑞士官方通报，截至目前，瑞士已经出现15例新冠病毒确诊病例。
2020年02月29日,宁夏昨日新增病例系从伊朗回国人员_荔枝网新闻,人民日报,2月28日，宁夏新增1例新冠肺炎确诊病例。患者为宁夏灵武人，37岁，经商人员。2月24日13时30分，患者与妻子乘SU513航班从伊朗德黑兰起飞，24日17时抵达俄罗斯莫斯科。24日晚21时10分，二人乘SU204航班，25日9时50分抵达中国北京首都机场T2航站楼，换乘摆渡车到T3航站楼，打印机票后在商务休息室等候。25日15时50分，二人乘CA1227航班于18时抵达银川河东机场，患者哥哥独自驾车将二人接回，期间佩戴两层一次性口罩，患者夫妻佩戴N99口罩，途经灵武北高速路口卡点时测体温正常。25日19时03分，三人到达灵武市家中，并向辖区居委会报告，随即对患者夫妻二人居家隔离医学观察，现场测两人体温35.9℃、36.2℃。26日17时，灵武市文化路社区卫生服务站测患者体温37.2℃，遂收治灵武市人民医院隔离治疗，胸CT左肺下叶炎症。26日晚23时30分，患者由灵武市人民医院转至银川市临时急救医院救治。28日21时50分，银川市疾控中心核酸检测结果阳性，22时自治区疾控中心复核检测结果阳性，经自治区诊疗专家组评估，确认为确诊病例（普通型）。患者现正转往自治区第四人民医院集中救治，流行病学调查深入进行中。患者自述与此前从伊朗回国的确诊病例丁某不相识、无联系，在伊朗未接触新冠肺炎患者，周围无发热、咳嗽等呼吸道症状人员。
2020年02月29日,库克：密切关注韩意疫情 中国苹果零售店80%已开业_荔枝网新闻,网易科技,网易科技讯2月29日消息，据外媒报道，苹果公司首席执行官蒂姆·库克（TimCook）在接受采访时表示，该公司正密切关注韩国和意大利的新冠肺炎疫情。苹果将韩国主要显示屏制造商三星电子和LG电子列为其供应商。根据苹果最新的供应商名单，苹果还从意法半导体（STMicroelectroic）设在意大利的一家工厂采购芯片。库克告诉福克斯商业网络（FoxBuieNetwork），苹果在中国大陆的零售店已有80%重新开业。他还表示，设在中国的iPhoe组装工厂已经重新开工，正处于“量产模式的第三阶段（恢复正常运作）”。库克称，完全克服新冠肺炎疫情的影响需要一些时间，但总的来说，疫情的影响是暂时的，不是长期的事情。当被问及苹果是否会将iPhoe组装业务从中国转移到越南或柬埔寨等国家时，库克表示，苹果的供应链是全球化的，除了成本之外，公司还考虑了市场反应速度和工程技术。他还表示，苹果的供应链管理人员正在研究该公司供应链对新冠肺炎疫情冲击的适应能力。库克指出：“因此，在我们渡过这次难关之后，我们面临的问题是，我们是否有恢复的能力，我们是否需要做出一些改变。我现在的观点是，如果有变化，是做一些局部调整，而不是某种大规模的根本性变化。”苹果上周宣布，无法实现截至3月份本财季的营收目标，并表示将遭遇供应链短缺。库克称，他现在不知道新冠肺炎疫情是否会影响到截止6月份的这个财季。本周三，在苹果年度股东大会上，库克表示，苹果将在印度开设第一家零售店。
2020年02月29日,第三例！美再现不明来源的新冠肺炎阳性病例_荔枝网新闻,中国新闻网,中新网2月29日电综合外媒消息，当地时间28日，美国卫生官员报告称，在俄勒冈州发现了第三例不明来源的新冠肺炎病毒检测阳性病例。报道称，这表明该疾病正在美国蔓延。这名患者已经成年，但其年龄和性别均未透露。该患者没有前往受疫情严重影响国家的已知旅行史，也没有与任何已知的患者进行接触。俄勒冈州卫生局局长艾伦称，该州仍在等待美国疾病预防与控制中心的最终确认结果。艾伦称，这名患者此前曾前往当地一所小学。目前，该患者已经入院。此前，美国加州已经出现两例未知来源感染新冠肺炎的病例。截至当地时间2月28日，美国疾病预防与控制中心的数据显示，美国新冠肺炎病例为62例。在美国已确诊病例中，44例为日本“钻石公主”号邮轮上的美撤侨人员，3例为中国武汉的撤侨人员，15例为美国本土的确诊病例。
2020年02月29日,疫情阴影下的欧洲足坛_荔枝网新闻,新华网,当新冠肺炎疫情抵达欧洲并开始肆虐，欧洲体坛不可避免地按下“暂停键”。截至记者发稿，疫情最严重的意大利已经有889例确诊病例，当天新增确诊病例234例；意大利周围的国家情况也不容乐观，德国确诊病例60例，法国57例，西班牙33例，英国20例……疫情阴云笼罩下，不断有赛事推迟或取消，甚至将于今年6月开幕的欧洲足球锦标赛，也蒙上了一层阴影。动辄上千人甚至上万人的体育赛场，一旦人群中有病毒感染者，后果不堪设想。本周末的意甲联赛，将有5场比赛空场举行。其中就包括尤文图斯主场与国际米兰的“天王山”之战。本周中的欧罗巴联赛，国际米兰主场与卢多戈雷茨的比赛也空场举行。国际足联主席因凡蒂诺28日在国际足球协会理事会年度大会上表示，短期来看，空场比赛是解决问题的一种方法，但不是“长久之计”。而至于接下来这段时间的赛事是否会被取消，因凡蒂诺表示不排除任何可能。“人们的健康比任何足球比赛都重要得多。所以我们需要去看看未来的形势如何发展，我们希望未来疫情能够被遏制住，而不是继续蔓延。”因凡蒂诺说。位于意大利北部的瑞士在28日新增7例确诊病例，累计确诊病例已达15例。瑞士政府于当天宣布，取消3月15日之前所有超过1000人以上的集会活动。这也意味着最近一段时间，在瑞士进行的大部分体育赛事都将取消，包括所有瑞超联赛和瑞士挑战联赛（瑞士第二级别足球赛事）。本周的德甲联赛依然正常举行，但未来一到两周是否会取消或推迟比赛，德国足协医疗委员会主席蒂姆·迈耶表示：“未来很难确凿预测，一切都需要由当地卫生部门做出最终决定。”在西班牙的33例确诊病例中，有一名患者身份为体育记者，他于上周随巴伦西亚队前往意大利报道该队与亚特兰大的欧冠比赛。此外，还有多名随队出征的西班牙球迷被确诊感染，这让巴伦西亚全队上下格外紧张。28日，巴伦西亚队宣布该队的球员和教练都不会参加本周末联赛赛前和赛后新闻发布会，除比赛之外，所有球员也不会参加任何公开活动，以降低感染风险。同样在28日，三名意大利第三级别足球联赛的球员以及一名俱乐部工作人员被确诊感染，这也是欧洲足坛首次有职业球员被确诊感染。国际职业足球运动员协会（FIFPro）发表声明表示对目前状况的担忧。“已经有运动员向我们协会寻求帮助，因为他们担心自己会在高风险的环境下参加比赛。我们会和各有关方面去讨论这一问题的解决办法。”FIFPro在声明中说。多家足球俱乐部也于近期陆续发布了一些预防措施。其中被提到最多的就是“不要握手”。英超纽卡斯尔联和西汉姆联已经在训练基地禁行握手礼。西汉姆联主帅布鲁斯说，球队本来每天早上碰面都会握手，但在队医的建议下已经暂停。法甲里昂队主教练鲁迪·加西亚在出席本周与圣埃蒂安队的联赛赛前新闻发布会时也表示，根据当地卫生部门以及队医的建议，已经告诫自己的队员们不要相互握手。德甲拜仁慕尼黑28日在官网发布公告称，根据德国疾控中心和相关机构发布的指导意见，俱乐部建议球员不要与球迷发生亲密接触，包括近距离签名合影，希望到比赛场和训练场的球迷能够理解。而德甲的另一支球队莱比锡主帅纳格尔斯曼则表示，球队目前取消了所有球员近期的短途旅行。欧洲足球锦标赛毫无疑问是本年度欧洲体坛最受关注的体育赛事。今年恰逢欧锦赛60周年，欧足联首次采取不设主办国的巡回赛方式在欧洲12座城市举办，意大利首都罗马将于6月12日承办揭幕战的比赛。随着疫情的扩散，很多人都在关心——今年欧锦赛究竟还能不能如期举办？尽管此前欧足联在一份声明中表示，目前还没有“改变按原计划举行”的必要。但是随着事态的发展，一切都是未知数。因凡蒂诺也认为，欧锦赛还是可以如期举行。“但在此之前我们还有许多场国际比赛，涉及许多行程，所以我们必须监控疫情，另外各政府、机构对于哪些可以做，哪些不可以，也会作出决策。”“我们没必要恐慌，我个人并不担忧，但我们必须严肃对待，不能低估（疫情影响），说什么事儿都没有，也不能反应过激。”因凡蒂诺说。
