2020年02月29日,市委应对新冠肺炎疫情工作领导小组会议召开，学习研究了这些重要事项……_荔枝网新闻,今日徐州,2月28日下午，市委应对新冠肺炎疫情工作领导小组召开会议，学习贯彻习近平总书记在中共中央政治局常务委员会会议上的重要讲话精神，以及省委书记娄勤俭在省委常委会会议暨省委应对疫情工作领导小组会议、省委深改委第十一次会议上的讲话精神，听取徐州市疫情防控工作情况汇报，分析形势、压实责任，研究部署下一阶段工作。市委书记周铁根主持会议并讲话。trog会议指出，trog要深入学习领会习近平总书记重要讲话精神，自觉把思想和行动统一到中央和省委决策部署上来。习近平总书记2月26日主持召开中央政治局常委会会议并发表重要讲话，进一步对统筹疫情防控和经济社会发展作出重大部署，为我们做好下一步工作指明了方向、明确了路径、划定了重点、提供了遵循。省委常委会、省委深改委随即召开会议，及时对学习贯彻习近平总书记重要讲话精神作出部署安排。全市各级要自觉把思想和行动统一到习近平总书记重要讲话精神上来，全力以赴推动党中央各项决策部署落地生根，认真落实省委最新部署要求，坚决打好打赢疫情防控阻击战，努力实现全年经济社会发展目标任务，以大战大考双胜利的过硬成果践行初心使命、做到“两个维护”。trog会议强调，trog要坚持分区分级精准防控，一往无前打赢抗击疫情这场硬仗。当前，要一鼓作气、一抓到底，重点防控“三大风险”、强化“两大保障”：一要严防境内外输入性风险，强化入境人员管理和口岸卫生检疫查验，城市交通入口要继续做好重点人员管控，城乡社区要严格落实测体温、戴口罩、外来人员信息登记“三个不间断”。二要严防复工复产聚集性风险，企事业单位要履行防控主体责任，严格落实防控措施，严防疫情发生传播，特别要强化地方所属的公安监所全封闭管理，确保公安监所绝对安全。三要严防城市常态化运行的流动性风险，公共交通运营和公共场所开放，要合理控制乘车人员规模和进出人员数量，强化农贸市场、商场、超市、医院等单位防控措施落实，抓好宣传教育和心理疏导，引导市民增强防护意识、缓解焦虑情绪，按照统一部署认真做好学校复课准备。四要强化有效救治能力保障，扎实做好现有病例救治，加强对出院回家患者的随访，用心做好支援湖北医疗救治工作。五要强化应急防控体制机制保障，补短板、堵漏洞、强弱项，加快形成整体推进合力，提高应对突发重大公共卫生事件的能力和水平。trog会议强调，trog要保持战略定力不动摇，迎难而上抓好经济社会发展各项工作。加快复工复产保运行，主动服务、精准服务，破解企业复工复产“四难”问题，强化落实支持中小企业“21条”，尤其要制定针对性帮扶措施，稳妥推进受疫情影响严重的行业有序复工复业。扩大有效需求保增长，一着不让攻项目，创新方式抓招商，积极培育消费热点，促进消费回补和潜力释放。做好政策托底保民生，加大援企稳岗力度，确保就业大局稳定，加强生活物资供需对接，加大对重点群体的关心关爱力度，照顾好疫情防控中因公殉职人员家属，及时落实帮扶措施巩固好脱贫成果。强化社会治理保稳定，有效预防和应对疫情引发的次生性社会问题，发挥“四位一体”社会治理体系优势，及时化解各类苗头性、趋势性问题，深入推进安全生产专项整治，坚决守牢安全发展底线，确保社会大局和谐稳定。trog会议要求，trog要切实加强组织领导，汇聚上下一心战疫情促发展保稳定的强大合力。全市各级党组织要认真履行主体责任，坚决把党中央和省、市委各项决策部署抓实抓细抓落地。各地各部门要压紧压实属地责任和监管责任，“一把手”要担起第一责任人责任。用好“三项机制”，注重在斗争第一线考察识别干部。坚持党建引领，充分发挥党的领导核心作用、基层党组织战斗堡垒作用和党员先锋模范作用。认真落实党中央号召，组织好党员自愿捐款支持疫情防控工作。强化舆论引导，营造浓厚氛围，深入宣传疫情防控一线涌现出的感人事迹，激发万众一心阻击疫情的强大正能量。响应党中央和省委的号召，徐州市动员组织党员捐款支持新冠肺炎疫情防控工作。会议前，市委书记、市人大常委会主任周铁根，市委副书记、市长庄兆林，市政协主席王安顺，市委副书记、统战部部长徐大勇带头捐款。其他市委常委和市人大常委会、市政府、市政协领导同志也在各自单位进行捐款。 
2020年02月29日,世卫组织：至28日10时全球新冠肺炎确诊83652例_荔枝网新闻,世界卫生组织官微,据世卫组织官微消息，截止到中部欧洲时间2月28日上午10点（北京时间下午5点），全球共确诊83652例2019冠状病毒病病例（新增1358例）。其中中国共确诊78961例（新增331例），并有2791例死亡（新增44例）。中国以外国家和地区确诊4691例（新增1027例），并有67例死亡（新增10例）。共有67个国家报告有确诊病例（昨日新增5个国家——立陶宛、尼日利亚、新西兰、白罗斯和圣马力诺）。
2020年02月29日,日本逐渐重视防控新冠肺炎疫情_荔枝网新闻,光明日报,连日来，日本国内新冠肺炎疫情受到世界关注，日本政府和民众也开始重视对于疫情的防控，采取了许多措施。但不以为然者也大有人在。新冠肺炎疫情目前正在日本扩大。截至2月28日10时30分，日本累计确认919例患者，其中705例来自“钻石公主”号游轮，还有14例是从武汉接回国的日本国民，后一部分患者大都是在隔离期间出现病状，与外界的接触非常少。在统计确诊病例时，日本媒体大多把这两部分患者排除在外，照此计算目前日本“国内”确诊病例为200例。从患者分布来看，新冠肺炎疫情已经蔓延至日本43个都道府县中的19个，确诊病例在5人及以下的都道府县就有13个，占将近三分之二。感染人数最多的是北海道54例，其次是东京都36例，随后是爱知县27例，神奈川县和歌山县分别13例，还有8例是厚生劳动省职员或检疫员。感染大多在人口集中地区。如果日本政府能够及时对这些地区采取有效的应对措施，疫情蔓延的趋势是能够得到控制的。现在，日本国民对于疫情的认知与2月初相比已有了明显的变化。2月初，东京各大交通枢纽中戴口罩者的比例不足两成，东京的餐馆、居酒屋、游乐场等场所人流络绎不绝。那时有日本人认为，新冠肺炎只是一种比流感更为严重的感冒而已，甚至还有日本年轻人在采访中表示，听说新冠肺炎只对老年人有影响，对年轻人影响不大。据记者观察，现在日本国民明显开始重视疫情防护，电视、报纸等媒体对国民做好疫情防护的提醒越来越多，马路上戴口罩的人明显增加，各服务场所的工作人员佩戴口罩率也越来越高。东京各大药妆店和超市的口罩和消毒用品依旧脱销，因为购买的人太多。近日还有谣言说，口罩的原材料与厕纸的原材料相同，未来增加口罩生产可能使厕纸短缺，部分日本国民受谣言蛊惑抢购厕纸，从27日起日本各大商店要么厕纸被抢购一空，要么限制一个家庭只能购买一包厕纸。其实，日本每当遭遇重大灾害时，厕纸都是紧缺物资。例如在阪神大地震中，受灾民众最缺的物资不是食物和衣服，而是厕纸。“3·11”东日本大地震后，不仅是灾区，日本全国都出现了厕纸短缺的情况。虽然日本民众盲目听信谣言而过度恐慌，但从另一个角度看，日本社会确实开始重视疫情了。鉴于未来一两周是日本控制疫情的关键时期，日本政府相继出台许多政策措施，但是国民对于政府的应对措施看法不一。日本首相安倍晋三27日表示希望全国的中小学、高中和特殊教育学校临时停课，文部科学省28日向各都道府县教育委员会等发出通知，正式要求学校停课。对安倍政府的停课通知，日本网络舆情有不少异议。有人表示，安倍看似强调学生们的安全第一，但实际上是想借机展示其执政能力，以提升他近期走跌的支持率，此举只会让民众的生活更加混乱。有的家长抱怨，突然决定让学生们放假，双职工家庭实在不知如何是好，因为学校放假而公司不放假，孩子不知道该由谁照看。还有日本教育专家表示，虽然理解政府此举是为控制疫情、保护孩子，但停课时期正是毕业季，毕业典礼要延期甚至停办，这或许会对学生们的心灵造成创伤，政府、学校及家长都要对学生们进行正确的心理疏导。（本报东京2月28日电本报驻东京记者张冠楠）
2020年02月29日,硬核！自己确诊未连累一个人！这名武汉大学生自我隔离38天！_荔枝网新闻,成都商报,原标题：硬核！自己确诊未连累一个人！这名武汉大学生自我隔离38天！武汉学院会计专业大三学生郭岳寒假期间从武汉回河北沧州老家后确诊新冠肺炎但最终未感染一人他是如何做到呢我们来一起看看他这些天的经历和所采取的隔离措施回家途中全程佩戴口罩1月22日，郭岳按计划从从武汉出发回家。当时，他没有明显的感染症状，但谨慎的他上飞机前做好充足的防护——戴了3层口罩和手套。“感染后有潜伏期，途中要接触很多人，防护好，对自己、对他人都好。”当天下午5点，郭岳乘坐的飞机落地天津。两个小时的行程中，郭岳没有摘下口罩、手套，没和任何人交谈。他提前打电话给到天津机场接他的父亲，让父亲带上酒精，把自己全身和行李消毒。晚上9时，郭岳回到家，主动联系社区说明自己的情况，然后他就把自己隔离在了卧室里。“因为从武汉回来，我担心传染给他人，就准备把自己隔离14天。”郭岳说。一直把自己隔离在房里2天后，郭岳收到同学确诊的信息。他联想到自己1月17日曾出现过咳嗽，于是马上联系社区，说明了情况，当天他就前往医院进行隔离。“虽然我没有发烧等症状，但作为密切接触者，我担心自己在潜伏期内会传染给他人。”郭岳说。1月29日，郭岳确诊。“庆幸的是，回来后我一直把自己隔离在房里，没有密切接触他人。”郭岳说，他的父母和弟弟无一人感染，也没有其他人因他感染。回忆起医院的治疗，郭岳告诉记者，“医护人员最辛苦。她们不仅要给我们治疗，还要照顾我们的生活起居，打扫病房。你只要觉得不舒服，按铃就有医护人员过来。”1月30日，郭岳情绪低落，医院护士长对他进行心理辅导，“她说我的情况不是很严重，让我不要焦虑，医护人员会全力救治。此外，我的家人、朋友和学校都给了我很大的帮助。”出院后在车库隔离28天2月7日，郭岳出院后开始了车库独居生活。“我担心自己病情会出现反复，回家后马上把自己再次隔离起来，避免传染给他人。”郭岳说。车库约30平方米，一边是居室，摆放着一张小床，还有一张可供学习、吃饭的桌子，一个小电暖器；另一边是洗手间。在小小的车库里，郭岳开始了自己的学习，一边上网课一边复习备战考研。“最近在复习英语，我之前住院的时候就带着英语资料书，状态好一点就学习。现在，每天学习时间更多了，希望能考上理想的学校。”每天，父母会把他的一日三餐送到车库门外。他与家人或外界沟通，全靠手机。“我每天都会和我奶奶视频，老人家年纪大了，特别担心我，我就每天跟她视频，让她放心。”郭岳说。原来郭岳担心影响大家的生活，每天坚持只开一个小缝，所以一天中很少见到太阳。白天还稍好点，晚上车库有些冷，他就靠电暖器取暖。今天，记者采访郭岳时，他仍独自住在家中的车库里。郭岳说，他打算在车库再住满一个14天，这样共有2个14天。这样更安全一些，也不会给家人和周围人带去不必要的麻烦。”因为郭岳教科书式的自我隔离，未造成一人因他感染，这是他一直特别欣慰的事情。治愈出院后捐血救人2月22日，郭岳接到沧州市人民医院的电话，告知他有一名新冠肺炎患者急需血浆，血型和他匹配，询问他是否可以前往医院捐献。“生命是第一位的，有能力就要去帮助别人。我当即答应了他们，进行了相关资料的查询，后面医院就接我去医院捐献了。”郭岳说。当天，他捐献了200毫升血浆。24日上午，郭岳收到了沧州市中心血站发来的短信：“郭岳您好：您于2020年2月22日献血一次，检验合格，感谢您的无私奉献！”他告诉记者，其实一开始看到血浆捐赠他自己还是有些害怕，而且自己那段时间还有些胸闷。但是当接到电话电话知道有患者急需血浆时，他毫不犹疑的就答应了，“毕竟救人要紧”。来源：楚天都市报见习记者：李碗容点击进入专题：聚焦新型冠状病毒肺炎疫情责任编辑：祝加贝
2020年02月29日,江苏发布新冠肺炎疫情风险等级名单_荔枝网新闻,江苏卫健委 江苏广电融媒体新闻中心,江苏省新冠肺炎疫情风险等级名单（截至2020年2月27日24时）一、县（市、区）（一）低风险地区（59个）南京市：六合区、溧水区、高淳区无锡市：锡山区、宜兴市徐州市：贾汪区、铜山区、丰县、沛县、新沂市、邳州市常州市：新北区、武进区、溧阳市苏州市：吴中区、相城区、吴江区、常熟市、张家港市、太仓市南通市：如东县、海安市、启东市、海门市、如皋市、通州湾示范区连云港市：赣榆区、东海县、灌云县、灌南县淮安市：洪泽区、淮阴区、涟水县、金湖县、盱眙县盐城市：大丰区、盐都区、响水县、滨海县、阜宁县、射阳县、建湖县、东台市扬州市：邗江区、仪征市、高邮市镇江市：丹徒区、丹阳市、扬中市、句容市泰州市：高港区、姜堰区、兴化市、泰兴市、靖江市宿迁市：宿豫区、沭阳县、泗阳县、泗洪县（二）中风险地区（8个）无锡市：惠山区、江阴市徐州市：睢宁县常州市：金坛区苏州市：昆山市南通市：通州区扬州市：江都区、宝应县（三）高风险地区（1个）淮安市：淮安区二、设区市主城区（不分具体区）（一）低风险地区（8个）无锡市：包括滨湖区、梁溪区、新吴区、无锡经开区徐州市：包括鼓楼区、云龙区、泉山区、徐州经济开发区常州市：包括天宁区、钟楼区南通市：包括崇川区、港闸区、南通开发区淮安市：包括清江浦区、淮安开发区扬州市：包括广陵区、扬州开发区镇江市：包括京口区、润州区、镇江新区泰州市：包括海陵区、泰州医药高新区（二）中风险地区（5个）南京市：包括玄武区、秦淮区、建邺区、鼓楼区、浦口区、栖霞区、雨花台区、江宁区、江北新区苏州市：包括虎丘区、姑苏区、苏州工业园区连云港市：包括连云区、海州区盐城市：包括亭湖区宿迁市：包括宿城区（据江苏卫健委官网）
2020年02月29日,墨西哥新增2例新冠肺炎确诊病例 中国提醒在墨公民_荔枝网新闻,央视新闻,墨西哥当地时间2月28日，墨西哥政府宣布墨出现2例新冠肺炎确诊病例。2名患者分别为墨西哥城一名35岁的男士和锡那罗亚州（Silo）一名41岁的男士，2人均有意大利旅行史且与意大利确诊患者有直接接触，回国后出现身体不适。28日，2名患者先后被墨西哥传染病诊断与研究所确诊感染新冠肺炎。目前2名患者症状较轻，分别在医院和宾馆隔离观察。墨卫生部提醒民众持续关注新冠肺炎疫情并采取防护措施。中国驻墨西哥使馆也发布通报，再次提醒在墨中国公民高度重视并积极应对疫情，注意科学防护，并且提供领事保护与协助电话。
2020年02月29日,韩国外交部：因新冠肺炎疫情针对韩国采取入境管制的国家和地区增至62个_荔枝网新闻,环球网,韩联社援引韩国外交部28日消息，截至当天下午6时50分，因新型冠状病毒肺炎疫情针对韩国采取入境管制措施的国家和地区增至62个。报道称，韩外交部25日面向各国驻韩外交使节介绍韩国疫情防控情况，呼吁各国不要盲目恐慌，采取不必要的过度措施，但采取管制措施的国家和地区仍不断增加。截至当天（28日），全球30个国家和地区对韩国采取全面或部分禁止入境措施，较前一天新增8个国家。加大对从韩国入境人员的检疫力度的国家和地区从前一天的21个增至32个。
2020年02月29日,河南无新增新冠肺炎确诊病例 新增死亡病例1例_荔枝网新闻,荔枝新闻,trog荔枝新闻讯trog 据河南省卫健委消息，2020年2月28日0-24时，河南省无新增新型冠状病毒肺炎确诊病例,新增出院病例58例,新增死亡病例1例。截至2月28日24时，全省累计报告新型冠状病毒肺炎确诊病例1272例，现有重症病例7例，现有危重病例6例，累计死亡病例21例，累计出院病例1161例。其中：确诊病例中，信阳市274例（含固始县31例）、郑州市157例（含巩义市9例）、南阳市156例（含邓州市17例）、驻马店市139例（含新蔡县10例）、商丘市91例（含永城市14例）、周口市76例（含鹿邑县7例）、平顶山市58例（含汝州市1例）、新乡市57例（含长垣市13例）、安阳市53例（含滑县2例）、许昌市39例、漯河市35例、焦作市32例、洛阳市31例、开封市26例（含兰考县5例）、鹤壁市19例、濮阳市17例、三门峡市7例、济源示范区5例。目前累计追踪到密切接触者39170人，2月28日已解除观察345人，共有1525人正在接受医学观察。
2020年02月29日,陕西无新增确诊病例累计245例 累计死亡1例_荔枝网新闻,荔枝新闻,trog荔枝新闻讯trog 据陕西省卫健委消息，2月28日8时至29日8时，陕西无新增新冠肺炎确诊病例，新增疑似病例0例。截至2月29日8时，陕西累计报告新冠肺炎确诊病例245例（200例治愈出院，1例死亡），其中输入性病例116例，密切接触者114例，无明确接触史病例15例。累计确诊病例中，西安市120例、宝鸡市13例、咸阳市17例、铜川市8例、渭南市15例、延安市8例、榆林市3例、汉中市26例、安康市26例、商洛市7例、杨凌示范区1例，韩城市1例。陕西省现有疑似病例0例。全省新增密切接触者4人，累计18926人，均集中医学观察。新增解除密切接触者403人，累计解除密切接触者16961人。
2020年02月29日,福建无新增确诊病例累计确诊296例 新增治愈9例_荔枝网新闻,荔枝新闻,trog荔枝新闻讯trog 据福建省卫健委消息，2月28日0—24时，福建省报告新增新型冠状病毒肺炎确诊病例0例，新增治愈出院病例9例。报告新增新型冠状病毒肺炎疑似病例0例。截至2月28日24时，福建省累计报告新型冠状病毒肺炎确诊病例296例（危重型1例、重型1例，死亡病例1例）。其中：福州市72例（鼓楼区2例、仓山区10例、晋安区11例、长乐区8例、闽侯县4例、连江县8例、罗源县1例、闽清县7例、永泰县2例、福清市16例、宁德市古田县1例、湖北省武汉市2例）；厦门市35例（思明区13例、海沧区2例、湖里区3例、集美区4例、翔安区3例、泉州市石狮市1例、湖北省武汉市9例）；漳州市20例（芗城区9例、龙文区1例、云霄县2例、诏安县2例、长泰县3例、东山县1例、南靖县1例、龙海市1例）；泉州市47例（鲤城区1例、丰泽区4例、洛江区1例、惠安县2例、安溪县2例、永春县2例、石狮市2例、晋江市20例、南安市13例）；三明市14例（三元区2例、宁化县1例、尤溪县2例、沙县5例、将乐县1例、永安市3例）；莆田市56例（城厢区31例、涵江区3例、荔城区8例、秀屿区6例、湄洲湾北岸3例、仙游县5例）；南平市20例（延平区4例、建阳区1例、顺昌县1例、浦城县1例、光泽县1例、松溪县5例、政和县1例、武夷山市3例、建瓯市2例、湖北省孝感市1例）；龙岩市6例（永定区5例、武平县1例）；宁德市26例（蕉城区3例、霞浦县4例、古田县11例、周宁县6例、福安市1例、福鼎市1例）。累计治愈出院病例241例，目前住院病例54例。现有报告新型冠状病毒肺炎疑似病例0例。目前，确诊、疑似病例的密切接触者已解除医学观察10615人，尚有297人正在接受医学观察。
2020年02月29日,新疆无新增新冠肺炎确诊病例 新增出院病例9例_荔枝网新闻,荔枝新闻,trog荔枝新闻讯trog 据新疆卫健委消息，2020年2月28日0—24时，新疆（含兵团）报告新型冠状病毒肺炎新增确诊病例0例，新增死亡病例0例，新增治愈出院病例9例。其中:新增治愈出院病例中，乌鲁木齐市2例、伊犁州2例、兵团第四师2例、兵团第六师1例、兵团第八师1例、兵团第九师1例。截至2月28日24时，新疆（含兵团）累计报告新型冠状病毒肺炎确诊病例76例（新疆维吾尔自治区52例、新疆生产建设兵团24例），累计死亡病例3例，累计治愈出院病例52例。截至2月28日24时，新疆（含兵团）现有确诊病例21例（新疆维吾尔自治区16例、新疆生产建设兵团5例），其中：乌鲁木齐市7例、伊犁州6例、昌吉州1例、吐鲁番市2例、兵团第四师3例、兵团第八师1例、兵团第九师1例；现有重症病例5例、危重症病例1例。目前尚有3618人正在接受医学观察。
2020年02月29日,山东无新增新冠肺炎确诊病例 新增治愈出院7例_荔枝网新闻,荔枝新闻,trog荔枝新闻讯 trog据山东卫健委消息，2020年2月28日12-24时，山东省无新冠肺炎疑似病例；无新增确诊病例，累计确诊病例756例（其中，重症病例7例，危重症病例5例，死亡病例6例）；新增治愈出院7例，累计治愈出院411例。截至目前，追踪到密切接触者16843人，已解除医学观察15714人，诊断为疑似或确诊病例291例，尚有838人正在接受医学观察。
2020年02月29日,海南无新增确诊病例累计168例 新增治愈4例_荔枝网新闻,荔枝新闻,trog荔枝新闻讯trog 据海南省卫生健康委员会消息， 2月28日0-24时，海南省报告新冠肺炎新增确诊病例0例，新增重症病例0例，新增死亡病例0例，新增出院病例4例。新增出院病例中，海口市1例、琼海市1例、昌江县2例。截至2月28日24时，海南省累计报告新冠肺炎确诊病例168例，重症病例2例，死亡病例5例，出院病例136例。确诊病例中，海口市39例、三亚市54例、儋州市15例、文昌市3例、琼海市6例、万宁市13例、东方市3例、澄迈县9例、临高县6例、昌江县7例、陵水县4例、定安县3例、保亭县3例、乐东县2例、琼中县1例。截至2月28日24时，追踪到密切接触者6174人，已解除医学观察5832人，尚有342人正在接受集中医学观察。
2020年02月29日,青海无新冠肺炎新增病例 累计确诊18例均已治愈_荔枝网新闻,荔枝新闻,trog荔枝新闻讯trog 据青海卫健委消息，2020年2月28日0-24时，当日青海省无新型冠状病毒肺炎新增确诊病例和疑似病例。截至2月28日24时，青海省累计报告新型冠状病毒肺炎确诊病例18例（其中西宁市15例，海北州3例），已全部治愈出院。目前累计追踪到密切接触者437人，已全部解除医学观察。
