2020年02月29日,充分发挥党员干部先锋模范作用_荔枝网新闻,人民日报,关键时刻冲得上去、危难关头豁得出来，才是真正的共产党人。在统筹推进新冠肺炎疫情防控和经济社会发展工作部署会议上，习近平总书记高度评价各级党组织和广大党员、干部在这场严峻斗争中冲锋在前、顽强拼搏，充分发挥了战斗堡垒作用和先锋模范作用，指出能不能打好、打赢这场疫情防控的人民战争、总体战、阻击战，是对各级党组织和党员、干部的重大考验，再次强调“让党旗在疫情防控斗争第一线高高飘扬”。“沧海横流，方显英雄本色。”面对来势凶猛的新冠肺炎疫情，各行各业的广大党员、干部响应党中央号召，不忘初心、牢记使命，在危难时刻挺身而出、舍生忘死，冲锋在第一线、战斗在最前沿，哪里任务险重哪里就有党组织坚强有力的工作、哪里就有党员当先锋作表率。从重症病房争分夺秒的救治，到城乡社区挨家挨户的排查，从工厂车间加班加点的生产，到科研实验室夜以继日的攻关，广大党员、干部用行动践行着“随时准备为党和人民牺牲一切”的入党誓言。当前，疫情防控正处在最吃劲的关键阶段，统筹推进疫情防控和经济社会发展任务艰巨，最需要充分发挥党员、干部先锋模范作用，让党旗在斗争一线高高飘扬。广大党员、干部要把初心落在行动上、把使命担在肩膀上，在其位谋其政，在其职尽其责，勇当先锋、敢打头阵，主动担当、积极作为，及时解决群众所急所忧所思所盼，当好群众贴心人，团结带领、紧紧依靠人民群众，把党中央各项决策部署抓实抓细抓落地，把党的政治优势、组织优势、密切联系群众优势转化为做好疫情防控和经济社会发展工作的强大政治优势。基层是联防联控、群防群治的第一线，也是复工复产的第一线，是确保各项措施落实到位的关键所在。基层党组织和基层党员干部要广泛动员群众、组织群众、凝聚群众，全面落实联防联控措施，构筑群防群治的严密防线。要做好耐心细致的思想工作，引导广大群众服从大局、遵守疫情防控各项规定，自觉维护社会秩序。各级党委要多关心关爱基层党员干部，及时帮助他们解决遇到的实际困难和问题。上级党政机关、企事业单位等要抽调更多干部下沉基层、支援基层，把基层锻炼作为践行初心使命、体现责任担当的试金石和磨刀石。干部政治上过不过得硬，就要看关键时刻靠不靠得住。总体看，在抗疫斗争中我们的干部队伍是好的，是经受住考验的，但也有少数干部表现不佳甚至很差。各级党组织要在斗争一线考察识别干部，对表现突出的干部要大力褒奖、大胆使用，对不担当不作为、失职渎职的要严肃问责，对紧要关头当“逃兵”的要就地免职。要及时宣传和表彰表现突出的党员、干部和先进集体，对在斗争一线表现突出的入党积极分子，可火线发展入党。疾风知劲草，烈火见真金。这场重大突发公共卫生危机，对我们党及全体党员、干部来说，是一场大考。在以习近平同志为核心的党中央坚强领导下，紧紧依靠人民群众，我们一定能赢得这场大考，坚决打赢疫情防控人民战争、总体战、阻击战，努力实现决胜全面建成小康社会、决战脱贫攻坚目标任务，向人民、向历史交上一份合格的答卷！
2020年02月29日,最高法最高检明确妨害疫情防控适用危害公共安全罪范围_荔枝网新闻,央视网,央视网消息：日前，最高人民法院、最高人民检察院相关负责人就疫情防控期间法律适用等问题联合答记者问。两高明确，在办理妨害疫情防控措施犯罪案件适用以危险方法危害公共安全罪时，主体上限于已确诊的新冠肺炎病人、病原携带者，或者新冠肺炎疑似病人。两高负责人表示，在办理妨害疫情防控措施犯罪案件适用以危险方法危害公共安全罪时，主观上具有传播新冠肺炎病原体的故意；客观上表现为拒绝隔离治疗或者隔离期未满擅自脱离隔离治疗，实施了进入公共场所或者公共交通工具的行为，其中新冠肺炎疑似病人还要求造成新型冠状病毒传播的后果。两高负责人强调，“实践中，适用以危险方法危害公共安全罪应当依法从严把握。”对于明知自身已经确诊为新冠肺炎病人或者疑似病人，出于报复社会等主观故意，恶意向不特定多数人传播病毒，后果严重、情节恶劣的，也应当适用以危险方法危害公共安全罪。对于其他拒绝执行疫情防控措施，引起新型冠状病毒传播或者有传播严重危险的行为，依照刑法第三百三十条的规定，适用妨害传染病防治罪。
2020年02月29日,男子为挽留女友谎报其为确诊患者，已被刑拘_荔枝网新闻,荔枝新闻,trog荔枝新闻讯trog 据广州市公安局官方微博消息，一名男子为拖延时间挽留女友，编造女友确诊新冠肺炎的虚假信息，造成广州市及相关部门启动应急预案，浪费社会与警务资源，扰乱了社会秩序。警方已依法刑拘该名谎报疫情男子。广州市公安局新闻办公室28日晚上通报：27日凌晨3时，广州白云机场客服热线接到一男子电话举报，称其女友为新冠肺炎确诊患者，26日到广州后暂住海珠区，近日准备搭航班飞外地。接报后，广州海珠警方立即在市公安局的统筹指挥下，与区相关职能部门密切联动展开追查，迅速在辖内一酒店里找到了举报人所称的该女子，并对该女子及酒店内相关人员采取了隔离观察与新冠病毒取样全套检测措施。经严格检测与细致筛查，该女子及酒店内相关人员新冠病毒检测结果均为阴性，也无人员存在疑似症状。综上情况，并在询问该女子相关情况后，警方怀疑举报男子涉嫌谎报警情。当晚，海珠警方在同一酒店内找到从赣州赶来的举报男子刘某(35岁，江西赣州人)。经审查，刘某供述因女友闹分手要回老家，得知女友准备从白云机场乘机回老家后，在赣州老家的刘某为了拖延时间，挽留女友。便编造了女友被确认新冠肺炎的虚假信息，打电话向机场客服热线进行“举报”。目前，相关酒店及人员已解除隔离观察措施。海珠警方已依法对涉嫌编造、故意传播恐怖信息的嫌疑人刘某采取刑事拘留强制措施，案件正在进一步侦办中。通报称，在举国上下抗击疫情的关键时刻，犯罪嫌疑人刘某谎报虚假疫情，造成广州市及相关部门启动应急预案，严重浪费了宝贵的社会与警务资源，扰乱了社会秩序。警方将依法对谎报疫情、警情的违法犯罪行予以严惩，为疫情防控工作营造良好的社会治安环境。
2020年02月29日,引爆韩国疫情的“天地邪”在哪？生病是罪得“灵修”_荔枝网新闻,新京报,截至当地时间2月28日16时，韩国累计确诊2337例新冠肺炎。此前27日，韩国已对近11万名新天地教会教徒进行了确认。其中，1638名出现新冠肺炎相关症状，已经居家隔离。“新天地教会”有不少“疯狂的教义”。比如，他们视身体的疾病为一种罪，会忍受病痛去参加宗教聚会。这次疫情中，有教徒被感染发病后，便拒绝医护人员的检测。他们更希望前往教会礼拜，希望能够治愈疾病。
2020年02月29日,金融助力“战疫情”｜中国银行发挥国有大行“稳定器”作用 多措并举支持疫情防控和复工复产_荔枝网新闻,中国人民银行,落实好央行专项再贷款政策支持重点企业复工复产人民银行关于发放专项再贷款支持防控新冠肺炎疫情政策出台后，中国银行立即制定细化方案，将专项再贷款支持政策传导至各分支机构和子公司，要求各机构全力做好对重点抗疫企业的资金支持，组织人员按照名单逐户开展对接落实。建立总行、省行、市行、支行四级联动，对有融资需求、满足再贷款政策支持标准和符合授信条件的企业实行“一户一策”，提供多元化融资方案。截至2月25日，中国银行累计向291家全国疫情防控重点保障企业发放优惠贷款74.18亿元。获悉上海联影医疗科技有限公司资金需求，中国银行上海市分行第一时间启动“绿色通道”，仅用一天时间，敲定具体的融资方案，批复该企业授信2亿元。在贷款支持下，联影医疗陆续以低于市场的价格向武汉、上海、北京、浙江、内蒙等地发出了近200台CT和DR设备，为包括火神山医院在内的几十家医院提供了近50台急需的高端医疗设备。（联影公司工程师、项目管理人员和一线医务人员）（中国银行上海市分行工作人员审核联影公司贷款材料）全流程管理，确保资金专款专用。中国银行积极落实好政策要求，在保障对全国性疫情防控重点保障企业应贷尽贷、应贷快贷的基础上，加强对优惠贷款的资金监控和贷后管理，重点关注大额放款，确保资金专款专用。创新金融服务方式，助力企业安心生产中国银行加强支持因疫情面临资金困难的企业，在政策允许范围内，全力以赴助力抗疫防疫和企业复工复产。设立假期应急贷款，减免防疫相关费用。中国银行在系统中增设假日应急贷款产品，保障企业的紧急用款需求。此外，减免与疫情防控有关的本外币单位银行结算账户的开户手续费、账户维护费等费用，免收各渠道疫情防控类捐款手续费。1月27日，专门生产医用口罩的四川恒明科技开发有限公司紧急恢复生产，中国银行四川省分行主动上门了解企业金融服务需求，组织业务骨干现场服务，给予特别利率优惠，减免相关费用。中国银行总行多部门也积极响应配合，开放业务系统，确定授信方案。当晚23时，企业授信方案尘埃落定，第二天下午15时，100万元贷款拨付到账。（中国银行四川省分行工作人员上门服务提前复工的四川恒明科技公司）优化还款方式和日期，助力企业渡过难关。针对部分地区推迟复工日期，导致资金无法按期到位及还款，中国银行及时优化业务政策，根据客户申请，灵活调整还款日期。中国银行湖北省分行全面摸排全省因不能及时复工、资金链紧张等原因无法正常还款的客户，逐户研究解决方案，共为39个授信客户办理贷款延期业务43笔，金额合计5.37亿元。湖北新楚风汽车股份有限公司受疫情影响，暂时不能归还1月26日到期的1亿元贷款。中国银行湖北省分行主动与企业联系贷款展期事宜，为该公司办理贷款展期至3月11日，帮助该企业渡过当前难关。（中国银行湖北省分行工作人员为湖北新楚风汽车办理贷款展期）调整不良记录，为企业吃下“定心丸”。中国银行开通征信异议处理绿色通道，协助受疫情影响发生还款迟付导致征信不良的客户及时调整不良记录。获悉杭州鸿雁电器有限公司因下游企业没有复工，无法回笼货款支付工资、偿还贷款和购买生产物资，中国银行临安支行主动上门，按照疫情期间有关政策为企业7笔贷款办理利息延期支付，企业的征信和生产都不会产生影响。防疫资金简化审批、提高效率。针对防疫企业的贷款申请，在把握实质性风险的前提下，中国银行灵活调整业务流程，结合视频、电子邮件等信息，优先受理、优先审批、优先发放防疫企业的新增贷款。发挥机构优势，保障国库资金拨付。中国银行各级机构成立预算单位资金拨付应急保障小组，全力保障各级政府部门、中央和地方预算单位的防疫相关财政国库集中支付、对公取现、代发、捐赠等资金拨付需求。特事特办，全力支援湖北重点地区防疫针对疫情较为严重的湖北地区，中国银行总行及时扩大湖北省分行贷款授权，调整抗疫时期利率审批和转授权方式，进一步降低企业在鄂企业融资成本。湖北省分行启动线上利率审批流程，通过内部行信业务系统完成审批，全流程无纸化、零接触和零暴露，最大限度提高效率和保障安全。在跟踪回访过程中，获悉国药集团湖北公司仍存在一定的经营困难，中国银行总行特事特办，批准扩大湖北省分行临时性贷款利率授权，进一步降低国药集团湖北公司的贷款利率，最终为客户实现了2.2%的优惠利率投放。2月17日，了解到新冠肺炎收治医院太和医院门诊收款已达上限，押运公司因封城无法提供服务，中国银行十堰茅箭支行工作人员上门提供大额现金清收服务，历经12小时，将887笔共计170余万现金清点完毕，经紫外线消毒后全部顺利入账，及时缓解了院方现金保管安全风险压力。（中国银行十堰茅箭支行工作人员上门清收太和医院现金）服务人民军队，守护医护人员多举措保障人民军队金融需求。以“为部队任务服务、为官兵保障服务”为主线，中国银行制定疫情防控期间为军服务十大举措，全面对接和保障人民军队抗击疫情期间各类金融服务需求。获悉驻沪部队在防疫物资方面存在缺口，中国银行上海市分行迅速筹备拥军抗疫专项资金，向驻沪部队提供口罩、测温仪、消毒水等共计近5000份物资支持，配合部队单位开展防疫工作。（中国银行上海市分行向驻沪部队提供防疫物资）专项保障，保险守护医护人员安全。中国银行联合旗下中银保险、中银三星人寿两家保险公司，累计为924家抗疫一线医疗机构12.76万名医护及疾控人员赠送保险，保费由中国银行全额承担。推出面向医疗机构的雇主责任险，提供全方位工伤保障，涵盖医护人员在履职过程中的工伤（包含“新冠肺炎”）、交通意外及职业病等。同时，推出“疫对抗，速理赔”六项举措，最大限度简化医护人员理赔手续。（中国银行温州市分行向温州医护人员捐赠保险）（中国银行达州分行向达州医护人员捐赠保险）践行初心使命，中行人在坚守中国银行积极担当国有大行的政治责任和社会责任，关键岗位时刻待命，业务不停，服务不断，坚决做好抗疫金融“支援部队”。中国银行党委向全行党员职工发出动员令，号召全体党员职工坚守岗位，全力以赴，落实好金融服务保障和支持工作。协同作战，综合方案支持企业需求。中国银行发挥集团综合化平台优势，为抗疫企业提供一揽子金融服务，助力抗疫企业和受疫情影响的中小微企业增加经营能力，妥善应对流动性缺口，尽快复工复产。中国银行与中银证券联动，为广东东阳光公司发行全国首单疫情防控公司债券；与中银资产联动，为参与防疫基础设施建设企业提供债转股支持；联合湖北省高新产业投资集团，设立湖北省第一支专项抗击新冠肺炎疫情的股权投资基金，总规模50亿元，首期落地10亿元。坚守岗位担当使命，金融服务不断档。中国银行党员职工牢记初心使命，关键岗位随叫随到，确保疫情期间金融服务不停，金融支持不断。总、分、支行协同作战，确保政策及时落地。中国银行总行公司金融部、普惠金融事业部成立联合专项工作组，会同相关部门连夜召开电话会部署政策落地方案，及时高效响应分支机构需求，即来即审、主动服务，为全行各条线业务提供全程保障支持。除夕当天，中国银行荆门分行工作人员放弃与家人团聚，连夜紧急办理拨款业务，就将780万元中央抗击疫情救灾款拨付到荆门市多家医院账户。大年初四，汕尾分行工作人员第一时间将3400万元医疗防疫资金划拨至5家定点医院账户，保障防疫物资采购资金及时到位。（中国银行总行工作人员办理业务审核）（中国银行湖北省分行工作人员办理财政资金紧急支付）
2020年02月29日,小家大爱|林洪波家庭：她在抗疫一线冲锋，他是坚强后盾_荔枝网新闻,女性之声,面对疫情，全国人民戮力同心，众志成城。在为“疫”而战的各方力量中，有包括“最美家庭”在内的许多家庭挺身而出，在支援一线、宣传引导、捐款捐物、志愿服务等方面做出了积极贡献。女性之声特别推出“小家大爱”栏目，为大家讲述他们的抗疫故事，致敬小家大爱！这是一个和谐有爱的三口之家，心里装着小家，也装着大家。曾几何时，丈夫林洪波作为一名军人在前线保家卫国，妻子王薇则在后方守护着小家。后来林洪波转业，一家人终于团聚。如今疫情当前，夫妻二人同在一线，林洪波在山东泰山景区的社区疫情防控工作中坚守岗位，王薇在重庆巫溪的疫情隔离区治病救人。他们集家庭之力，为抗击疫情做出了自己的突出贡献。林洪波是一名转业军人。新冠肺炎疫情发生后，他主动报名请战，积极投身“到一线·肩并肩·战疫情”专项行动中，参与社区疫情防控工作，协助迎胜农贸市场疫情防控点开展信息登记、体温检测、人员消毒等疫情防控工作。同时，他还肩负着数控大楼办公网络正常运转的维护工作，对视频会议系统进行网络对接和设备调试，多次为防控工作视频会议提供安全、高效的技术支持。林洪波的妻子王薇是泰安市中心医院重症医学科主治医师，是2019年泰安市卫健委选派到重庆市巫溪县帮扶协作的支医队员，已在巫溪县人民医院ICU工作半年。春节期间，在家休假的王薇接到巫溪县人民医院通知，要求她火速赶回支援新冠肺炎疫情防控工作。面对未知的疫情，作为工作多年的主治医师，王薇明白，投身防控战役，责无旁贷。林洪波对妻子说：“你放心去一线吧，不要挂念家里，照顾好自己。家里有我在，你放心！”为了不让父母担心，林洪波并没有告诉父母王薇在重庆疫情隔离区工作。他一边为妻子担心，一边还要安慰双方老人，只能自己默默地承担一切。每当夜幕降临，林洪波盯着手机，搜索着重庆巫溪关于抗击疫情的最新消息。他不敢打电话询问妻子的情况，因为他知道防疫前线的任务有多艰巨，他不能让妻子分心。直到看到新闻报道，他才知道，妻子连续5天工作到凌晨4点才睡觉，他心疼极了。他想打电话关心一下妻子，可是当过兵的他知道，上了前线，就一定要坚持到底。王薇工作照→刚上初一的儿子平时最喜欢跟妈妈聊天，眼看刚回到家没几天的妈妈又要去“战场”打仗了，心里难免不舍。林洪波要去防疫一线值班，照顾不过来，只能把孩子送到外婆家，让老人帮忙照看。孩子想妈妈了，他就给孩子讲妈妈在ICU照顾病人很忙，是抗疫英雄，要以妈妈为榜样，理解妈妈。林洪波说：“以前我是军人，冲锋在前，她是军嫂，保障后勤。现在，她冲锋在前，我就是她的坚强后盾。我们一定会取得疫情防控阻击战的胜利，期待孩子妈妈早日凯旋归来！”
2020年02月29日,加快研发加快检测加快办理！深圳税企携手增强战疫力量_荔枝网新闻,国家税务总局,2020年，一场由新型冠状病毒引起的肺炎疫情牵动全国人民的心。隔离消毒、分子诊断、体温监测、影像诊断、呼吸救治等必需的医疗耗材和设备，成为了此次疫情中的战略物资，直接影响抗“疫”形势大局。深圳市新产业生物医学工程股份有限公司于2月份研制出全球首款新冠病毒化学发光检测试剂，为抗“疫”战场提供了新的“弹药”。“检测结果早一分钟出来，就少一分钟的感染风险。”新产业生物董事长饶微表示，化学发光免疫分析方法具有检测速度快、对实验环境要求低、结果精准度高等优势，采用快速高通量化学发光免疫检测平台，25分钟可出首个结果，最快的机型每小时可完成300个测试项目，与目前CT、核酸检测形成有效互补。快速研发的秘诀，在于早做战备，料敌机先。“1月中旬我们得知武汉出现肺炎疫情，公司立即组织原料研发、试剂研发等多部门50余名骨干进行紧急攻关，经过昼夜奋战，只用了十几天的时间，就成功研制出了新型冠状病毒重组表达抗原，以及新型冠状病毒IgM和IgG抗体全自动化学发光免疫分析检测试剂盒。”值得一提的是，国家税务总局深圳市坪山区税务局的工作人员了解到企业相关情况后，第一时间与新产业生物财务负责人丁晨柳取得联系，宣传关于支持疫情防控的系列税收优惠政策，为企业安排了政策辅导专员，并开辟了办税绿色通道。“我们看到三个公告后真是士气高昂、信心大振，这可真是给力的及时雨啊，就是还在犯愁怎么能尽快落实落地到我们公司身上。”丁晨柳表示，“没想到，税务人员通过电话马上联系了我们，通过微信详细进行了政策解读辅导。”根据财政部、税务总局公告2020年第8号，省级及以上发展改革部门、工业和信息化部门确定的疫情防控重点保障物资生产企业，可以享受新购置的相关设备一次性在企业所得税税前扣除、退还增值税增量留抵税额等优惠政策。新产业生物掌握该政策情况后，已经开始着手准备有关申请资料。丁晨柳说：“我们能够在全球首个研发出针对新冠病毒的化学发光检测试剂，源于我们始终专注化学发光免疫分析领域研究，源于我们有一支强大的研发团队，这也得益于国家一直以来的税收政策支持。特别是2019年一系列减税降费政策，有力支持了我们企业的发展和科研活动。”例如，研发费用加计扣除比例提高后，新产业生物全年的企业所得税减免超过980万元，此外，还享受出口退税约2205万元和增值税附加税费减免约150万元；“新个人所得税法实施后，我们的代扣代缴数也由2018年的1508万元下降到2019年的794万元，同比下降了47.37%，这对于我们吸引更多高端科研人才有很大的帮助。”据悉，新产业生物现有员工1700多人，其中博士、硕士及海外归国人士200多人，拥有试剂研发及生产中心、仪器研发及制造中心、营销中心等专业团队。据了解，坪山区税务部门对防疫重点物资生产企业的发票申请、退税申请等，都会优先审批、加快办理，考虑到相关企业为阻击疫情正全身心投入防疫物资生产，该部门还提供了容缺受理服务。2月19日，新产业生物完成欧盟地区准入，成为全球首家拥有CE标志并在欧盟公开销售的新冠病毒抗体化学发光试剂企业。目前，新产业生物已经将10万人份的试剂免费分发到北京协和医院、武汉协和医院、解放军总医院第五医学中心等多家疫情防控一线重点医院合作试用。饶微介绍：“现在公司全自动化生产线已启动试剂量产，每日可生产一万盒，我们的全自动化学发光免疫分析仪在全国装机超过10000台，基本上很多地市级城市二级以上的医院都有相应的检测设备，湖北超过400台、武汉接近100台，短期内可以搜集大量的样本，一旦被验证有效，将尽快投入生产，为打赢新冠肺炎防控阻击战贡献力量。”（记者陈发清）
