2020年02月29日,格鲁吉亚确诊第三例新冠肺炎病例 与第一例接触过_荔枝网新闻,央视新闻,当地时间2月29日，据格鲁吉亚卫生部国家疾病控制中心负责人消息，格鲁吉亚境内确诊第三例新冠肺炎病例。该名患者与格鲁吉亚第一例确诊患者有过接触，两人一起从伊朗经阿塞拜疆返回格鲁吉亚。目前格鲁吉亚超过150人正在进行隔离观察。
2020年02月29日,荷兰新增2例新冠肺炎确诊病例 累计4例_荔枝网新闻,央视新闻,当地时间29日下午，荷兰公共卫生与环境研究院表示，荷兰境内再添2例新冠肺炎确诊病例，两名病患分别为此前确诊的阿姆斯特丹女性居民的配偶及最小的孩子，而该女子的另外两个孩子并未受到感染。按照荷兰卫生部门的相关程序，在没有出现严重症状的情况下，这三名病患在接下来两周内将继续在自己家中隔离。（总台记者邹合义）
2020年02月29日,通讯：“没有中国克服不了的困难”——埃及中文专业师生支持中国抗击新冠肺炎疫情_荔枝网新闻,新华网,“中国加油！”“武汉加油！”在位于埃及首都开罗的艾因夏姆斯大学校园里，一群青春洋溢的埃及学生举着写有汉字的标语，为中国抗击新冠肺炎疫情加油呐喊。“希望能用这样的方式表达我们对中国人的爱与支持。”艾因夏姆斯大学中文系大四学生玛利亚姆对记者说。疫情发生以后，玛利亚姆和同学们几乎每天都关注来自中国的消息。他们为逝去的生命感到惋惜，也被许多中国一线医护人员的事迹感动。在中文系学生的带动下，大学里其他专业的学生也陆续加入进来。在艾因夏姆斯大学国际合作处处长伊斯拉的微信朋友圈里，每隔几天就能看到不同专业的埃及大学生举着写有“中国加油”字样的标语声援中国。“新冠肺炎疫情是短暂的，但中国与埃及的友谊是长久的。”艾因夏姆斯大学语言学院副院长纳赛尔说。在埃及伊斯梅利亚省的苏伊士运河大学孔子学院内，师生们发起了一项“尼罗河的来电”活动，用拍摄视频的方式声援中国。已学习中文三年的努尔汉·穆斯塔法在视频中说，“没有中国克服不了的困难”，等疫情过去，他还要去中国学习深造。埃及著名汉学家、苏伊士运河大学孔子学院外方院长哈桑表示，中华民族具有坚韧不拔、不畏险阻的精神气质，他深信中国将战胜疫情。“投我以木桃，报之以琼瑶”，中国新冠肺炎疫情也牵动着开罗大学文学院中文系师生们的心。中文系一年级学生用手绘画表达了他们对中国的支持。埃及学生努尔汉·穆罕默德手绘了一幅在金字塔与长城背景下，两名少年手举中埃国旗携手前行的画，表达要“手拉手一起加油”的美好愿望。在埃及著名汉学家、开罗大学孔子学院外方院长李哈布的倡议下，学院教师也纷纷筹集善款，用行动表示对中国抗疫的支持。“中国是我的第二故乡，祝那里的人们一切安好。”李哈布说。
2020年02月29日,法国新增16例新冠肺炎 法国疫情扩散进入第二阶段_荔枝网新闻,人民日报,人民日报记者李永群消息，法国卫生部长韦朗29日在新闻发布会上表示，法国当天新增16例新冠肺炎感染病例，累计确诊病例达73例，法国疫情扩散进入第二阶段。截至目前，法国确诊的73名患者中，2人死亡、12人痊愈出院，另有59人在医院接受治疗。
2020年02月29日,日本感染确诊总数上升至946例 多地出现首例确诊_荔枝网新闻,中国新闻网,中新社东京2月29日电 截至当地时间29日19时，日本新型冠状病毒肺炎感染确诊总数上升至946例，累计死亡人数为11人(其中邮轮“钻石公主”号乘客6人)，多地出现首例确诊。日本首相安倍晋三29日在首相官邸向媒体表示，接下来的两周应采取一切手段阻止疫情蔓延。安倍说，将利用超过2700亿日元(约合25亿美元)的预备费，再用10天左右的时间制定出第二轮的紧急对策。安倍称此次的病毒有许多尚未知的部分，和看不清、不了解的敌人战斗并不容易。单靠政府的力量很难取得胜利，需要民众的共同努力。关于东京奥运会，安倍说，日本政府将继续为大会的举办，和国际奥委会、东京奥组委、东京都开展紧密合作，朝着使运动员和观众都能安心的目标作万全的准备。当天，高知县发现首例确诊，为1名30多岁的女护士，据悉，该患者近期去过大阪旅行，没有出国经历，也没接触过从中国武汉回来的日本人。当天，新潟县也发现首例确诊，为1名60多岁男性。据悉，他从东京回新潟老家照顾母亲，出现发烧等症状遂去医院检查。29日，宫城县发布消息称，仙台市1名70多岁男性确诊，为该县首例。患者此前为邮轮“钻石公主”号上的乘客，在病毒检测中结果为阴性，2月20日下船回到家中。除了买食物外没有外出，其间戴口罩。
2020年02月29日,中国以外55个国家和地区新冠肺炎确诊逾6000例_荔枝网新闻,中国新闻网,中新社北京2月29日电综合消息：截至北京时间2月29日18时，中国以外共55个国家和地区报告新冠肺炎累计确诊病例6246例，死亡94例，治愈424例。目前，韩国是除中国外累计确诊病例最多的国家。截至当地时间29日16时，韩国累计确诊病例3150例，死亡16例。新增病例中大部分集中在大邱及周边地区，一半以上确诊病例与“新天地教会”有关。此外，亚洲的伊朗和日本疫情也较为严重。伊朗是除中国外死亡病例最多的国家。截至当地时间29日中午，伊朗累计确诊593例，死亡43例，治愈123例。截至日本当地时间29日上午，包括“钻石公主”号邮轮在内的确诊病例累计940例，死亡11例，治愈22例。意大利是欧洲疫情最严重的国家。截至当地时间28日18时，意大利累计确诊888例，死亡21例，治愈46例。近日，为应对医院床位短缺和患者增多，意大利各地医院外搭建临时帐篷专门接诊疑似感染者，方便分流、诊断和隔离。墨西哥、冰岛、摩纳哥均在当地时间28日报告境内出现首例新冠肺炎病例。墨西哥首例患者为35岁男性，2月14日至22日曾在意大利北部停留。冰岛首例患者为50岁男性，回国前在意大利北部度假。摩纳哥首例患者为50岁左右男性，目前状况稳定，已被送至法国尼斯接受隔离治疗。当地时间28日，世界卫生组织总干事谭德塞在日内瓦宣布，将新冠肺炎疫情全球风险级别由此前的“高”上调至“非常高”。世卫组织专家同时强调，这并不是为了让人们恐惧，而是唤醒各国看清现实，做好准备，对自己的国民和世界负责。
2020年02月29日,新加坡29日新增4例新冠肺炎确诊病例 累计确诊102例_荔枝网新闻,央视新闻,新加坡卫生部今晚（29日）发布公告，当天新增4例新冠肺炎确诊病例，累计确诊102例。4例确诊病例皆与此前确诊的一个感染源有关联。新加坡卫生部同时发布，今天有3例患者治愈出院，出院总数达到72人。另有7例危重。
2020年02月29日,卡塔尔确诊首例新冠肺炎感染者_荔枝网新闻,人民日报,卡塔尔通讯社29日报道，该国公共卫生部当天发布声明，称该国确诊首例新冠肺炎感染者。声明说，该名感染病情稳定，是一名36岁卡塔尔男性，系卡塔尔政府从伊朗撤侨包机上的乘客，目前所有乘客都在隔离当中。卡塔尔已经开始对相关的密切接触者进行检测。
2020年02月29日,甘肃29日通报：连续12天无新增新冠肺炎确诊病例_荔枝网新闻,荔枝新闻,trog荔枝新闻讯trog2月28日20时至2月29日20时，甘肃省无新增新型冠状病毒肺炎确诊病例。截至2月29日20时，甘肃累计报告新型冠状病毒肺炎确诊病例91例，累计治愈出院82例，累计死亡病例2例。现有7例在定点医院进行隔离治疗，其中平凉市3例、兰州市2例、定西市1例、庆阳市1例。现有重型病例1例。甘肃省目前无疑似病例。目前，累计追踪到密切接触者4332人，已解除医学观察4075人，其余257人正在接受医学观察。（总台央视记者柴世文）
2020年02月29日,全国政协“委员讲堂”推出抗击新冠肺炎疫情特别节目 “众志成城 同心战‘疫’”_荔枝网新闻,人民网-强国论坛,href="htt:tvlyer.eole.com.clyer.hxmlL3B2c2VydmljZS94bWwvMjAyMC8yLzI3LzNiOWMyYjEzLTcxNTctNGFjMy04YmIwLTU1MzBkN2YwY2IxNy54bWw=orecomm1ki2lyerByOmf.wf"点击查看视频突如其来的新冠肺炎疫情，是新中国成立以来在我国发生的传播速度最快、感染范围最广、防控难度最大的一次重大突发公共卫生事件。疫情发生后，党中央高度重视，迅速作出部署，全面加强对疫情防控的集中统一领导，全国人民众志成城。经过艰苦努力，目前疫情防控形势积极向好。全国各级政协组织和广大政协委员积极投身到疫情防控和建言资政、凝聚共识之中，充分发挥优势和作用，作出了自己的贡献。全国政协办公厅制作的“委员讲堂”节目2月28日起推出抗击新冠肺炎疫情特别节目“众志成城同心战‘疫’”，邀请部分全国政协委员从自身专业出发，分析疫情形势，提出政策建议，普及防控知识，帮助公众科学认识疫情，树立健康生活理念，为我国夺取疫情防控和实现经济社会发展目标双胜利建言献策。新冠肺炎疫情与2003年的“非典”疫情有何异同？新型冠状病毒到底有多“毒”？新冠肺炎致死率低，为何仍需动员全民防控？如何看待防治新冠肺炎的“特效药”开发和疫苗研制？广大政协委员在疫情防控中发挥了哪些作用？……本期特别节目中，十三届全国政协委员方来英、张德兴、孙承业参加访谈，就公众关注的疫情相关热点话题深入解读。“委员讲堂”是全国政协学习贯彻习近平总书记关于加强和改进人民政协工作重要思想的一项履职创新探索，是为政协委员联系团结界别群众、面向社会正面发声、凝聚和传播共识搭建的一个新的机制化平台，也是展现政协委员新时代新担当新作为的重要窗口。“委员讲堂”旨在引导广大政协委员在建言资政和凝聚共识方面双向发力，协助党和政府协调关系、解疑释惑、理顺情绪、化解矛盾，更好地发挥正面引领、凝心聚力的作用，更好地担负起人民政协制度参与者、实践者、推动者的责任。
2020年02月29日,新型冠状病毒肺炎疫情防控健康教育海报系列（附下载链接）【新型冠状病毒科普知识】（253）_荔枝网新闻,健康中国,
2020年02月29日,阿塞拜疆新增两例新冠肺炎确诊病例_荔枝网新闻,央视新闻,2月29日，据俄罗斯卫星社报道，阿塞拜疆新增两名感染新冠肺炎患者。患者分别为22岁和47岁的阿塞拜疆公民，之前到过伊朗库姆，大不里士和德黑兰。目前两人状况稳定，阿塞拜疆正在对两人近期接触的人员进行排查，防止病毒进一步传播。此前阿塞拜疆境内确诊一例，患者为俄罗斯公民，不久前从伊朗入境阿塞拜疆。
2020年02月29日,直通武汉|捷报频传，又一批重症患者今出院！_荔枝网新闻,荔枝新闻,trog荔枝特报武汉报道组 通讯员 trogb周宁人杨刚btrog  编辑德青trog2月29日上午10点，武汉市第一人民医院。继昨天5名重症患者出院后，今天上午，又有7位新冠肺炎重症患者达到治愈出院指标，将被安排至社区隔离点进行14天的医学隔离观察，如果一切顺利，他们很快就可以跟自己的家人团聚。trog入院都要“吸氧”不少人还有基础疾病trog据了解，今天这一批出院的患者全都是符合新冠肺炎重症型标准的，年龄最小的29岁，最大的65岁，但他们都有一个共同的特征——重症患者。江苏省人民医院援武汉市第一医院医疗队队长、江苏省人民医院副院长刘云教授表示，这7名患者入院时情况都不稳定病情很重。为了保障每例患者的及时诊疗，医疗队快速建立了以江苏省人民医院ICU重症张萍主任医师呼吸与危重医学科齐栩主任医师、急诊乔莉主任医师、感染科金柯主任医师为核心的，集心脏、肾脏、内分泌、消化、心理理等各专科的联合诊疗专家团队开始密切协作。“许多重症患者同时合并了基础疾病”，齐栩表示，医疗团队在结合原有诊疗指南基础上，关注每个患者的基础疾病，比如糖尿病、高血压、慢性肾病、慢性肺阻塞性疾病等，同时加上心理疏导，改善睡眠等，多措并举地加快患者康复。   “今天出院的7例患者，经过我们全力救治，都在入院后5到7天内脱离了吸氧，10天左右复查CT较刚开始有了明显好转。看到这些重症患者顺利康复，也给我们增添了莫大的信心和力量。”医疗队员、江苏省人民医院急诊医学中心乔莉主任医师告诉记者。trog这份“江苏温暖”让他们流下热泪trog29岁的小金是今天出院患者中最年轻的一个。今年春节前，他突然出现了发热，当时，他的爱人此刻已经临近预产期，为了避免传染给爱人，小金只能自我隔离，让母亲照顾妻子的饮食起居。2月14日，小金接到社区的电话，他被快速送到了武汉市第一医院，收治在江苏省人民医院援武汉医疗队负责的感染五病区。经过科学、悉心治疗和照顾，小金身体一天比一天好，这让他的害怕和紧张大大的缓解。江苏省人民医院援武汉市第一医院医疗队护理部主任宋瑾说。让他更加开心的是，就在他住院期间，妻子喜诞千金一枚，这也增强了他康复的信心和力量，每天她都会拿孩子照片给他的主治医生，江苏省人民医院援武汉市第一医院医疗队队员张倩医生看。“孩子新生让我开心，你们给我的新生永远难忘！”出院前，小金流下了喜悦的热泪。今天出院的何大姐谈起救治经过感慨万千。儿子今年要高考，住院后，想到自己不能督促儿子学习，更不能照顾饮食起居，何大姐整天以泪洗面，一度沮丧。江苏省人民医院医疗队员了解到这一情况后，在治疗的同时，立即安排江苏省人民医院援武汉市第一医院医疗队心理科王浩飞医生对何大姐进行心理疏导，积极安慰、不断鼓励给她打气。在全体医疗队员的帮助下，何大姐再次恢复了信心，积极配合治疗。医务人员还帮她每天跟儿子视频，让儿子放心备考。“有一次我发现纸巾等生活用品用完了，我的床位医生杨刚主任第二天就帮我带来了，还送了我一些榨菜和小吃，我要给他钱，他怎么也不要，杨主任与我儿子差不多大，跑这么远来照顾我们，每天看到他们在病房忙忙碌碌，我真的很心疼他们，我看到他就想起我的儿子，我一直在想，等我出院了，我一定要烧点吃的给他们”，何大姐说，这份来自江苏的暖意她将永远铭记。trog分组分区高效救治半个月交出高分成绩单trog江苏省人民医院援武汉医疗队副队长陈群主任医师表示，半个月前，大家刚到达武汉，没有来得及整理行李就投入到重症病人的收治中。短短2小时，病区61张床位迅速收满。为了高效有序救治病人，刘云队长部署实施分组收治，由组长带组员，迅速掌握所有患者的一手病情；然后根据病情，快速将患者区分开、重症患者及危重症患者分开，将普通吸氧、高流量吸氧以及呼吸机辅助的患者区分开。这样的分组分区救治，实现了安全、高效、有序的救治过程，减少了在不熟悉环境中发生错误的概率。半个月的时间过去了，江苏省人民医院援武汉市第一医院医疗队交出了一张不错的成绩单，看到患者们相互道别珍重的画面，医护人员的心情也跟着今天的天气一样，充满着阳光和希望。   
2020年02月29日,天津29日无新增新冠肺炎确诊病例 治愈出院4人_荔枝网新闻,荔枝新闻,trog荔枝新闻讯trog 据天津市疾控中心消息，2月29日6时至18时，天津无新增新冠肺炎确诊病例，治愈出院4人。截至目前，天津累计报告新冠肺炎确诊病例136例，其中男性73例，女性63例；危重型1例、重型5例、普通型17例、轻型1例、治愈出院109例，死亡3例。疑似病例41例。累计排查密切接触者2278人，尚有339人正在接受医学观察。
2020年02月29日,硬核出击！宜兴线缆企业驰援多地“小汤山”医院建设_荔枝网新闻,荔枝新闻,b荔枝新闻讯b  面对新冠肺炎疫情，武汉火神山、雷神山医院火速建成投用，令全世界为之惊叹。“中国速度”的背后，有着众多宜兴线缆企业的身影。据无锡市工信局初步统计，春节以来，远东、江南等10多家宜兴规上线缆企业，先后驰援武汉火神山、雷神山医院，以及深圳、苏州、西安、柳州等10多个城市的应急防疫医院和临时医疗隔离病房建设，累计提供主干、分支各种规格型号电缆20余万米，货值近2000万元，其中捐赠货值200余万元。宜兴是全国最大的电线电缆生产集聚区，形成千亿级产销规模，无论从产业规模、市场份额，还是创新能力、竞争实力，都是当之无愧的行业“领头羊”。尤其是一批线缆生产企业运营质态优、创新能力强。目前，无锡全市线缆企业获得全国质量奖1家、江苏省质量管理奖6家，拥有国家级企业技术中心2家、省级企业技术中心13家。 工期越短，对产品的可靠性要求越高。武汉火神山、雷神山医院以及全国一批“小汤山”医院频频选择宜兴的线缆企业，正是基于无锡坚实的产业基础，以及一批线缆企业通过加强创新、严控质量在行业中赢得的美誉度和树立的领军地位。迅速启动春节紧急生产预案，组织生产人员到岗，开足马力，全力保障武汉所需电缆供应……1月25号，远东高端装备、低压特种电缆等生产厂部分员工提前结束春节假期，迅速投入到生产一线。精神饱满的工人熟练操作着先进生产设备，机器飞速运转。此次，远东电缆为武汉雷神山医院供应主干电缆2万多米，分支电缆11万多米，占项目所用电缆的70%。无锡市华美电缆有限公司自先后驰援武汉火神山医院、湖北十堰市郧阳区新冠肺炎医院应急工程建设后，2月15日又接到了紧急发运一批电线电缆驰援连云港抗疫应急医院建设的任务。公司董事长华健第一时间安排部署，在做好企业内部疫情防控工作的前提下，加班加点赶制发货，仅耗时两天就赶制出抗疫用电缆。“武汉火神山、雷神山医院及全国一批‘小汤山’医院按计划顺利通电，在这场时间争夺战中，极致的‘宜兴效率’，在全国人民面前彰显了宜兴线缆行业转型发展所取得的硕果。”无锡市工信局局长蒋惠清说。以无锡市华美电缆为例，2017年企业投资1.3亿元，引进国外先进设备以及国内最优良的电缆生产装备，建设“智能车间”，大幅提升了企业生产效率。无锡江南电缆有限公司坚持创新发展，通过研发新工艺和运用新材料，生产产品种类100多个、5万多个规格。在此次驰援武汉战疫情的过程中，江南集团董事局主席储辉主动联系武汉雷神山医院建设单位中国三建，号召企业员工放弃春节假期，加班加点调拨电缆，以最快速度运抵武汉抗击疫情第一线，不仅保障了武汉所需电缆供应，还为无锡车站、机场、港口、国省道、高速公路口等留验站提供电缆。  江苏东峰电缆有限公司总经理刘玉峰主动对接武汉火神山医院，在确认要货信息后，紧急召集员工返岗，连夜装车，第一时间把价值250万元的电缆送达医院，并捐赠了价值50万元的电缆。（来源：江苏广电无锡中心站刘康亮赵夏楠编辑徐金吉）
2020年02月29日,直通黄石丨为患儿健康保驾护航，他们在黄石当起临时“奶爸奶妈”_荔枝网新闻,荔枝新闻,b荔枝新闻讯b新冠肺炎疫情暴发以来，湖北的患者救治情况一直牵动着无数人的心，其中儿童患者尤其令人牵挂。今天（2月29日），荔枝特报黄石报道组记者走访了黄石市妇幼保健院，看看江苏援黄石医疗队队员们在前方都采取哪些治疗手段？江苏援黄石医疗队队员、南京儿童医院急诊医学科副主任医师李灼介绍，目前黄石市的儿童感染大多是家庭聚集引起，但病例以无症状和轻型感染为主，平均病程大多在10天左右。与成人相比，新冠肺炎儿童患者有两大不同，一是对用药不会有强烈的炎症反应，从而发生对自身的损害；二是儿童没有基础疾病，不会引发相关并发症。但同时儿童患者的救治也有一些难点：第一，孩子会条件反射，看见医生穿隔离服过来，就知道要打针了，就会不配合；第二，孩子的静脉比成人要更难找，儿童坐的时间长点、年纪小点的打针就会比较困难；第三，医务人员都是戴三层手套，再加上护目镜、面屏，操作起来很不方便。由于母亲在待产期间被感染，有些婴儿刚刚出生即被确诊，需要待在无陪护病房进行隔离治疗。宝宝的病情牵动着全家的心，由于不能探视，家人往往心急如焚，这其中所有的护理和沟通联系等大量工作全部由护士来完成。针对母婴分离引发的家长焦虑情绪，护士们也会提供一些健康教育知识，并时刻关注他们的心理问题。和成人病房不同的是，新生儿需要一直睡暖房，足月儿的暖房设置在22-24度，早产儿的暖房设置在24-26度。在这种环境下穿着厚厚的隔离服进行护理工作，江苏援黄石医疗队队员、苏州儿童医院新生儿科护士长郭宏卿直言，自己差点就被闷虚脱了：“里边所有的消毒都是护士来做，干体力活的时候就感觉特别热、特别闷，汗沿着头发、沿着后背往下流，后背都湿透了，现在适应点了会好一些。”对于年纪大点的儿童患者来说，他们并不清楚自己得了什么病，每当看到医护人员像外星人一样穿着严密的防护服，心中难免产生恐惧和紧张。对此，医务人员开始学习在防护服上画黑猫警长、小猪佩奇等卡通人物，来“讨好”孩子们。由于防护服每穿一次就要被销毁，所以每一件漫画都是独家定制。江苏援黄石医疗队队员、南京儿童医院重症监护室护士长张少华告诉记者，对于医护人员们来说，其实这也是他们释放压力的一种方式，大家十分珍惜每件“作品”，每次画完都会拍照留念：“家长们挺配合我们，也很感谢我们。有一位家长说，将来等孩子长大了，一定要把这个画画的故事讲给他听。”江苏援黄石医疗队进驻以来，黄石市妇幼保健院先后有三位患儿康复出院，病区内其他患儿的生命体征也基本稳定，没有危急重症病例。专家团队对收治病例正在进行严密观察，提供完善的监护和治疗。在接下来的日子里，期待有更多的患儿可以治愈出院。（来源：荔枝特报黄石报道组王德俭王晟编辑梁瑄）
