2020年03月07日,警察，警嫂，母亲：面对三重身份  这位监区女警会怎样抉择？_荔枝网新闻,我苏网,trog我苏网讯trog新冠肺炎疫情暴发以来，扬州市公安局监管支队女警丁香芹，已经整整一个月没有走出过高墙了。她没有想到的是，会与爱人用一种出人意料的方式重逢。2月28日，她接到通知，将某监室在押人员提到视频提讯室内。刚进入提讯室，意外出现了。在视频那头，前来提审的案件主办人竟是自己的爱人陆叶！这么近，那么远！这一对一个月没见面的警察夫妻，就这样在隔空提审时偶遇了。“虽然工作之余也会跟他视频，但这次我觉得咱俩真的算‘见面’了，因为他就在我单位门口的传达室，我觉得我们离得很近，特别开心。”丁香芹抑制不住内心的激动。trog警察，警嫂，母亲trog丁香芹和爱人陆叶，一个是监管民警，“外防输入、内防扩散”，为打赢监所疫情阻击战执着坚守；一个是网安警察，在网络空间打击犯罪，守护着正义与平安……既是警察，也是警嫂，还是两个年幼孩子的母亲，这三重身份背后，丁香芹承载的负担，常人难以理解。值班、加班、备勤与家庭生活交织在一起，但她与丈夫约定，既然选择就不要抱怨，既然坚持就绝不放弃，对待工作，相互支持、不拖后腿；对待家庭，齐心协力、共挑重担。随着疫情发展，1月26日，扬州市公安机关从春节休假转入战时机制，夫妻俩安顿好孩子，奔赴各自的战斗岗位。2月1日，江苏公安监管场所启动封闭管理工作模式，从一开始的15天延长到30天，再到“疫情不退、我们不撤”的铮铮誓言，丁香芹回家的时间一再延后。“说没有顾虑、没有犹豫是不现实的，毕竟两个孩子还小，我还是第一次离开他们这么久。”说到孩子，丁香芹有点哽咽。但“疫情就是命令，防控就是责任”，为了确保被监管人员绝对安全，身为警察又怎能徘徊不前？经过短暂的思想斗争，丁香芹主动递交了请战书，迈入彻底封闭的监区。两口子因工作隔空相遇那会儿，千言万语、百感交集，化作了一句简单问候：“你辛苦了，要多保重啊！”，“老婆你在监区安心工作，家里和孩子我会想办法照顾好的。”既是战友、又是爱人，为共同的理想信念而奉献，这，何尝不是一种幸福？ trog封闭在监区的唯一一名专职女管教trog扬州市看守所女子监区在押近300人，人员高度密集，加之女性情感复杂、思想容易产生波动，平时管理教育工作难度就很大。疫情防控时期，如何保证安全、保持工作有序、管理规范，这是丁香芹面对的首要问题。作为封闭在监区的唯一一名专职女管教，她围绕疫情可能会带给在押人员的担忧、恐慌心理，加强宣传、正面引导，坚持每天下监室主持“日小结”会，参与在押人员讨论，答疑解惑、及时纠正她们理解认识上的误区。通过科普新冠肺炎防控知识、讲解医学常识，督促在押人员重视个人卫生与健康、养成良好的生活习惯。隔离在监区的日子，每天都很忙碌，一天要下十几个监室、开上百道门、量数百次体温、不停地重复着某一句话……但丁香芹仍然希望事情能再多一点。“这样，我就没有时间想孩子和老公了。”除了日常工作以外，丁香芹还想借抗击疫情的契机，用正能量感化教育在押人员。她每天向大家宣传社会各界众志成城抗击疫情的感人故事，以及白衣天使们从全国各地奔赴湖北的奉献精神。在丁香芹教育感召下，女子监区608监室在押人员集体书写了《隔离病毒，不隔离爱》的表态信，表示“国家兴亡，匹夫有责”，自己虽然身份特殊，身陷囹圄，但为国家、为社会尽职、贡献的责任不能少，并郑重向看守所提出为抗击疫情捐款，尽一点绵薄之力。“疫情面前，舍小家为大家，是我们每一名公安干警应当做、也必须做的事情，虽然与家人分离多日，但我想无论多久，能用我们的‘自由’换来在押人员的生命健康安全，我和战友们都觉得值！”丁香芹对记者说。（来源：江苏广电扬州中心站王泽坤通讯员朱正茂滕一飞编辑苏月）
2020年03月07日,黑龙江：免减缓社保 8.2万户企业将减负近百亿_荔枝网新闻,中国新闻网,7日下午，黑龙江省政府新闻办公室就黑龙江省应对新型冠状病毒感染肺炎疫情防控工作有关情况举行第三十场新闻发布会。记者从会上获悉，黑龙江省印发了《关于阶段性减免企业社会保险费实施意见》，针对社会保险实施免、减、缓三项措施，初步测算，黑龙江省8.2万户参保企业将减轻负担近100亿元人民币。据黑龙江省人力资源和社会保障厅副厅长肇劲松介绍，“免”，就是2020年2月至6月，免征对应属期内黑龙江省各类中小微企业的养老、失业、工伤三项社会保险费单位缴费的部分，对以单位方式参保的个体工商户，也参照中小微企业给予免征。主要考虑是，中小微企业是中国经济发展的主力军，是吸纳就业的主渠道，但抗风险能力较弱，给中小微企业更大的支持力度，能帮助中小微企业缓解困境，促进企业的生存和发展，稳定和扩大就业。“减”，就是2020年2月至4月，减半征收对应属期内各类大型企业、民办非企业单位、社会团体等各类社会组织的养老、失业、工伤三项社会保险费单位缴费部分。主要考虑是，大型企业是国家的经济命脉，抗风险能力比较强，但受疫情影响，生产经营活动也遇到许多困难，通过政策支持可以对企业恢复生产起到积极作用。考虑到民办非企业单位、社会团体等其他参保单位因疫情影响也不同程度遇到了困难，这些单位也一并享受减半征收政策。“缓”，就是受疫情影响生产经营出现严重困难的企业，可以申请缓缴三项社会保险费，缓缴执行期为2020年内，缓缴期限最长不超过6个月，缓缴期间免收滞纳金。此外，2020年2月1日以后在减免期内新开工的工程建设项目可按施工总承包单位进行划型并享受阶段性减免工伤保险费政策。(完)
2020年03月07日,巴勒斯坦新冠肺炎确诊病例增至16例_荔枝网新闻,新华网,新华社拉姆安拉3月7日电巴勒斯坦卫生部长马伊·凯拉6日晚宣布，继5日约旦河西岸城市伯利恒出现7例新冠肺炎确诊病例后，6日该城又新增9例确诊病例。目前，巴勒斯坦新冠肺炎确诊病例已增至16例。出现确诊病例后，巴勒斯坦总统阿巴斯5日晚宣布，巴领土从6日起进入为期一个月的紧急状态。
2020年03月07日,马耳他确诊首例新冠肺炎病例 系一名12岁意大利女孩_荔枝网新闻,中国新闻网,中新网3月7日电据路透社报道，马耳他卫生部长7日表示，该国确诊首例新冠肺炎确诊病例，系一名12岁的意大利女孩。据报道，卫生部长表示，这名女孩病毒检测呈阳性。目前正在医院传染病科接受治疗，并称她“状况良好”。据悉，女孩上月底从意大利北部特伦蒂诺州返回，曾途经罗马，于6日报告了相关症状。
2020年03月07日,祝福！百岁老人今日治愈出院，系目前最高龄患者_荔枝网新闻,新华社,3月7日16时许，100周岁高龄的王大爷在湖北省妇幼保健院光谷院区顺利出院，成为目前最高龄的新冠肺炎治愈出院患者。同批还有80余名患者治愈出院。湖北省妇幼保健院光谷院区医护人员与当地接洽人员一道将老人送上车，并为老人准备了两周的康复药品。王大爷出生于1920年2月，刚刚度过100岁生日，经鼻咽拭子取样和核酸检测，王大爷达到出院标准，确定治愈，可以出院。据感染1科主任曾力介绍，老人于2月24日入院，除新冠肺炎外，还患有阿尔兹海默症、腹主动脉瘤、高血压、心衰等多种基础疾病，意识处于模糊状态。针对百岁老人复杂的身体状况，医院抽选呼吸重症、老年病等学科专家骨干，组建了专门的医疗团队和护理团队。在治疗上，多次邀请军队临床救治专家来院会诊，采取中药抗病毒、干扰素雾化吸入以及纠正电解质紊乱、低蛋白血症等方法进行救治，并对老人开展了2次新冠肺炎康复者恢复期血浆临床治疗，加强对老人神志及生命体征监测，取得显著疗效。截至3月7日，湖北省妇幼保健院光谷院区已累计收治60岁以上的老年新冠肺炎患者552例，治愈出院149例。医院针对老年人基础疾病多、自理能力差、代偿能力弱的普遍特点，实行“精准化”用药、“全程化”疏导、“个性化”配餐、“亲情化”护理、“常态化”咨询，最大限度提高治愈率、降低病亡率。
2020年03月07日,美星巴克一员工确诊感染新冠肺炎，工作店面已关闭_荔枝网新闻,环球网,美国咖啡连锁公司星巴克当地时间周五（6日）宣布，位于西雅图市中心的一家星巴克咖啡店一名员工确诊感染新型冠状病毒肺炎，该店已关闭并进行彻底清洁。据美国有线电视新闻网（CNN）报道，星巴克在周五的一份备忘录中表示，检测呈阳性的员工目前正在家中进行隔离。星巴克表示，该确诊病例工作的咖啡店已经关闭，当地卫生部门同意该店在进行清洁后可恢复营业，但并未宣布何时重新开放。星巴克还表示将继续遵循预防新冠病毒相关协议，涉及员工护理和来自美国疾控中心的专业知识。彭博社称，星巴克副总裁威廉姆斯在写给公司合作伙伴的声明中表示，他们在周四（5日）晚得知一名员工确诊后，立刻采取措施，关闭咖啡店并彻夜洗刷清洁。威廉姆斯说：“由于这是我们第一起确诊病例，我们认为有必要向大家通报。”据报道，也同样在本周，星巴克宣布暂时停止在全球门店使用个人杯子，以帮助防止新型冠状病毒传播。CNN介绍说，星巴克总部位于西雅图，其周边地区是美国新冠疫情暴发中心。此外，本周早些时候，微软、亚马逊和脸书等互联网巨头在公司出现新冠肺炎确诊病例后，开始鼓励员工在家办公。
2020年03月07日,比利时新增确诊病例60例，累计169例_荔枝网新闻,人民日报,比利时卫生部门3月7日发布消息，比利时新增新冠肺炎确诊病例60例，目前确诊病例总数为169例。据比利时媒体报道，比利时一名不到1岁的婴儿确认感染新冠肺炎。
2020年03月07日,一天捐赠400万元！伊朗驻华使馆致谢中国民众：你们是最可爱的人_荔枝网新闻,海外网,海外网3月7日电连日来，伊朗国内新冠肺炎确诊病例数字呈现不断攀升态势，这也时刻牵动中国民众的心。伊朗驻华大使馆4日在微博公布官方捐赠渠道，短短24小时之内，中国民众就捐赠近400万元人民币。6日，伊朗驻华使馆在中国国内社交平台发文向中国民众致谢。伊朗驻华使馆发文称，今天又是充满感动的一天。这一天，使馆看到了马云为伊朗筹集到100万只口罩的消息，一位卧病在床的老先生给使馆打来了慰问视频电话，还有一对老夫妇亲自到使馆捐赠。一些企业将多方筹措的防疫物资专程送到使馆，更有无数中国网友踊跃捐款捐物……细数种种，使馆在文末写道，“虽然我们可能无法得知每一位捐赠者的名字，但我们将永远铭记：你们是最可爱的中国人！”日前，中国民众通过自己力所能及的方式为伊朗人民送上慰问。伊朗驻华使馆4日在微博公布了官方捐赠渠道，短短24小时之内，中国民众就捐款近400万元人民币，仅通过微博渠道捐赠的款项就超过了200万元。使馆在微博上写道，“自公布捐款渠道以来，中国网友之间的爱心接力远超我们预期。感动之情无以言表”。此外，还有众多网友在使馆微博下留言声援伊朗民众，为他们加油打气。有网友表示“伊朗加油，滴水之恩当涌泉相报”，有的网友则暖心表白“疫情过去之后，我会去德黑兰走一走”，还有网友给伊朗打气，“加油，中国正在逐渐复工，能够给你们最大的支持”，“风雨过后终见彩虹，友谊万岁”。2月9日伊朗报告发现首例新冠肺炎确诊病例，随后疫情形势愈发严峻。在中国抗“疫”期间，伊朗曾向中方提供300万只医用口罩。作为全球第一个公开声援中国的外长，伊朗外长扎里夫更表示“无论顺境逆境，伊朗始终与中国人民站在一起”。如今，中国疫情得到初步遏制，我们也及时向伊朗伸出了援手。2月25日，中国驻伊朗大使常华代表大使馆和在伊有关中资企业紧急向伊朗卫生部捐赠25万只口罩和5000人份核酸检测试剂盒，助力伊朗抗击新冠肺炎疫情。 
2020年03月07日,伊朗新增新冠肺炎病例逾千例，累计达5823例_荔枝网新闻,新华社,新华社德黑兰3月7日电伊朗卫生部7日公布，截至当地时间7日上午，伊朗新增新冠肺炎确诊病例1076例，累计病例数升至5823例，其中死亡145例，治愈1669例。
2020年03月07日,日本新冠肺炎确诊病例增至441例_荔枝网新闻,新华社,新华社东京3月7日电据日本广播协会（NHK）电视台统计，截至当地时间7日19时（北京时间18时），日本国内累计确诊病例达到441例。日本福岛县、广岛县和群马县7日首次报告新冠肺炎确诊病例。此外，“钻石公主”号邮轮确诊病例数已调整为696例。
2020年03月07日,伊朗新冠肺炎确诊5823例145死 逾1.6万疑似病例入院_荔枝网新闻,中国新闻网,中新网3月7日电据外媒报道，伊朗卫生部门7日消息称，伊朗新增新冠肺炎确诊病例1076例，累计确诊达5823例，死亡人数升至145人。此外，伊朗目前有超过1.6万人疑似感染新冠肺炎，都已送往医院。另有1669人治愈出院。据悉，在伊朗首都德黑兰，有1539人感染了新冠肺炎。伊朗卫生部官员此前表示，新冠病毒疫情目前已蔓延至伊朗31个省份。当局表示，将设立检查站，限制主要城市间的通行，希望阻止病毒蔓延。
2020年03月07日,事实面前，美媒的“中国道歉论”不攻自破_荔枝网新闻,人民网,近日，美国福克斯新闻台一位名叫杰西·沃特斯的主持人，在节目中妄称新冠病毒源自中国，中国人应该就新冠肺炎疫情“正式道歉”。这是何其荒谬可笑的言论，充分暴露出像沃特斯这类美国人的“双标逻辑”，以及对中国根深蒂固的傲慢、偏见和无知。疫情是人类面临的共同挑战，病毒是人类的共同敌人，病毒感染从来没有国界。当前，疫情正在全球扩散蔓延，一些国家相继出现了来源不明的病例。世界卫生组织认为新冠病毒源头尚不确定。病毒源自何处尚无定论，就要求中国道歉毫无道理。美国前助理国务卿坎贝尔坦言，“中国严格的防疫措施为美国争取了时间”。但他对美国是否有效利用了这段时间抱怀疑态度。然而，沃特斯却急哄哄地拿中国来当本国防控失当的替罪羊，只会聚错焦、瞄歪靶，耽误疫情防控。疫情发生以来，中国同其他国家一样，都是病毒的受害者。但中国采取了历史上最勇敢、最灵活、最积极的防控措施，构建起了防止疾病国际传播强有力的第一道防线。正是看到中国的艰苦努力，全球170多个国家领导人和40多个国际地区组织负责人，对中国抗疫举措及其积极成效，以及为此付出的巨大牺牲和贡献，予以高度肯定；世卫组织干事布鲁斯·艾尔沃德感慨：“我们要认识到武汉人民所做的贡献，世界欠你们的”，甚至表示“如果我被感染，我希望能在中国接受治疗。”在国际社会公认的事实和对中国高度赞扬面前，要求中国道歉，沃特斯就如跳梁小丑一般让人不齿。执意煽动歧视和偏见，只会暴露其政治化病毒的别有用心，只会阻碍世界共同战“疫”的脚步。制造带有目的性的偏见与歧视，明眼人都不会买账。荷兰电台播放将华人和新冠病毒联系起来的歌曲，遭到5万人联名谴责；意大利那不勒斯市青年人发起“拥抱中国人”的快闪活动，很多民众参与其中，呼吁人们抵制歧视；一个关于“新冠肺炎亚裔歧视”的社会实验视频走红网络，显示出比利时社会对亚裔社区的温情和理解……哪里有歧视，哪里就有抵制，哪里就有温情对冲。这些真情交融、命运交织的案例，展现了“我们都是一家人”的情怀。这也说明，疫情面前，所谓“道歉论”不过是一些国家媒体“政治正确”下的又一个政治标靶。呼唤良知与正义，抵制偏见与不公，传递信心与力量，才是全球化时代的主流。正是共担风雨时，共同抗“疫”是正途。大疫即大考，考验的不只是人类智慧，更是团结精神。当前，世界需要的不是好事者的趁机聒噪，不是狭隘者的偏见和歧视，更不是西方一些媒体乱贴标签、刻意歪曲的不义之举。各国只有协调一致、科学应对，才能早日战胜新冠肺炎疫情，维护“地球村”的健康福祉。“中国道歉论”在事实面前不堪一击，不攻自破。沃特斯之流应该明白，比病毒更可怕的，是他们心中的“政治病毒”。国际观察：美国散布“中国道歉论”居心何在？就在中国人民站在抗击新冠肺炎疫情的第一线、如火如荼地开展捍卫人类生命斗争的关键时刻，美国一家媒体主持人竟然在其节目中信口雌黄地要求中国“道歉”，这充分暴露出美国部分人颠倒黑白落井下石的嘴脸，甚为可憎可笑。中国采取的应对举措得到国际社会广泛认同和支持。偏偏美国政府，好像在全世界也只有美国，从一开始就毫无道理地把矛头指向中国，对中国多方指责、发难，现在又恬不知耻地要求中国“道歉”，实在是没有任何道理可言。但是，既然事情发生了，总要问个究竟。思来想去，对此类“美国大佬”的言论大概有一种可能，就是“恶人先告状”，或者是“此地无银三百两”，企图嫁祸于人、遮人耳目。正如5日上午中国外交部副部长马朝旭所说：面对公共卫生安全这样的全球性挑战，是同舟共济还是以邻为壑？是并肩作战还是隔岸观火？是雪中送炭还是落井下石？这个答案是不言自明的。中国人民也好，世界其他多数国家的人民也好，都是在靠事实说话，比如造成“新冠肺炎”的病毒究竟来自何处，各方都在进行科学探究，寻找事实基础。尽管已经有了不少可疑源头的结论因素，但人们并没有“一锤定音”。其中，一些国际舆论认为中国是受害者、是在“替人背锅”，并非没有道理和依据。正如中国权威的呼吸病学专家钟南山院士近日所强调的，病毒首先出现在中国，但不一定发源于中国。中国作为一个负责任的大国，敢于担当，在此次抗击疫情的斗争中，除在国内取得积极成效外，也给世界作出贡献，为国际社会共同开展的这场斗争树立了榜样和标杆。采取最全面、最彻底、最严格的防控举措，中国始终坚守在疫情防控的最前线。中国为全球公共卫生事业作出的努力和付出得到了国际社会肯定和支持。世卫组织总干事谭德塞认为，中国强有力的举措为全球疫情防控赢得了时间。联合国秘书长古特雷斯也指出，中国举国动员应对严峻挑战，以巨大的牺牲为全人类作出了贡献。中国用实实在在的行动赢得了世界的普遍认同与赞赏，体现了负责任的大国担当，生动践行了构建人类命运共同体的承诺。然而，说到“道歉”，事实上人们不会忘记，在近几十年间，美国在全世界制造的多种灾难，有战争性质的、有经济性质的，也有危害人类健康的疫病性质的。2009年美国爆发的H1N1流感蔓延到214个国家和地区，当年就导致至少18449人死亡。也许，需要向世界人民道歉的应该是美国。那位主持人作为媒体人，从媒体应当坚守的事实、客观、公正立场出发，不妨试试去规劝美国政府，并且就要求其从检讨这次抗击疫情中的种种表现开始，因为美国在很多关键时刻的应对举措都是极端错误的，世界卫生组织已经多次指出，所以美国理应深刻检讨，大胆认错并公开道歉。不过，估计这位主持人在高喊“言论自由”的美国也绝没有这个胆量。“沉舟侧畔千帆过，病树前头万木春。”像美国这位主持人的小丑行径，永远不可能阻挡住中国人民的前进步伐，也永不可能抹杀中国人民在此次疫情面前，守在最前线所作的贡献。
