2020年03月07日,【专家观点】于凤霞：疫情对共享经济带来的“冲击”和“刺激”都是短期的_荔枝网新闻,新华网,近几年，共享经济在政策支持、需求释放等多重因素推动下呈现稳中向好发展态势。但年初爆发的新冠肺炎疫情，让以共享经济为代表的平台经济和各种新业态受到一定冲击。事物都有两面性。如何看待疫情对共享经济的影响？疫情之下，共享经济又面临怎样的机遇？化“危”为“机”，共享经济平台该怎么做？针对这些问题新华网专访国家信息中心分享经济研究中心副主任于凤霞。trog疫情对共享经济有“冲击”也有“刺激”trogtrog新华网：本次新冠肺炎疫情，对共享经济产生巨大影响。目前看，这种影响涉及共享经济中的哪些领域，有何具体体现？trog于凤霞：突发新冠肺炎疫情，不仅对宏观经济运行和国民经济各行业产生了巨大影响，而且以共享经济为代表的平台经济和各种新业态也受到了严重冲击。由于抗疫过程还在进行中，疫情的影响尚未全部呈现出来，因而无论是各级政府部门还是平台企业，都要对这一冲击的短期和中长期影响给予高度关注，并在动态监测、评估和预测的基础上加以切实应对。就共享经济而言，由于网络平台在各种产业活动中发挥的作用不同，因而，线下经济活动的骤然暂停，对不同领域共享经济的发展的影响也不尽相同。受疫情冲击最大的是线上线下融合程度高且必须通过线下活动完成整个交易闭环的领域。共享住宿、交通出行、家政服务等领域，由于受疫情防控措施的影响，平台上的服务需求骤降，平台企业的订单量和营业收入大幅减少。疫情在对部分共享经济领域产生较大负面冲击的同时，也对部分共享经济领域的需求产生了一定的“刺激”性影响。得益于互联网的快速普及和应用，在线下活动受到严重限制的情况下，大量的消费和生产活动被迫转到线上，共享医疗、教育等领域，短期内用户数量和交易量出现猛增态势，出现了与大势逆行的小高峰。trog化“危”为“机”，需要多方共同努力trogtrog新华网：危与机往往并存。共享经济平台如何化“危”为“机”，疫情之下，能洞察出哪些新机遇的信号？trog于凤霞：此次疫情虽然对短期内我国经济发展产生了巨大冲击，但如果疫情能在较短时间内得到有效控制，那么这种冲击在很大程度上就是暂时的。一旦疫情危机解除，被压抑和限制的消费与生产活动将恢复到疫情之前的正常状态，经济发展也将步入正轨，在宏观经济逐渐步入正轨的大背景下，共享经济等新业态也将再现往日的繁荣与活力。在抗疫期间，网络技术在各个领域的应用得到进一步深化，人们的在线消费习惯得到进一步培养；二是作为共享制造重要基础的产业互联网发展面临新契机，抗击疫情的同时又要促进经济发展，这种矛盾客观上对制度创新起到了显著的“倒逼”作用。这些都是未来共享经济新业态进一步发展的重要机遇。要化“危”为“机”，需要多个方面的共同努力。对平台企业而言,一个抓手是充分利用疫情期间强化企业内功。在那些需求短期内受到压抑但长期仍然存在的领域，平台企业需要认真思考疫情结束后如何尽快把握住市场恢复甚至是反弹带来的新机会；对那些短期内因线下活动受限而业务暴增的平台来说，则需要全力提升用户粘性，积极探索有效的商业变现模式，努力将那些疫情期间被动转向平台的用户转化为能够带来源源不断收入的忠诚用户。trog新华网：对一些平台来说，解决眼下面临的经营难题是当务之急。推动共享经济行业复工复产、为它们纾解困难，您有什么建议？trog于凤霞：短期看，面对“冲击”，要最大限度地控制成本和寻找新的收入来源，活下去才是硬道理。一是目前国家和地方相关部门都陆续推出了一些帮助企业共渡疫情难关的优惠政策，特殊时期平台经济企业需要高度关注政策动态，结合自身情况充分利用好扶持政策。二是可以充分发挥技术和用户积累方面的优势，积极寻找特殊时期新的市场机会，探索新的业务模式。长期来看，全面提升企业的数字化和平台化水平则是所有企业，尤其是传统企业，必须从战略上高度重视并从实践层面务实推进的一项艰巨任务。trog降本增效、开源节流将成今年企业的首要选择trogtrog新华网：疫情就是大考，对共享经济行业来说也是一次洗牌。经此一“疫”，您怎么看待未来一个时期共享经济的发展情况？trog于凤霞：总体上看，疫情对共享经济企业带来的“冲击”和“刺激”都是短期的。“冲击”根本上说是因线下经济活动被迫中止而“传导”到线上的，但市场需求和供给能力只是短期被压制，长期则仍然存在。因此随着线下相关产业发展走向正轨，平台相关业务有望很快得以恢复甚至是加速反弹。另一方面，短期内骤增的需求和供给能否持续、商业模式是否有效、行业发展是否真正迎来新的发展拐点等，都有待市场和时间检验。在上述背景下，降本增效和开源节流将成为2020年平台企业经营策略的首要选择；从拼规模和速度，转向拼品质、服务、安全等的趋势也将会更加明显，能否为用户带来更好的体验和更多的价值，也将成为未来市场竞争的关键。在竞争加剧的同时，行业洗牌和格局调整的步伐也将加速，那些拥有较强的技术支撑能力、更好的用户基础和服务体验、更加完善的生态圈的平台企业有望在新一轮竞争中胜出，头部聚集效应进一步显现；处于行业尾部的数量众多的中小平台，则在日趋激烈的竞争中处于不利地位，面临随时被淘汰出局的风险。trog共享经济平台为抗击疫情贡献力量trogtrog新华网：作为行业研究人员，您怎么评价在抗击疫情过程中，共享经济做出的贡献？哪些平台、哪些创新的举措令人印象深刻？trog于凤霞：疫情期间一些共享医疗平台，如微医、好大夫、平安好医生等平台均开设了在线问诊服务，联合来自全国各地医疗机构的医生为公众提供免费服务。这些平台帮助人们了解疫情动态、普及相关知识和缓解焦虑情绪等发挥了重要作用。再比如一些企业根据抗疫需要，紧急上线医疗物资信息资源共享平台，高效对接和匹配医疗机构防护物资需求、生产企业医疗物资生产原材料和物流资源的供给需求。产能共享平台在提升社会应急管理能力方面的作用在抗疫期间得到充分体现。疫情的发生还激发了平台企业的模式创新。盒马生鲜、7FRESH等生鲜电商平台与西贝、云海肴等餐饮企业开展“员工共享”，大量待业的餐饮员工转入生鲜电商平台，从事装配、拣货等工作。这种模式一举多得，既降低了餐饮企业在营收锐减的情况下仍需负担高额人力成本的经营压力，也一定程度上弥补了疫情造成的餐饮员工的收入损失、稳定了就业，同时也大大缓解了生鲜电商平台用户需求激增而导致的人手紧缺问题。
2020年03月07日,安徽：科技引领 开足马力_荔枝网新闻,经济日报,安徽省集聚科技力量，精准发力，一面加快恢复经济社会生活秩序，一面谋篇布局战略性新兴产业发展，千方百计把疫情损失补回来。一场疫情，两场战斗。3月初，安徽省“双线”传来好消息——截至3月6日，全省16个市已有14个市实现新冠肺炎患者“清零”，在院患者减至5例，治愈率达98.9%。另一条战线——精准稳妥推进复工复产，目前，安徽省属企业全面复工；截至3月5日，全省规模以上工业企业复工率已达99.1%，达到往年同期水平；2月份重大项目集中开工251个，总投资1253.8亿元。在坚决打赢疫情防控阻击战的同时，安徽省精准施策、科学安排，继续积极发挥科技优势，扩大创新成果，一面加快恢复经济社会生活秩序，一面谋篇布局战略性新兴产业发展，千方百计把疫情损失补回来，争取更高质量发展。trog科技战“疫”展实力trog针对突如其来的疫情，多年来在科技方面集聚力量的安徽省精准发力。针对新冠肺炎疫情防控工作中亟待解决的关键技术难题，安徽省迅速启动了一批科研项目。在安徽省疾控中心，“新型冠状病毒基因分子变异与进化研究”项目组在2月17日成功分离到2株高滴度的病毒株，安徽成为全国较早分离出病毒株的省份；“新冠肺炎流行病学及临床特征研究”项目组联合中国电科38所安徽四创电子股份有限公司技术团队开发出新冠肺炎疫情分析研判系统，可实现疫情态势实时展示、疫情分析、人员关系图谱等功能。合肥市重点推动发展的生命健康产业在疫情防控中大显身手。兆科药业（合肥）有限公司自研药品重组人干扰素α2b凝胶被列入“安徽省应急药品生产企业目录”和“工信部重点物资保障信息监控平台”，成为本次疫情防控的紧急战略物资；在疫情防控期间，影联云享医疗公司开发的“影像云远程医疗平台”已通过远程影像会诊在线筛查88000余病例，最大程度减少人员流动，切断新冠肺炎的传播途径；云之迹信息公司开发的“智能上下电梯跑腿送物机器人”目前已在武汉火神山医院部署使用。人工智能也普遍应用于疫情防控。科大讯飞AI“立体化科技防控方案”利用人工智能辅助各级卫健委、基层医生构建基层疫情防线。trog创新发展抢机遇trog科技的力量增强了安徽省部署战略性新兴产业的信心。2月25日，一场“云签约”让总投资1020亿元的重大产业项目落户安徽合肥。形式简单，内涵却关乎安徽省战略性新兴产业布局的再拓展。投资额最大的是以色列高塔半导体模拟芯片工厂项目，超过400亿元。芯片被誉为“现代工业粮食”。在“2019世界制造大会”上，总投资超过2200亿元的合肥长鑫集成电路制造基地项目在合肥签约，其中长鑫12英寸存储器晶圆制造基地项目总投资约1500亿元，长鑫存储是中国第一家投入量产的动态随机存取存储芯片（DRAM）设计制造一体化企业。时隔半年，这家全球排名第一的模拟代工厂大单落地，为合肥市打造“中国IC之都”又添一支“劲旅”。另一引人瞩目的是蔚来汽车中国总部项目，包括在合肥成立蔚来汽车中国总部，建立研发、销售、生产基地，打造以合肥为中心的中国总部运营体系。项目计划融资超百亿元，5年内将打造一个千亿元产值的龙头企业。安徽新能源汽车产业本有基础，南有奇瑞、北有江淮。创建于2014年的蔚来汽车，致力于打造中国高端电动汽车品牌。据悉，这场“云签约”8个签约项目聚焦新能源汽车、集成电路、医疗大健康、工业互联网、装备制造等高端前沿行业，与合肥市重点发展的集成电路、新能源汽车、生物医药、高端装备制造等产业集群高度契合，是合肥市乃至安徽省投资于未来、投资于战略的重大科技型项目，有利于全省产业升级，更对我国通讯行业、高端智能电动汽车领域实现自主可控发展、应对国际竞争具有重要意义。trog稳步有序保全年trog疫情当前，安徽省各地各部门想方设法、精准稳妥地推进复工复产。“要牢牢把握统筹‘两手’，善于化危为机、努力保持经济社会发展良好势头。千方百计把疫情影响降到最低。”安徽省委书记李锦斌在2月24日召开的省委常委会扩大会议暨统筹推进新冠肺炎疫情防控和经济社会发展工作部署会议上强调说。3月5日，合肥市和人民银行合肥中心支行联合举办“全面有序复工复产银企合作对接会”。合肥市睿力集成电路（科技类）、安粮控股（外贸类）、辉隆农资（畜牧养殖类）、滨投文创（文化旅游类）等12家企业在会上分别与国开行安徽省分行、进出口银行安徽省分行、农发行安徽省分行、工行合肥分行等12家银行签订了总额58.28亿元贷款规模的框架合作协议。安徽省发展改革委在做好疫情防控工作的同时统筹抓好“六稳”工作有关决策部署，近日会同安徽省财政厅预下达2020年省重大新兴产业基地奖励资金安排计划。计划明确，全省25个重大新兴产业基地各预下达奖励资金3000万元，累计7.5亿元，坚定企业尤其是中小企业发展信心，全力支持基地战略性新兴产业企业复工复产。安徽省经信厅抓实抓细疫情防控工作，科学落实防控措施。安徽省国资委积极帮助省属企业与属地政府、行业主管部门对接，及时协调解决企业复工管理、项目建设、生产资质核准等方面实际问题。截至3月3日，28户省属企业集团公司全面复工。
2020年03月07日,天津无新增新冠肺炎确诊病例 累计报告136例_荔枝网新闻,荔枝新闻,trog荔枝新闻讯trog2020年3月6日0－24时，天津市报告新型冠状病毒肺炎新增确诊病例0例，新增危重型病例0例，新增重型病例0例，新增死亡病例0例，新增治愈出院病例0例。截至3月6日24时，天津市累计报告新型冠状病毒肺炎确诊病例136例，出院病例128例，死亡病例3例。现有在院治疗确诊病例5例（危重型病例1例，重型病例0例）。其中：确诊病例中，宝坻区60例、河东区15例、河北区12例、和平区6例、南开区6例、北辰区6例、河西区4例、宁河区4例、东丽区4例、西青区4例、滨海新区3例、红桥区2例、武清区2例、津南区2例、外地来津6例；出院病例中，宝坻区56例、河东区14例、河北区11例、和平区6例、南开区6例、北辰区5例、河西区4例、宁河区4例、东丽区4例、西青区4例、滨海新区3例、红桥区2例、武清区2例、津南区1例、外地来津6例。目前追踪到密切接触者2412人，已解除医学观察2111人，尚有255人正在接受医学观察。
2020年03月07日,【专家观点】王辉耀：疫情之下，数字化供应链成撑经济的强劲动力_荔枝网新闻,新华网,新冠肺炎疫情是一起重大突发公共卫生事件，也是一场经济“大考”。受疫情影响，居民生活、市场消费、企业复工等都面临诸多困难，但疫情之下也有新的机遇：电商行业在抗疫情、保民生、撑经济中发挥了重要作用，并带动大量行业“逆势”发展，让人眼前一亮。这种劲头持续下去，电商行业将为疫情过后中国经济的快速恢复提供强劲动力。疫情发生后，各大电商为保障抗疫前线物资供应和居民生活物资供应提供了重要的后勤支持。阿里、京东等众多电商和物流企业迅速行动，为疫情严重地区打通物资通道，如京东自营供应体系与供货商高效配合，有效保证口罩、防护服、药品等物资及时到达前线医务人员手中，并通过数据挖掘推动上游制造商复工复产，显示了以数字化供应链为代表的“新一代基础设施”的鲜明特色。数字化供应链对打破农产品滞销困境、维持市场供求平衡也发挥了显著作用。疫情期间，一些往年供不应求的农产品因交通受阻或渠道商停工而出现滞销，电商的介入在很大程度上解决了这一问题。通过帮助农民开网店、直播带货促销、产地直营等手段，加上物流端倾向性运力支持，丹东草莓、奉节脐橙等优质农产品甚至以比往年更低的价格直达消费者手中。这种无接触购物方式降低了病毒传播风险，也让更多实体经济业者重新认识了数字化供应链的价值。疫情期间，消费者向线上消费大规模迁移，推动了电商扩大用工规模，对稳定就业具有重要意义。为帮助受疫情冲击最严重的中小型服务企业纾困，在关键时刻更好地承担社会责任，京东集团、达达集团联合采取灵活多样的用工形式，向社会提供超过35000人的就业岗位，通过余缺调剂、岗位共享等创新模式，努力缓解疫情对就业的冲击。在传统互联网零售业务基础上，疫情期间，网络教育、互联网医疗、网上办公、全渠道生鲜零售等新业务快速发展。一些消费者可能迫于疫情只能选择线上购物，疫情过后这部分流量可能回落，但这些新业务可能在疫情后仍呈上升趋势，因为其本质上顺应了未来智能城市发展潮流，并代表了产业互联网的未来——实体经济在互联网企业助力下迅速展开数字化升级转型。这些市场需求和升级进程被疫情提前激发，一些接受新生事物能力较差的群体，也开始主动使用这些新的功能，这在网络教育、互联网医疗等业务上表现得十分明显。开展一项新业务，初始阶段推广十分关键，一旦人们普遍了解和接受了这些更加便利的智慧应用，疫情结束后对互联网服务的依赖度和需求量就可能持续上升。互联网企业要避免疫情期间的强劲增长成为“昙花一现”，关键是要持续提升服务品质，并把数字化供应链等核心能力进一步对外开放，让这个春天成为产业互联网高速成长的新起点。首先，重视整合行业资源，避免粗放式扩张，通过优质服务保持客户“黏性”。疫情期间市场需求的激增，会导致相关行业规模快速扩张，一些缺乏经验的企业或商贩盲目开办网店，往往会遇到各种运营难题，最终资金回笼周期长，难以持续经营。在消费升级时代，单纯的价格战已无法赢得多数消费者的青睐，不断优化服务、提升性价比才是打造口碑的根本路径。这也为大型互联网企业提出了更高的要求——应当更好地开放核心能力和资源，打造产业互联网的新一代基础设施，为更多行业数字化升级提供有效支持和路径。第二，不断创新运营模式，打造新的竞争优势。疫情期间出现的“共享员工”等新的共享经济、创新经济模式，给未来企业运营带来了更多可能性。如何让这些新模式成为统筹整合社会协作网络、大幅提升生产效率的法宝，而非披着“共享”“创新”外套的泡沫，是未来互联网企业挖掘竞争新优势需要解决的重要问题。第三，加强国际合作，通过海外客户增加流量。此次新冠肺炎疫情已经演变成为一场全球性挑战，国际合作在抗击疫情中的价值更加凸显。电商作为沟通货物交流的重要桥梁，进一步开展跨境合作，可成为国内互联网零售发掘增量的途径。中国电商行业在全球处于领先地位，疫情期间互联网服务发展又上升到新的高度，中国可以通过国际合作将这些经验与各国分享交流，实现互利共赢。疫情使中国面临的经济挑战显现，如何转“危”为“机”，推动经济快速恢复，需要我们的认真思考与艰苦努力。网络技术与现代物流的创新发展造就了电商行业，电商行业也显示出了应有的社会责任担当。相信通过抗击疫情的磨练与考验，电商行业能够激发出无限潜力，打造好以数字化供应链为代表的“新一代基础设施”，助推中国经济稳健强劲高质量发展。（作者系国务院参事、全球化智库CCG主任）
2020年03月07日,不让一个同学掉队，江苏高校出台大学生就业帮扶政策_荔枝网新闻,我苏网,近日，教育部印发《关于应对新冠肺炎疫情做好2020届全国普通高等学校毕业生就业创业工作的通知》，就进一步指导推动各地各高校积极应对新冠肺炎疫情，开展网上就业服务等工作，作出部署安排。通知发出后，江苏高校积极响应，出台一系列措施帮助学生找工作。  “一个字，‘快’！”对于刚刚结束了三场面试的南京信息工程大学应届毕业生蒋晋雅来说，此刻用“快”来形容网络招聘会再合适不过。她已经收到其中一家的入职通知，即将成为一名在线辅导老师。“学院老师也为我们提供了一些招聘网站和招聘信息，给我们带来了很大的帮助。”  蒋晋雅参加了学校举办的2020年春季网络招聘会，招聘会吸引了429家企业参会，提供3万多个职位，受到近4万人次关注。同时，学校还结合就业形势，举办空中宣讲会、线上就业指导。  “今年可能会出现一个新的情况，学生8月底，甚至年底才能实现就业，学校会持续地做跟踪帮助，直到他找到工作为止。”南京信息工程大学学工处副处长王贤芳介绍。接下来学校还将分学科专业举行多场专场招聘会。  近日，南京航空航天大学举办了一场特殊的校友企业"宣讲会"，邀请来自北京、上海、深港澳等地近70位校友企业家，在分享南航人责任与担当的同时，为在校生指引前进方向。此外，学校还出台"一对一"的精准帮扶政策。“经过调研，每个学生计划找工作还是考研，我们手中有本账，以便开启精准帮扶。”南京航空航天大学就业创业指导服务中心主任许爱华说。党员、教师和求职同学开展一对一帮扶，已经找到工作的同学和没有找到工作的同学一对一结对，形成覆盖全体毕业生的网格化就业帮扶局面，保证不让一个同学掉队。（来源：江苏广电融媒体新闻中心王建华王健安编辑国正）
2020年03月07日,韩国新冠肺炎确诊病例新增483例，累计6767例_荔枝网新闻,人民日报,韩国中央防疫对策本部7日通报，截至7日零时，韩国较6日零时新增新冠肺炎确诊病例483例，累计确诊病例达6767例，共出现44例死亡病例。
2020年03月07日,连续11日无新增：3月7日重庆市新冠肺炎疫情情况_荔枝网新闻,荔枝新闻,新增治愈出院病例中，万州区2例、沙坪坝区1例、长寿区1例、潼南区2例、忠县1例、彭水县1例。截至3月6日24时，重庆市现有在院确诊病例50例（其中重型病例3例、危重型病例1例），累计死亡病例6例，累计治愈出院病例520例，累计报告确诊病例576例。累计追踪到密切接触者23640人，已解除医学观察23375人，尚有265人正在接受医学观察。重庆市卫生健康委提示：从今日开始，重庆市新冠肺炎疫情情况由每日上午7点前发布调整为每日上午9点前发布，相关疫情分析在每日下午重庆市新冠肺炎疫情防控工作新闻发布会上发布，如无新闻发布会则通过其他方式发布。
2020年03月07日,海南无新增新冠肺炎确诊病例 现存确诊住院病例4例_荔枝网新闻,荔枝新闻,trog荔枝新闻讯trog3月6日0-24时，海南省报告新型冠状病毒肺炎新增确诊病例0例，新增重症病例0例，新增死亡病例0例，新增出院0例。截至3月6日24时，海南省累计报告新型冠状病毒肺炎确诊病例168例，重症病例1例，死亡病例6例，出院病例158例。确诊病例中，海口市39例、三亚市54例、儋州市15例、文昌市3例、琼市6例、万宁市13例、东方市3例、澄迈县9例、临高县6例、昌江县7例、陵水县4例、定安县3例、保亭县3例、乐东县2例、琼中县1例。截至3月6日24时，追踪到密切接触者6315人，已解除医学观察6086人，尚有229人正在接受集中医学观察。
2020年03月07日,内蒙古无新增新冠肺炎确诊病例 现存确诊9例_荔枝网新闻,荔枝新闻,trog荔枝新闻讯trog2020年3月6日7时至7日7时，内蒙古自治区报告无新增新冠肺炎确诊病例，无新增疑似病例，无新增治愈出院病例，包头市昆都仑区1例重症病例转为普通病例。截至3月7日7时，内蒙古自治区累计报告新冠肺炎确诊病例75例，现存确诊病例9例，治愈出院65例，死亡病例1例，重症病例1例，疑似病例1例。其中，现存确诊病例9例为：1.包头市3例（土默特右旗2例、昆都仑区1例）2.通辽市的霍林郭勒市2例3.呼和浩特市玉泉区1例4.乌兰察布市化德县1例5.锡林郭勒盟锡林浩特市1例6.赤峰市翁牛特旗1例重症病例1例（锡林郭勒盟锡林浩特市1例）。疑似病例1例（呼伦贝尔市莫力达瓦旗1例），仍在定点医院接受隔离治疗。目前，尚在接受医学观察的密切接触者113人，其中，外省市区新冠肺炎病例密切接触者18人。当日解除医学观察19人。
