2020年03月07日,至尊公主号确诊21名新冠病毒肺炎患者_荔枝网新闻,人民网 ,人民网旧金山3月6日电 当地时间3月6日周五，美国副总统彭斯宣布，4号就停泊在旧金山雷奇蒙外海的“至尊公主”邮轮上确诊21名新冠病毒阳性患者。目前该邮轮仍未被允许靠岸。据悉检测套件通过直升机送抵船上，共有46人接受了新冠病毒检测，其中21人新冠病毒检测呈阳性，24人呈阴性，1人检测待完成。在感染的21人中，19人为工作人员，2人为乘客。船上乘客加上船员共约3500人。彭斯表示，本周末将采取措施，将“至尊公主”停靠在一个非商业码头，陆续让3500名船上人员接受新冠病毒检测。中国驻旧金山领馆通报记者，“至尊公主”号上目前有11名中国籍工作人员。中国驻旧金山领馆已经跟他们取得了联系，提醒他们注意加强个人防护。目前他们健康状况稳定，而乘客中是否有中国籍游客正在进一步核实中。中国驻旧金山领馆高度重视中国公民的安全与健康，将根据疫情情况和当地有关规定，向船上中国公民提供领事保护与协助。当地时间本周三晚上，加州州长纽森表示，在评估出风险之前不允许该船靠岸。今天的消息说政府正对“至尊公主”号乘客进行评估，但尚未允许邮轮靠岸。至尊公主号邮轮公司位于旧金山市区渔人码头27号码头。彭斯说，我们知道，这趟邮轮分了两趟，在第一趟中，已经有人被感染，而目前船上的是第二批上来的。并形容局面“veryverydifficult.”3月4日一名新冠肺炎患者，在北加州的Plcercouty死亡，在追溯其接触史的时候，发现他在2月11日到21日搭乘旧金山-墨西哥-旧金山的至尊公主号邮轮。同船的游客大部分居住在加州。目前未被允许靠岸的至尊公主号实际上是开启第二程旧金山一夏威夷中途被追回。追踪显示北加州目前已确诊的病例中有6人与死亡的老人同一时间在同一邮轮。其中还包括一例老人居住在Suyvle，他没有做新冠肺炎检测，在昨晚死亡，高度疑似新冠肺炎。与他密切接触，实施CPR的警员，共7人现在均被隔离。
2020年03月07日,意大利新冠肺炎新增死亡病例49例 累计死亡197例_荔枝网新闻,参考消息,参考消息网3月7日报道据法新社报道，意大利6日报告新增新冠病毒肺炎死亡病例49例，累计死亡病例增至197例。这是单日死亡人数最多的一天。意大利新增新冠肺炎确诊病例也猛增了778例，累计确诊病例达到4636例，为除中国、韩国与伊朗之外确诊病例最多的国家。 
2020年03月07日,IU为抗疫捐3亿韩元和物资 网友收到干洗手表感谢_荔枝网新闻,新浪娱乐,新浪娱乐讯据台湾媒体报道，韩国女歌手IU人美心也美，近来新冠肺炎疫情升温，截至6日上午数据统计韩国确诊人数来到6593人；IU一开始先捐了韩币2亿元（约116万人民币），尔后又再度慷慨解囊，自5日为止共捐了5次款项，总和逾韩币3亿元（约175万人民币）以上。近来，灾区居民也收到她捐赠的物资，在网络上PO出她给的干洗手，当事人感动直呼“IU谢谢你”。近来，有网友在网络上PO出收到居民中心的短信通知，内容为歌手IU为了预防新冠肺炎所捐赠的物资，每个家庭可领到一罐500ml的干洗手，当事人感动表示“谢谢IU”，贴文被公开后，大批粉丝回应“IU真的是天使”、“IU最棒”、“IU总是让人很暖心”。事实上，IU光是此次新冠肺炎疫情便分别捐赠了5次捐款，除了捐给公益单位团体，瑞草区、京畿道果川市、杨平郡等疫情区也分批捐款，就连各地的保健所都照顾到，且不只金钱上的帮助，她还备了干洗手等物资，令民众感动不已。韩国新冠肺炎确诊人数急速上升，演艺圈纷纷做出行动救援，各大咖捐款出力量，日前政府也宣布幼稚园、国小、国中、高中延期开学，部分大学也改成暂时网络授课，盼望这场浩劫赶快度过。
2020年03月07日,韩新冠肺炎病例达6767起48死 大韩航空又一空乘确诊_荔枝网新闻,中国新闻网,中新网3月7日电据韩媒7日报道，截至目前，韩国新冠肺炎累计确诊病例达6767例，死亡人数已增至48人。据韩国中央防疫对策本部，多数死亡病例为患有基础疾病的老年患者。此外，约60%的确诊病例与大邱“新天地教会”有关。据报道，大韩航空公司和当地政府官员6日说，该公司又一名机组人员已被诊断出感染新冠病毒。这名36岁的大韩航空空乘人员曾于上月底，在洛杉矶至仁川的航线上进行服务。而在2月25日，一名大韩航空机组人员已被确认为新冠肺炎患者。这名乘务人员也在同一架从洛杉矶起飞的航班上服务。此外，疫情严重的大邱市封锁了一栋住宅大楼，市政府6日发布住户通知，表示大楼将进行出入管制，并禁止快递和外送服务。这栋大楼已出现46名确诊患者。防疫当局指出，因为同栋住宅大楼内有连续出现肺炎确诊患者，所以采取封楼措施。住民表示，大楼内广播“请别上班，大楼将隔离到15日”等消息。
2020年03月07日,中华医药 抗击疫情丨“肺炎1号方”疗效显著 中医战“疫”因时因地因人_荔枝网新闻,央视新闻,疫情之下新冠肺炎确诊病例的数字变化牵动着每一个人的心广东是除湖北外感染人数最多的省份也是治疗、救治最有效的省份之一这背后少不了中医药治疗发挥的作用《中华医药抗击疫情》第三集，讲述中医药治疗在新冠肺炎救治中发挥的重要作用。1月23日，广东省启动了重大公共突发卫生事件一级响应，并迅速成立中医药防控专家组，围绕临床救治、综合防控、疫苗研发和药物研制等多方面进行攻关。时隔17年，中医药再次走上广东抗击疫情的“主战场”，为救治患者发挥重要作用。截止到2月26日8时，广州市第八人民医院共收治新冠肺炎确诊病人是297例。其中，中医科收治了63例新冠肺炎确诊病人，并用“肺炎1号方”进行治疗。目前，我们收治的患者的情况是：2例病人病情加重，转ICU治疗；其他病人基本上全部是明显好转，43例病人已经出院了。救治过程中，“肺炎1号方”发挥了快速改善临床症状、增强身体的抵抗力、抑制肺部的炎症和调节肠道菌群平衡等作用。各地的方子“不同”，是因为中医的认识是整体观念和中医治疗讲究“因时、因地、因人”，特别是用药习惯。地区之间存在差异，南方地区喜欢用清解的药，而武汉地区比较寒，可能也用一些温的药或者化湿的药。个体之间也有差异，有些老年人有其他的基础病，特别是有肺部的基础病，如慢阻肺、哮喘，这会使得患者成为重症患者。我认为，浙江省在这次疫情防控工作中“精准施策、行动迅速、执行有力”。在中医药防治方面，浙江省要求“关口前移”，中医全程参与、中西医协同，也就是说不等到病人发病的时候用药，而是在他没有发病之前，就事先采取措施。在中西医协同方面，中医药防治对轻症、普通型患者的症状改善是比较明显的；对于重症或者危重症的患者，中医药治疗提高疗效。
2020年03月07日,江北新区多部门对一违规活禽宰杀点进行联合查处_荔枝网新闻,荔枝新闻,trog荔枝新闻讯trog自从新冠肺炎疫情爆发以来，取缔活禽养殖宰杀一直都是疫情防控工作的重中之重，随着疫情减轻，一些违法的活禽养殖宰杀点也复苏了起来。3月5日，根据市民举报线索，江北新区城管执法大队联合有关部门来到花旗村，找到了这处隐藏在田地里的非法宰杀点。执法人员在现场发现，该宰杀点仅由几间简易披棚搭建而成，披棚边上堆了上百个装满活鸡活鸭的铁笼子，以及用来宰杀家禽的塑料盆、水桶等器具。门前的道路上泥泞不堪，布满了污水、鸡血、鸡粪便等混合物，严重影响卫生环境。看到有执法人员前来检查，负责人李某解释道，宰杀的都是自己养殖的活禽。当执法人员要求其出具养殖经营手续时，李某表示没有办理，这才承认这些活禽都是从市场上批发来的，自己宰杀后给饭店菜场等营业场所供货。市场监管部门的执法人员立即对现场作业工具进行查封，责令其限期整改，立即停止活禽宰杀行为，并对宰杀场地进行消杀。在执法人员对于防疫期间活禽养殖法律法规的宣传教育后，李某表示一定全力配合现场整改，立即将现有的活禽全部装车运走。  疫情防控期间，宰杀贩卖活禽是控制传染源的重要举措。后期，江北新区综合执法部门将持续健全和落实违规活禽交易防控工作，对没有合法经营手续的非法养殖屠宰点坚决予以打击和取缔。（编辑高若婷）
2020年03月07日,苹果确认iPad Air 3会出现永久性黑屏：用户可免费维修；德国新增239人确诊，疫情最重州照常举办5万人足球赛_荔枝网新闻,每日经济新闻,trog1丨苹果确认iPdAir3会出现永久性黑屏：用户可免费维修trog苹果官方给出公告称，iPdAir3可以免费进行维修，因为少数设备会出现永久性黑屏。在设备黑屏之前，可能会出现短暂的闪烁或闪光。公告中显示：受影响设备的生产日期为2019年3月至2019年10月之间。trog2丨德国新增239人确诊疫情最重州照常举办5万人足球赛trog据中新网消息，德国权威机构最新公布的数据显示，截至当地时间6日15时，德国共确诊感染新冠肺炎639人，较前一天增加239人。尽管确诊人数增速持续高企，在疫情最严重的北威州，一场预计有超过5万观众到场的德甲赛事仍将于7日如期开赛。负责发布德国最新疫情数据的罗伯特·科赫研究所公布的截至当地时间6日15时的数据显示，639例确诊感染者中，西部的北威州和南部的巴伐利亚州两地分布最多，分别为329例和117例。门兴俱乐部方面发布的信息显示，可容纳54022名观众的普鲁士公园球场7日当晚球票已全部售罄。门兴方面表示，其已向所有来自海因斯贝格县的购票观众提议，呼吁他们自行放弃观赛并获得全额退款，同时还能够获得前往下一场在当地举办的欧洲杯主场比赛免费观赛的资格。trog3丨上海对疫情严重国家（地区）入境人员100%流调将加大瞒报处罚trog上海海关副关长蒋原透露，目前，上海海关对来自疫情严重国家（地区）的入境人员启动100%流行病学调查，并将加大对瞒报行为的惩处。trog4丨泰国新增2例确诊新冠肺炎病例累计确诊数达到50人trog据央视新闻，3月7日，泰国卫生部在新闻发布会上透露，泰国新增2例新冠肺炎确诊病例。2个确诊病例都是泰国籍，他们一位是50岁男性，目前正在Rjvithi医院接受治疗；另一位是40岁男性，目前正在NortRjthee医院接受治疗。两位新确诊的患者与第45例确诊患者有密切接触，此前都是从意大利返回。截至目前，泰国累计确诊病例50例，治愈病例31例，仍在医院治疗中18例，死亡1例。
2020年03月07日,@涉外企业，帮扶福利有哪些？看这里！_荔枝网新闻,经济日报,受新冠肺炎疫情影响，涉外企业面临较大压力，一边是疫情防控，一边是复工复产，要想做到稳经营稳发展，政策支持和金融支持都不能少。浙江省宁波市拥有较多涉外企业，对其中一些企业来说，将迎来六项专项服务，包括投放100亿信贷、提供低成本资金、发放再贷款、减免结算费用、提供结算便利、延长还款期限等。哪些企业能享受到这些福利呢？生财君了解到，此次宁波市商务局与宁波银行推出的六项措施，主要是面向重点涉外企业和疫情防控企业两类企业。其中，重点涉外企业包括：宁波全市2019年进出口额在300万美元以上的外贸企业；走出去企业和外商投资企业；机电及高技术产品出口、能源及大宗商品进口、跨境电商、数字贸易、服务贸易、优质商品进口等“225”外贸双万亿行动重点发展领域的企业。疫情防控企业包括:为应对疫情提供医用防护服、隔离服、医用及具有防护作用的民用口罩、医用护目镜、新型冠状病毒检测试剂盒、负压救护车、消毒机、消杀用品、红外测温仪、智能监测检测系统和相关药品等生产企业和境外采购服务的涉外企业。对于支持范围内的企业，宁波银行开展专项“助企业复工，送惊喜好礼”活动，在信贷规模、融资产品、发放再贷款、费率减免、结算便利、贷款延期等方面提供支持。trog措施一：设立专项信贷规模trog宁波银行安排100亿元信贷规模，定向投放两类重点企业，保障企业合理流动性需求，帮助企业尽快复工复产。trog措施二：提供低成本资金trog宁波银行针对企业不同融资需求，为两类重点企业提供优惠融资服务。包括——人民币贷款：经银企协商，宁波银行可提供临时免息贷款，提供不跨月优惠贷款，解决企业临时资金需求。国际贸易融资：对于支持范围内的企业，提供免息补贴，最长可以享受国际贸易融资利息减免30天的优惠。票据贴现：对生产制造型企业、民营企业和小微企业提供票据贴现优惠利率，较现有报价下浮20BPS。外币融资：向涉外企业推荐外资银行贷款，包括美元贷款和欧元贷款，最长可以减免1个月的跨境保函费，跨境贷款利率降低20BPS。融资租赁：宁波银行全资子公司永赢租赁向出口制造型小微企业提供融资租赁服务，帮助企业盘活存量设备，解决新设备购买资金需求，期限最长3年，分期还款。3月底前登记意向企业可享受首期租息减免、保险费用全包等优惠。trog措施三：发放再贷款trog对列入疫情防控重点保障名单内企业，发放再贷款，贷款年利率不高于3.05%，保障疫情期间各类防疫抗疫物资顺利恢复生产。trog措施四：减免结算费用trog针对企业日常交易结算业务，减免网银转账手续费和年费；针对企业进出口业务，推出零收费计划，2020年4月30日前免除外贸企业的汇款手续费、电报费，出口托收、信用证交单费等结算费用。trog措施五：提供结算便利trog宁波银行发挥科技金融优势，提供全线上的快捷服务。包括——贷款业务：通过网银可实现线上还款、线上申请。票据业务：全线上操作，贴现业务秒级出账；开票业务分钟级出票；国际业务：全面开放汇入汇款确认、汇出汇款、结汇、信用证开证／承兑及付汇、进出口贸易融资等线上交易渠道，确保企业零接触、零等待，足不出户办理各类外汇业务。其中进口企业防疫物资的付汇业务可通过网银办理购付汇并全免手续费，2小时内确保汇出，疫情相关的汇入款支持在线确认、实时入账或结汇。trog措施六：延长还款期限trog受疫情影响还款困难的企业，贷款还款期限最长可延长至2020年6月30日，延期期间提供征信保护，不视为违约。据悉，这是宁波银行抗击疫情、帮扶企业的又一重大举措。2020年2月以来，宁波银行已通过投放小微企业专项免息贷款、提供费率优惠、实施“无还本续贷”等措施帮扶各类小微企业。
2020年03月07日,美国这场会议2人确诊新冠肺炎 彭斯、蓬佩奥曾出席_荔枝网新闻,中国新闻网,中新网3月7日电据美媒报道，“美以公共事务委员会”(AIPAC)6日发布声明称，已证实至少有两名从纽约来的与会者在参加完华盛顿的一场会议后不久，新冠肺炎病毒检测呈阳性。据悉，会议约有超过18000人参加，包括美国副总统彭斯、美国国务卿蓬佩奥以及三分之二的国会议员。据《今日美国》报道，会议于当地时间3月1日至3日召开。与会者包括美国副总统彭斯、美国国务卿蓬佩奥、参院多数党领袖麦康奈尔、得克萨斯州参议员克鲁兹(TedCruz)、前民主党总统竞选人布隆伯格，以及其他数名立法议员等。当地时间6日，AIPAC在社交媒体“推特”上发布声明称，已经证实至少两名与会者的新冠病毒检测呈阳性。据悉，这两人来自纽约。纽约州确诊新冠病毒感染者6日新增22例，累计44例。目前整个纽约州有近4000人在隔离中。声明说，将继续与纽约卫生部门、美国国家卫生当局等保持联系。该组织还说，美国卫生当局的指导方针仍是，所有与会者都应遵循疾病预防控制中心(CDC)的指导方针，如果他们感到不适或有医疗问题，应咨询他们的医疗服务提供者。据美国有线电视新闻网(CNN)，6日早些时候，在工作组简报会上，有记者问彭斯，他是否担心华盛顿已存在新冠病毒，一些国会议员可能已经被感染。彭斯表示，“我这一天都很忙，这是我第一次听到这个消息。”根据美国疾病控制与预防中心以及各州公共卫生部门的统计，截至美东时间6日晚7时，全美共出现新冠肺炎确诊病例324例，死亡病例14例。目前，全美共有25个州出现确诊病例。
2020年03月07日,菲律宾新增1例新冠肺炎确诊病例 累计确诊6例_荔枝网新闻,央视新闻,3月7日，菲律宾卫生部部长杜凯称，菲律宾新增1例新冠肺炎确诊病例，累计确诊6例。菲卫生部正在对该患者的密切接触者进行追踪。该患者是一名59岁的菲律宾女性公民，在3月5日出现咳嗽等症状，目前正在医院接受隔离治疗，情况稳定。她是第5例患者的妻子。杜凯表示，菲卫生部已确认3月6日确诊的第5例病例为菲律宾第一例本地传播病例。该名患者为一名62岁的男性，无出国旅行史。目前，菲卫生部正竭尽全力采取各种措施以确保疫情不会继续在社区传播。此外，菲卫生部已将警报级别提高到红色代码1级，这表示菲律宾政府以及公共和私人医疗机构都要做好准备应对疑似病例增加的可能，并及时报告提供医疗服务的情况。如果情况持续加重，卫生部将会考虑进一步将警报级别提升到红色代码2级。同时，杜凯还建议菲总统府宣布全国进入公共卫生紧急状态，以加强资源调动，及时掌握疫情情况，实施防备措施，加强严重急性呼吸系统疾病的监测等。
2020年03月07日,镇江市春季渔业生产有序推进_荔枝网新闻,整点快报,受新冠肺炎疫情影响，今年春季渔业生产较往年有所延后，但在疫情得到有效控制、交通运输畅通后，养殖户们紧锣密鼓的展开塘口清理、水质调控、苗种投放等工作，春季渔业生产已有序展开。截至目前，苗种放养面积15万多亩，占总面积80%左右，其中河蟹放养面积3.6万亩，青虾放养面积5.79万亩，虾蟹经济特色依旧明显。前期受疫情影响滞销的青虾，通过多渠道助推产销对接，销售量已达七成以上。为了进一步推进春繁春放相关工作，各级渔业主管部门通过网络平台、微信、“农技耘”APP等信息技术手段，开展技术人员“云指导”；深入基层指导存塘水产品管理、春投春放、水质调控及疾病防控等技术；联合执法部门开展苗种、投入品检查20多次，抽检水产品15批次，严厉打击使用违禁药物等行为，确保水产品质量安全。
2020年03月07日,火线立功！任小宝穿着旧战靴与死神过招_荔枝网新闻,人民陆军微信公众号,
2020年03月07日,武汉方舱医院力争10日全部休舱_荔枝网新闻,央视,6日下午，武汉光谷科技会展中心方舱医院宣布休舱，至此武汉已有两家方舱医院休舱。该方舱医院共设840张床位，累计收治新冠肺炎轻症患者875人。方舱医院现有患者2000余人力争10日全部休舱截至昨天，武汉还在运行中的方舱医院有患者2000余人。随着康复出院人数增加，方舱医院将进行整合。据国家卫健委介绍，力争在3月10日左右将方舱医院全部休舱。建设方舱医院在我国医学救援史上具有标志性意义此前据中央指导组成员、国家卫健委主任马晓伟介绍，疫情发生初期，大量病人在社区和社会流动，床位等医疗资源紧张，造成双重压力。在这种复杂情况下，中央指导组深入一线，果断作出建设方舱医院的决定，要求武汉市立即将一批体育场馆、会展中心改造为方舱医院，收治轻症患者。方舱医院解决了大量患者入院治疗的问题，武汉的新冠肺炎患者中，每4人就有1人是在方舱医院治疗的，是名副其实的“生命之舱”。建设方舱医院在防与治两方面发挥了不可替代的作用，在我国医学救援史上具有标志性的意义，也为今后应对突发公共卫生事件创造了新的模式。
2020年03月07日,生猪产能稳住了吗？农业农村部公布一个关键数据_荔枝网新闻,央视新闻,在3月5日的国务院联防联控机制新闻发布会上，农业农村部对于新冠肺炎疫情对生猪生产带来的影响，以及当前生猪生产形势作出了回应。trog我国能繁母猪存栏连续4个月恢复增长trog农业农村部畜牧兽医局局长杨振海：能繁母猪存栏连续4个月恢复增长，尽管受新冠肺炎疫情冲击等困难，我们有信心实现全年生猪产能基本恢复到接近常年水平。杨振海表示，下一步将解决饲料、屠宰、流通等企业复工复产面临的突出问题，畅通仔猪和种猪调运，将生猪规模养殖场贷款贴息范围从年出栏5000头以上调整为年出栏500头以上，抵押贷款范围从试点4个省扩大到全国所有省份。杨振海还表示，春季是动物疫病高发期，下一步要加大禽畜疫情的防控。trog农业农村部：今年非洲猪瘟疫情发生强度大幅降低trog发布会上，农业农村部畜牧兽医局局长杨振海介绍，今年非洲猪瘟疫情发生强度同比大幅降低，高致病性禽流感疫情形势总体平稳。农业农村部畜牧兽医局局长杨振海：去年全年共发生非洲猪瘟疫情63起，其中家猪60起，野猪3起。去年这个时候发生了12起非洲猪瘟疫情，今年发生了1起，同比发生强度大幅降低。今年全国报告了4起野鸟和2起家禽高致病性禽流感疫情，发病强度与近几年的平均水平基本一致。经过专家会商和综合研判，今年高致病性禽流感疫情形势总体是平稳的。从通报的非洲猪瘟和禽流感疫情看，今年发生的疫情再次提醒我们重大动物疫病的病原种类多、分布广，特别是非洲猪瘟病毒污染面很大，我们国家养殖密度又比较高，加之边境线很长，野生动物活动不宜掌控，疫情风险始终是存在的。
2020年03月07日,西班牙新冠肺炎确诊病例达374例_荔枝网新闻,新华网,新华社马德里3月6日电西班牙卫生部6日确认，西班牙新冠肺炎病例升至374例，死亡8例。其中，首都马德里确诊病例数达137例。由于马德里两处养老院中有多名老年人和护理人员被感染，卫生部门决定未来一个月暂时关闭该地区213家老年活动中心。迄今，西班牙所有新冠肺炎死亡病例均为老年人，年龄从69岁至99岁不等。
