2020年02月26日,6项联防联控机制保驾长三角一体化示范区战“疫”_荔枝网新闻,荔枝新闻,b 荔枝新闻讯b新冠肺炎疫情来袭，长三角生态绿色一体化发展示范区执委会会同青浦、吴江、嘉善深入研究，印发2020年执委会一号文件——6项联防联控机制保驾示范区战“疫”，实现信息动态互通互鉴、人员流动互认互通、共保物资运输车辆通行、合并交界点临近卡口、应急物资互帮互济、社会治安联合管理。日前，上海市青浦区金泽镇居民王涛特地开车来到318国道芦墟公安检查站，申请办理了一张车辆通行证。他供职的公司先前在上海，后来搬到了汾湖，但他依然住在金泽。新冠肺炎疫情发生后，每次驾车上下班时，他都得在这个检查站扫码登记信息，再加上要排队，要花费不少时间。办理通行证后，这个问题得到有效缓解——长三角生态绿色一体化发展示范区执委会发布告知函，明确青吴嘉对三地往来人员、车辆通行证互认。持证过站，只需核对证件信息、测量体温，前后耗时在1分钟左右。王涛的经历，体现出的只是长三角一体化防控的一角。面对来势汹汹的新冠肺炎疫情，执委会会同青浦、吴江、嘉善三地，共同构建形成了一体化示范区疫情联防联控6项工作机制。“疫情联防联控是探索跨区域一体化制度创新的应有之义，示范区有必要也有条件率先探索。”在2月21日举办的示范区新闻通气会上，上海市发展和改革委员会副主任、长三角生态绿色一体化发展示范区执行委员会副主任张忠伟说，不仅仅是阶段性的应对疫情，在公共安全和应急管理制度方面，示范区接下来也会进行重点思考和研究。trog一号文件聚焦联防联控trog随着疫情的蔓延，示范区成了一种特殊的存在。这片由青浦、吴江、嘉善组成的区域，面临的压力说不大也不大，说大也大。压力不大，是从人口密度和救治强度来讲。示范区常住人口有310万人，建设用地上的人口密度为4200人平方公里，而上海市外环线以内的人口密度是1.72万人平方公里，也就是说，示范区建设用地上的人口密度约是上海市中心的14。截至2月20日，示范区两区一县确诊病例数为21例，已经出院13例。压力大，体现在防控任务重。从区域特点上看，示范区地处两省一市交界处，门户特征非常明显，它承担的不仅仅是两区一县内部人员流动的管理任务，还有沪苏浙大通道人员车辆流动的管理任务。以318国道芦墟公安检查站为例，2月9日出沪车辆有539辆，2月20日出沪车辆已经达到993辆，10天左右，车流量几乎增长一倍，而且接下去还会持续增加。面对这一情况，应对策略在于联防联控。2月1日起，执委会开始与两区一县联络；2月13日，执委会和两区一县共商，联合印发《关于建立长三角生态绿色一体化发展示范区疫情联防联控工作机制的通知》，这也是2020年执委会发布的一号文件；2月18日，执委会与三地相关部门再次召开协调会，细化方案，共同推动实施。trog实施6项机制成效初显trog依据执委会发布的一号文件，示范区明确探索建立6项联防联控机制。一是信息动态互通互鉴。两区一县加强信息实时共享，加强防控人员排查登记信息、活动轨迹信息的及时推送、交换和比对，加强疫情防控重要举措出台的通报，实行分类分级联防联控，联合开展疫情研判和风险评估。二是人员流动互认互通。为保障跨区域人员流动，避免重复检测和重复隔离，示范区探索实行两区一县务工人员、本地人员“一人一证”制度，凭一地上岗证或相关通行证可免身份验证，经体温测量通过后，跨区域自由通行。三是共保物资运输车辆通行。落实跨区域物资运输放行制度，完善跨省运输绿色通道机制，切实保障疫情防控必需、城市运行保障必需、群众生活必需、重要企业必需等的物资运输车辆通行。四是合并交界点临近卡口。为避免因行政区划造成重复设卡检测，节省人力、物力等资源，示范区两区一县跨区域通道交界点临近的卡点合并设于交界处，由相邻的区（县）各派人员联合办公，进行卡点疫情检测工作。五是应急物资互帮互济。加强跨区域内重要医疗防疫物资、生产性物资、保障性物资、生活必需品的生产能力、库存的信息互通。在应急情况下，三地进行积极有效补给。六是社会治安联合管理。强化市场联合监管、公安执法联动，依法严惩利用疫情哄抬物价、非法收售珍贵濒危野生动物、造谣滋事、妨害公务等扰乱社会稳定的违法行为，切实保障疫情防控工作顺利进行，坚持快审严判并及时通报曝光。对情节严重的企业和个人，依法列入失信黑名单。“执委会正会同两区一县疫情防控工作领导小组办公室细化落实6项工作机制，取得了一些初步成效。”执委会综合协调组组长陈千颂举例说明，此前，青浦金泽境内两个公路卡口（G50金泽出口卡口和西岑卡口）合并至吴江汾湖卡口，将吴江汾湖境内苏同黎公路卡口合并至嘉善陶庄卡口，建立两地一站式查控关口，查控工作无缝衔接。2月20日，人员、车辆通行证互认互通正式启动。应急物资互帮互济方面，经青浦区协调，上药青浦医疗健康服务公司为嘉善县增援一批医用口罩。嘉善县与上海白玉兰远程会诊平台做好远程会诊准备，一旦有会诊需求，白玉兰平台即可组织该平台的上海三甲医院专家组进行远程会诊。trog深层次思考制度创新trog这些综合性措施，是在长三角联防联控大框架下做的探索，解决了疫情防控中一些综合性问题，但并非常态化举措。执委会将根据疫情发展和三地需求，对举措适时进行动态调整。“我们就是要创造一种机制，为接下来碰到的问题创造一个沟通解决问题的平台。”张忠伟坦言，新冠肺炎疫情的来袭，让执委会意识到，在示范区一体化制度创新等方面，还面临着一些短板和瓶颈问题，比如，示范区内的很多公共服务实际上处于这个区域的底部，从提升老百姓的满意度，提升公共服务能力、水平的角度来讲，需要进一步加大示范区公共服务优质资源项目的供给。执委会在牵头研究示范区“十四五”规划有关重大问题时，计划将公共安全、应急管理、公共卫生涉及的能力建设问题作为一个重要专项进行研究，并将朱家角人民医院打造为区域性的医疗中心，提升为三级甲等医院。（来源：江苏广电苏州中心站钱一鸣编辑徐金吉）
2020年02月26日,韩国39人赴以色列朝圣：31人确诊 同机空姐也被感染_荔枝网新闻,海外网,海外网2月26日电 据韩国纽西斯通讯社报道，韩国疾病管理本部中央防疫对策本部通报称，截至26日，韩国赴以色列朝拜圣地后返回的39人中，累计有31人确诊新冠肺炎，包括1名同机的25岁空姐。据了解，这名空姐当值的航班，是当地时间16日下午3点10分抵达韩国仁川的大韩航空KE958航班。这也是韩国39人朝圣团的返程航班。据悉，大部分确诊患者回国后第二天就去了温泉、餐厅等公共设施或正常上班，甚至参加了团体活动，因此社区传播的风险较大。据韩国庆尚北道和义城郡政府调查，与确诊病例接触者约170余人，不排除今后出现新增病例的可能性。
2020年02月26日,2020年沃尔沃中国高尔夫球公开赛延期举办_荔枝网新闻,新华网,中国高尔夫球协会消息，受疫情影响，原定于4月20日至26日在深圳举办的2020年沃尔沃中国公开赛将延期举办。公告称，为做好新冠肺炎疫情防控工作，经研究决定，延期举办原定于4月20日至26日在深圳正中高尔夫球会举办的2020年沃尔沃中国公开赛，举办时间待定。沃尔沃中国公开赛创立于1995年，是中国最早的国际职业高尔夫赛事之一。
2020年02月26日,台湾新增1名新冠肺炎确诊病例 累计32例确诊_荔枝网新闻,央视新闻,台湾新增1名新冠肺炎确诊病例，病例为临时外籍看护人员，确诊前曾照顾确诊病人。“台湾北部80余岁老翁新冠肺炎群聚案”再扩大，台湾流行疫情指挥中心26日下午公布，台湾第32例新冠肺炎确诊病例为此前老翁在2月11日至16日住院期间的30多岁女性外籍看护人员。因此看护为临时看护，卫生单位在老翁确诊后寻找该名个例。2月24日晚间查找到该看护人员之后，卫生单位将其送往医院检测并住院隔离。该看护当时有轻微喉咙不适，经检测于今天确诊。
2020年02月26日,日本政府发言人回应庞德言论：东京奥运会照常举行_荔枝网新闻,新华网,针对国际奥委会委员迪克·庞德做出的“如果三个月之后新冠肺炎疫情威胁不能消除，东京奥运会可能取消”的判断，日本政府发言人、内阁官房长官菅义伟26日称，庞德的观点只代表其个人，不代表国际奥委会。东京奥运会将按计划如期举行。据美国媒体25日报道，加拿大籍的国际奥委会委员庞德在接受采访时表示，如果三个月之后新冠肺炎疫情威胁不能消除，东京奥运会可能会被迫取消，但不可能延期或者易地举行。据美联社报道，菅义伟26日在出席新闻发布会时表示，庞德的观点并不能反映国际奥委会的官方态度，东京奥运会不会推迟或者取消。“对于这位委员的表态，国际奥委会已经回应称这并非他们的官方态度，目前国际奥委会正在按照计划推进东京奥运会的准备工作。”菅义伟说。2020年东京奥运会定于7月24日至8月9日举行，残奥会定于8月25日至9月6日举行。此前国际奥委会、东京奥组委以及日本政府均明确表态，东京奥运会及随后的残奥会“绝对”不会取消或延期。由于受到疫情影响，东京马拉松等马拉松赛事都取消了大众项目的比赛。此外日本足球职业联赛J联赛也已宣布，3月中旬之前的所有联赛将延期举行。
2020年02月26日,共享员工潮：员工到手工资或翻倍 流程、法务问题待解_荔枝网新闻,新京报,受新冠肺炎疫情影响，中国这个庞大的经济体同时遭遇“复工难”和“用工荒”两大难题。在此背景下，一些暂时难以复工的中小企业将员工以共享模式进行短期人力输出，掀起一波“共享员工潮”，以期解决接收方的“用工荒”难题和缓解输出方“复工难”的经济压力。但共享员工潮背后仍有诸多问题待解，比如接收方能支付多高的成本？共享员工审批流程快慢？如果共享的员工想转正，接收方怎么想，是否会对出借方造成新的员工流失？双方有着怎样的“君子协议”？trog多地政府发起“抢人大战”trogtrog头部企业尝鲜“共享员工”trog随着新冠肺炎疫情日趋稳定，“复工”正在成为中国这个庞大经济体的当务之急。在率先行动起来的长三角、珠三角等经济重镇，“用工荒”比往年来得更加剧烈。在多地封路的背景下，不少地方都派出了专车、专列甚至专机接回滞留在老家的企业员工。以浙江义乌为例，据不完全统计，从2月16日至2月21日，已返程的“义乌号”就业大巴261辆，接回员工9184名；到达火车专列3列，分别是安徽阜阳、江西南昌、云南昆明，接回员工2541名。另外，义乌还开通贵阳北—义乌G4134、怀化南—义乌G4132专列，接送员工返回岗位。这些做法对于东部省份的经济强市、强县来说，已经成为“标准操作”。各地政府频频出手背后，是企业紧绷的用人需求。浙江金华的一家玩具企业总经理日前告诉新京报记者，公司七十多名员工中，仅有来自本地的五六人返岗。西部省份尚未通畅的交通，仍将大多数员工隔绝在本地。即便是联想集团这样的大企业，员工回岗率也仅有50%左右，无法实现满负荷生产。与此同时，也有餐饮、零售等行业的许多企业，因为人流聚集的属性而无法正常复工，员工即使回到工作地，也面临无事可做的窘境，甚至失业的风险。在这种情况下，盒马鲜生、联想集团、苏宁等企业推出的“共享员工”尝试引起了市场的注意：通过为暂时不能复工的企业商户员工提供短期工作机会，既能在紧张的“用工荒”中迅速获得自身需要的劳动力，也为其他企业和员工提供了渡过难关的机会。不过，作为一种全新的尝试，它的落地或许也并没有那么容易。trog“疫情再难，经济也要流动起来”trogtrog对于输出方可能存在法务问题trog“中小企业不能垮，尤其一些不具备防疫抗毒能力的小工厂，强行开工风险太大，采取共享员工的办法，就是为了帮助他们撑过去。疫情再难，经济也要流动起来。”一位联想集团内部人士告诉新京报记者，“中小企业主可以让员工先来联想干一段，保存实力和队伍，扛过这一段，再谋未来。”2月8日，联想集团官方微信公众号发布消息称，公司在武汉、合肥、深圳、惠阳和成都的工厂将为临时歇业的企业商户员工提供短期工作机会。具体工作包括电脑、服务器、手机的组装、包装等。两周过去，联想集团董事长兼CEO杨元庆在2月20日接受新京报等媒体采访时表示，联想除了成都和武汉的工厂还在等待政府的进一步指令外，其他工厂均已顺利复工，只是员工回岗还没有到很高的水平，现在大概只到50%左右。2月24日，联想深圳、惠州地区工厂的内部管理人员杨华(化名)告诉新京报记者，以惠州工厂为例，1000多人中已经到岗五六百人。有分析人士表示，联想这种“共享员工”的做法，既能解决一些中小企业的成本之急，也能让停工在家的人员有些收入，同时还弥补了工厂短期内人手的不足，是一举多得的“多赢”措施。谈到“共享员工”的问题时，杨华表示，公司发出倡议后，有不少企业来报名，也有很多人以个人的形式加入进来。惠州工厂方面，当地有一家酒店因为疫情无法开业，约百人规模的员工需要短期工作机会，目前正在走企业内部的流程。深圳工厂这边也有四五十人过来咨询。不过，杨华告诉新京报记者，作为一种新的尝试，用工方原来所在企业在走流程时可能会比较慢，“共享员工”这一形式在对方企业法务方面也可能存在问题，合作模式还需要一点点地探索。尽管有这样那样的问题，在深圳工厂已经有两名工人顺利入职了。就上面提到的法务问题，浙江晓德律师事务所主任兼首席律师陈文明向新京报记者分析道，对于原企业来说，企业未复工期间如有员工个人应聘参加“共享员工”的，应当及时向员工和新企业了解情况。如存在员工违反竞业禁止、侵犯商业秘密、对完成本单位的工作任务造成严重影响的等违反企业规章制度行为的，应当及时沟通处理。鉴于员工在外与第三方建立用工关系，企业可与员工协商处理疫情防控期间的工资待遇问题，尽可能减少受疫情影响造成的损失。如企业与借入企业合作借调“共享员工”的，应当与员工就借调协商一致，并在与出入企业、员工签订的协议中明确约定各方的权利、义务与责任，特别是工伤赔偿费用承担等问题。trog“共享员工”到手工资或翻倍trogtrog若共享员工想留得与原单位解除劳动合同trog在薪资待遇上，杨华表示，这些“共享员工”的收入也是与本地工厂平均薪资相仿。惠州工厂的待遇大约在4000元-6000元之间，深圳工厂的月工资应该会在5000元-6000元左右，根据工时的不同、是否加班等情况会有所浮动。而据他了解，停工期间，惠州本地的一些企业只能给员工发一千多元的基本工资。即便这样，这也给企业带来了不小的成本压力。“我们联想的工厂是第一批复工的，通过(‘共享员工’)这种方式，我们也想能够对这些企业有一些帮助，对于这些员工个人也有所帮助。”杨华表示。杨华表示，为了保障员工的工作健康，联想的工厂都根据当地政府防疫组的要求准备了防疫措施，为工人提供口罩、测量体温，对厂区进行清洁等等。由于“共享员工”招聘的岗位基本上都是一些比较简单的工种，因此前期培训并不会花很长时间。“主要是一些入职培训、安全培训，这些我们都会做。”杨华介绍道，在目前的计划中，短期用工是要做到三月底。如果未来“共享员工”想留在联想工厂，杨华表示，则必须要与原来的公司解决劳动合同，联想才能接受，“我们目前还是按照劳务输入的方式来做。”此前，也有联想内部人士告诉新京报记者，这种做法其实挺难操作的，理论上一个月成为熟练工，第二个月开始干活，后续疫情消退了，这些临时员工就会走了，这对工厂的产能影响很大，“我们采取这个措施，真的是为中小企业考虑。”该人士表示。trog有餐厅20人中就有3人参与“人才共享”计划trogtrog“共享”双方需签“君子协议”trog杨涛是叁鲸日式料理的寿司师傅，今年元宵节后，他临时到京东7FRESH七鲜超市的通州北京ONE店，成为一名“共享员工”。在过去的两周里，杨涛每天的工作从做寿司变成分拣工作，用他的话来形容，这算得上是一份机械、流水式的工作。“以前一天才走七八千步，现在每天至少得走四五万步，工作量比以前更大一些，但有一定的收入又能帮到京东，我觉得是一次很好的机会。”促成此次员工共享的，是叁鲸日式料理的市场部负责人王子迪。曾经是京东一员的他，在听闻老东家推出“人才共享”计划后便与门店的员工商量，最后由杨涛带领一部分员工成立七鲜分队，减轻叁鲸日式料理店的压力。王子迪说，他和公司不希望在这个时候放弃任何一个员工——尽管明知道几乎不会有客人到店就餐，但他和另外两位合伙人仍选择在2月10日复工开店，为的只是将公司和员工的损失减少至最低水平。“我们两家店一共20个员工左右，最终共享了3名员工。”王子迪向记者表示，由于日料讲究食物的口感和餐饮体验，两家位于北京亦庄和通州的门店平时几乎不做外卖，但疫情之下他们也不得不将向外卖拓展，最近外卖的比例已经提高到80%。而作为员工的接收方，京东7FRESH的“人才共享”计划提供了收银、理货、拣货打包、骑手等岗位，以满足疫情期间线上订单暴增的需求。据记者了解，该“人才共享”计划除了提供有竞争力的薪资之外，还提供新冠肺炎保险，而合作的餐饮企业则正常承担员工的保险。王子迪表示，公司与京东之间有“君子协议”，协议中规定“共享员工若想回店里，提前三天跟京东提出即可。”随着日料店逐步恢复正常经营，员工也将随之回到店里，预计恢复到正常水平可能要到三月中旬。
2020年02月26日,微视频｜复工战“疫”_荔枝网新闻,央视网,videocotrol=""durtio="0"fbl=""oter="htt:img.v.jtv.comimge202022620202261582700218487_227_m.jg"rc="htt:vod.v.jtv.comvideo202022620202261582700218487_227_1377.m4"webkit-lyilie=""videobr抗击新冠肺炎疫情到了最吃劲的时候有序复工复产也是战“疫”分区分级精准复工复产同时不放松防疫举措物资有了保障防疫才会更有力量生活在继续光明在前头
2020年02月26日,巴林新增3例新冠肺炎感染者 累计26例_荔枝网新闻,央视新闻,巴林卫生部当地时间26日上午发布公告，称境内新增3例新型冠状病毒感染者，均为近期从伊朗通过中转返回的巴林女性公民。至此巴林境内共确诊26名新型冠状病毒感染者。巴林卫生部呼吁本月曾赴伊朗旅行的所有人员避免外出与他人接触，同时与防控疫情热线444联系，已便卫生部门安排上门医学检查。
2020年02月26日,林书豪休赛期努力训练 发文自勉：时间是宝贵的_荔枝网新闻,中国新闻网,北京首钢球员林书豪26日在个人社交媒体晒出了自己训练的照片，并配上一段长文进行自我勉励。“相信自己绝对比相信别人更重要。”林书豪写道，“当我在等待新冠肺炎控制结果和CBA赛季时，自己已经在健身房里扎营了。时间是宝贵的，这个间歇期让我重新思考和调整了比赛思路。没有灯光，没有魅力，没有观众。只有我，一个篮球，一片球场和努力不懈。人们只谈论突破，但是每一天和每一步都同样有价值。”同时，林书豪表示，这段时间让他想起了2011年NBA的停摆，“那时没人期望太高，但我们都知道接下来发生了什么。”在NBA停摆期间，林书豪同样在休赛季不断提高自己的技术，为以后的比赛做准备。在训练期间，林书豪也一直关心着新冠肺炎疫情的发展，他在微博向一线医护人员致敬，并且捐出100万元用于疫情防控。
2020年02月26日,5月决定东京奥运是否举办？日奥运相：非官方意见_荔枝网新闻,中国新闻网,中新网2月26日电据日本共同社报道，26日，针对有国际奥委会委员称5月下旬是决定是否举办东京奥运会的最后期限一事，日本奥运相桥本圣子表示，“这并非国际奥委会的官方意见”。据报道，桥本透露，东京奥组委已要求国际奥委会对此事做出说明并获得答复，她说，“国际奥委会回复称，‘这不是国际奥委会的官方主张，有这样的言论正说明了国际奥委会正在朝着东京奥运会按照计划举办的目标，开展准备工作。’”。报道称，对于东京奥运会能否如期举办，桥本强调，“将继续全力开展筹备工作，以确保能够安心举办奥运会，并获得国际奥委会的认可”。据美联社报道，国际奥委会委员迪克·庞德此前在接受采访时表示，如果因为新冠肺炎疫情爆发而证明今夏在东京举行的奥运会太危险，组织者很有可能完全取消这届奥运会，而不是推迟或换城市举办。
2020年02月26日,疫情防控不放松 藏历新年这么过_荔枝网新闻,中国西藏网,中国西藏网讯2月24日是藏历金鼠新年正月初一，记者获悉，青海省安多卫视为观众呈现了一台富有民族特色、宣传疫情防控知识的藏历金鼠年迎新节目，广大观众对此纷纷点赞。安多卫视节目负责人告诉记者：“今年的藏历新年正值新冠肺炎疫情防控的关键时期，我们充分整合台里的节目资源，编排了长达18个小时的迎新节目，在藏历正月初一呈现给广大观众，陪伴观众度过这个特殊的藏历新年。”据悉，新冠肺炎疫情发生之后，安多卫视对播出的节目做出了调整，用藏语制作、编译了40多部疫情防控公益宣传短片，并用疫情防控宣传片替换了贺岁宣传片，穿插在节目中播放。同时，组织藏族歌手录制了《希望之光》《请莫害怕不懈防疫》等藏语原创歌曲引导藏族群众提高自我防护意识和自我防护能力，呼吁全社会万众一心打赢疫情防控战。据安多卫视节目负责人介绍：“藏语电影一直深受西藏和涉藏工作重点省广大观众的喜爱，我们把《冈拉梅朵》《西游记之大闹天宫》《中国合伙人》等多部优秀电影译制为藏语，安排在藏历新年期间播出，为喜爱藏语电影的观众备好了一道道视听盛宴。为了确保这些节目在藏历新年期间能够与观众见面，台里的新闻主播、栏目主持人和其他幕后工作人员一起兼职配音，完成了节目录制。”据悉，藏历新年期间，这些节目在安多卫视播出的同时，还会在安多卫视微信公众号和抖音号、祥云网同步推送。（中国西藏网记者泽仁措姆图片由安多卫视提供）
