2020年02月26日,方舱医院旁边的树开花了 | 天使日记_荔枝网新闻,中央广电总台中国之声,2月24日武汉天气阴我是胡智敏，武汉市肺科医院内镜中心的内镜医生，支援发热门诊已经25天。刚去发热门诊的那段时间是我们医院发热门诊量剧增的时期，每天目睹门诊患者焦急地排队、等待，留观室危重症患者不断加床，除了开具相关药物，还特别需要安抚患者的情绪。一部分患者在留观室也得到了治愈，这是我们最高兴的事情。作为医生，我也在得到安慰。今天家人发来微信图片，收到一大堆社区工作者为医护人员家庭送的蔬菜，说家里一切很好，让我安心工作。我还接到陌生来电，是下沉社区的党员同志对一线医务人员的问候，并告诉我家里有任何困难可以随时打电话联系他。这些天，发热门诊的患者数量一天天减少，绝大部分是前来复查的恢复期病人，留观室的重症患者全部顺利收入隔离病区，得到更加系统的诊疗……希望有更多让人安心的消息。2月24日湖北孝感天气多云我是孝感市中心医院呼吸内科护士长袁曼。因感染新冠肺炎，2月23日19时30分，黄文军在工作了19年的湖北省孝感市中心医院去世，年仅42岁。黄文军作为医院呼吸内科副主任医师，是一位资深专家。疫情以来，呼吸科一直在收治新冠肺炎患者，从未间断。1月24日，他主动提交请战书，申请去隔离病区工作。黄医生自身有糖尿病，却一直坚守在工作岗位上。白天上发热门诊，顶在最危险一线工作，晚上赶往孝感市各县市区，去参加新冠肺炎疾病相关的专家工作。他平时工作也是这样，积极主动，从不叫苦叫累。因为黄文军体态微胖，说话快人快语，脸上总是笑容满满，大家都说他是“老黄牛”。老黄，工作中，好多次在走廊里和你碰面时，我们都喜欢跟你斗嘴耍贫，因为我们都知道你不会生气，我们就喜欢看到你灿烂的笑容。当得知你确诊新冠肺炎以后，我赶紧给你打电话，我们都劝你放下手头的工作，赶紧住院。你说自己还好，不要紧，还在乐观的笑，可你不停的咳嗽声，真是让人担心。后来，你病情加重，大家准备给你插管时，你在一张纸上写下：“不插管，我还好”。我知道，你是怕传染给同事……老黄，老黄牛……你还听得见我们的呼喊声吗……黄文军2020年2月24日武汉天气阴我是山东大学齐鲁医院肝病科主治医师高帅。17天前，我们医疗队支援武汉，接管了武汉大学人民医院东院区的两个重症病区。隔离区里的高帅我在十七病区工作，这个病区的患者大多是由方舱医院转来的。那位88岁的老人，让我印象非常深刻。她是由养老院送来的，身体非常虚弱，严重营养不良。由于常年卧床，生活不能自理，她背上还有几片很深的压疮。老人在隔离病房里非常紧张。我们在药物治疗的同时，也给了她更多的关怀和安慰。她听不懂普通话，我们就自学了简单的武汉话同她交流。她牙齿不好，我们专门准备了破壁机为她制备营养餐。隔离病房里，不允许家属陪同，护理人员为她喂饭喂水，翻身拍背，清理排泄物。有一次，我在查房的时候，她紧紧地抓住了我的手，沧桑的脸上满是感动。老人很配合我们的治疗。我们一起努力，最终战胜了病毒。她也是我们医疗队接管病区以来，首批出院的患者的之一。2020年2月24日武汉天气阴我是北京大学人民医院神经外科的主管护师席晓会，今天是我到武汉的第17天。我上个班是夜里1点到5点。巡视完所有的患者后，我还是不放心5床的奶奶，总觉得她有什么事情。进到病房，奶奶坐在床上，我说：“奶奶，您怎么坐起来了？”老奶奶抬头看看我，摆摆手，说：“没事！”我又问：“奶奶，有什么事您跟我说，我可以帮您！”她抬起头，说：“我想喝水。”我刚拿起水杯，想去拿暖壶，奶奶说：“水有点凉。”说完她又将头深深低了下去。我这才明白，奶奶想喝热水，但是不好意思麻烦我去打水。打好热水回到病房，我把奶奶保温杯里的水倒掉，去卫生间清洗了杯子、杯盖，再回来倒上新打的热水，跟她说：“现在有点烫，您晾晾再喝！”奶奶慢慢抬起头，双手合十，对我说：“谢谢，谢谢北京来的娃儿！”又低着头小声嘟囔了一句：“哎，我没用，一天天总给人家找事情！”我赶紧说：“奶奶，没事，我们从北京那么远的地方来，就是来帮助您的。有事您说话！”她冲我点了点头。我转身离开，听见身后又传来一句：“谢谢你！”我回过头，看到奶奶又在冲我拱手致谢！我工作已经15年了，没想到还是会被这普通的三个字感动到泪如雨下。2020年2月24日武汉天气阴我是天津市第三中心医院重症医学科护士许程飞，这些天担任武钢二院一队护理八组的代班护士长。许程飞汗湿的背影四楼病区收治了一名“特殊”的新冠肺炎患者，因为他还是一位肿瘤晚期患者，身上插着胃管和尿管，生活不能自理，需要护士全方位进行治疗护理和生活照顾。第一次查房时，我发现患者双侧足跟压疮和骶尾部是深部组织损伤，后背压疮到了II期，左手手背处有水泡。由于条件有限，我只能先对患者手部的水泡和后背的压疮进行了处理，双侧足跟用枕头抬高，后背用枕头进行一侧垫起，减少患者骶尾部受压。之后每两个小时带领本院老师一起给患者翻身。通过细心的护理，目前患者的后背部压疮和手背部明显好转，足跟部和骶尾部压疮也没有进一步恶化。2020年2月24日武汉天气阴我是空军军医大学唐都医院疾病预防控制科主管护师曹小琴。到武汉已经32天了。作为一名疾病预防控制科主管护师，我的主要工作是保障队友们的安全，不给病毒留下任何可乘之机。我们建立了全接触点消毒杀菌制度，早上，我照常在酒店驻地门口配置消毒液。因为想尽早完成准备工作，本来两次搬完的东西，我一次全拿上了，提着几件，还用肚子顶着几个，就在这时，驻地酒店对接老师徐春华朝我跑了过来，从我手中接过去一大半，还说：“以后这样的事，一定叫上我一起，让我多做些事吧！”曹小琴为战友消毒杀菌又见到徐老师时，她正拿着几个大洗衣盆过来，对我说：“昨天在电梯里听到你洗衣盆坏了，在问队友借，我下班后就赶紧新买了几个给你们用，你们还有什么需要尽管和我说。”我无心的一句话，没想到她记在心上。从“解放军来了，我们有救了！”到“解放军，我还能为你做点什么？”这些天我们不但听到大家的感谢，更听到对我们的激励。2020年2月24日武汉天气阴我叫佧米力江阿力木，是来自新疆和田地区传染病专科医院的一名护士。我们是和田的第1批，新疆的第2批驰援武汉的医务人员。在来武汉之前，我去过最远的地方就是乌鲁木齐。当我来到武汉的第一感觉就是特别美，高楼大厦特别多。我工作的地方是武汉东西湖方舱医院，我们方舱医院就是一个大家庭，有来自全国各地的医护人员，我们C厅就是广东和新疆的医务人员，我们会彼此开玩笑地叫他们一声靓仔，他们也叫我靓仔，我也特别高兴。男护士的优势是很显著的，每次我们会提两大桶水进仓，力气活都是抢着干的。现在每天都有出院的，出院的人数多，进仓人少，空床也有了，他们出院了我很高兴，心里感到特别欣慰。方舱医院旁边树开花了，有粉色的、白色的，都能感受生命绽放，特别美丽。总台央广记者：凌姝、张晶、王成林、冯会玲、陈庆滨、雷恺、吴卓胜、金昀瑾孝感台聂云山东台赵国伟新疆台丁晓丹许红涛新媒体编辑：孙雪往期回顾：今天是我在抗疫一线工作的第29天抗击疫情，不计报酬，无论生死，逆风而行春暖花开，等我平安回来，娶你！黑夜翻面之后，会是新的白昼儿子，妈妈打完怪兽就回家！｜天使日记ICU一个班下来我的衣服都完全湿透，一口气能喝一两瓶水｜天使日记他拿记号笔在我们衣服后面写上“平安喜乐”|天使日记如果我们都不上，这场仗就打不赢了｜天使日记想想那些就诊的患者，我得放下亲情擦干眼泪继续战斗｜天使日记从病毒手里抢人，成了我们每天的责无旁贷|天使日记“乔治，你知道妈妈去哪里了？”“妈妈在武汉医院”|天使日记如果你想我了，就吃了这颗糖|天使日记那一刻，我决定做住院老奶奶和她老伴儿的“通讯兵”｜天使日记身穿白色防护服的我们就像守卫健康的大白，一定会守护你们平安上岸！｜天使日记“我能做的就是让他们尽早回家和家人团聚”|天使日记“在武汉过生日，我们一起用手扇风熄灭蜡烛”|天使日记凌晨三点我帮阿姨扶着呼吸机，她用武汉话说：“谢谢你丫头，好人有好报！”|天使日记从重症转回普通病房的病人一直握着我的手不愿松开，还比划着胜利的手势|天使日记嫂子，我们都是你的后援团！|天使日记我会再来武汉，吃一碗正宗的热干面！|天使日记病人唯一的希望就是我们，我们必须坚强|天使日记老公举着那两行字的画面每天都在我脑海里闪现|天使日记“他最后还是走了…我们已经拼尽了全力，相信他也是”|天使日记他们的背后是整个家庭，所以我必须竭尽所能！|天使日记妈妈明年就要退休了，还在一线，我更不能缺席|天使日记好心人听到我前两天在中国之声的天使日记，特意寄给我一箱苹果|天使日记我希望把爱心传递下去，让医患关系温暖起来！|天使日记
2020年02月26日,90后“抗疫”志愿者：做快乐的“螺丝钉”，哪里需要去哪里..._荔枝网新闻,央视财经,在抗击新冠肺炎疫情的过程中，湖北武汉各个岗位上的人们都各司其职，将自己的本职工作做到最好。然而还有一个群体，他们却主动选择成为一颗颗螺丝钉，哪里需要就出现在哪里。一件绿马甲，或是一顶小红帽，都是这些志愿者忙碌的身影。为方舱医院里的患者广播，是九零后志愿者华雨辰上午的第一项任务。伴着广播声，武汉青山方舱里的患者们陆续开始活动，有的还跳起了舞。这一天，又有患者出院了，华雨辰还播报了一封《告治愈者书》。因为不能进入病区，华雨辰并不知道一墙之隔的患者会有何反应，但她相信这道墙不会隔断爱的传递。广播结束，华雨辰有时要和街道工作人员一起将患者和医护的午餐送到方舱门口。前一天送餐时，她们为3位患者偷偷准备了生日蛋糕。湖北省武汉市青山区志愿者华雨辰：这是武汉当地的剪纸，给他们准备的特别的生日贺卡。我们就想做一些事情让他们觉得不要去放弃，我们很多人还是在关注你们、关心你们。作为志愿者，华雨辰还经常到各处帮助运送分发各地支援的物资。湖北省武汉市青山区志愿者华雨辰：确实平时没干过这些活，辛苦还是辛苦的。累现在不重要了，重要的就是你现在做的事情有没有用。华雨辰所在的志愿者群里，每天都会不定时派发各种任务。这支队伍现在已有284人，年龄最小的只有20岁。湖北省武汉市青山区志愿者华雨辰：所有的小伙伴都干得热火朝天，到处需要我们去帮忙。很受鼓舞，特别有安全感，你就会觉得有一群人都在使劲。我可能力量不够，但是它现在需要人，哪怕我力量再小，我多去一个也是一份力量。中午在路边的台阶上匆匆吃完盒饭，华雨辰又赶往高速路口帮忙测体温。这项工作虽然简单，但一站就是6个小时。为了把医用防护服留给医务人员，志愿者们一般只穿简单的防护服，反复消毒使用。湖北省武汉市青山区志愿者华雨辰：这些东西都是我们稀有资源，不穿破不会换的。他们说我穿的防护服应该是3个L加的，穿起来走路很像个企鹅。忙碌工作间隙，九零后的华雨辰常常会不经意露出自己活泼的一面。因为志愿者不具备在外隔离条件，华雨辰每天工作后仍要回家居住。在外像个“战士”，但当要面对自己父母时，她却选择了隐瞒。渐渐地，华雨辰心理上有点扛不住了。湖北省武汉市青山区志愿者华雨辰：进家门的时候我很难受那一瞬间，我就不敢进去。我万一要是真的把这个病毒带回家传染我爸妈了，那我到底做的这个事情，它到底是对的还是错的，这个真的是到现在其实我每天都在纠结这个事情。得知真相后，父母并未明确表态是否支持，但华雨辰仍然感受到了一些变化。无论回家多晚，父母总是在客厅等她。湖北省武汉市青山区志愿者华雨辰：我当时坦白之后，我爸爸当时第一个问我的问题就是“我能不能替你去”？我说不行，你这个年龄比我更危险，我抵抗力比你强。他说那我能不能陪你去，还缺不缺人，起码你让我跟你一起，我就知道你在干什么，我放心。华雨辰的本职工作，是一名小学音乐老师。因为疫情无法开学，她最近给学生们制作了一首特别的“防疫”《健康歌》，还号召孩子们一起录歌，唱给抗疫英雄。湖北省武汉市青山区志愿者华雨辰：我就想一直等着胜利的号角吹响，在这之前我相信我们当中不会有人放弃的。本文编辑：张爽
2020年02月26日,战疫情丨各地紧急支援 50余台“人工肺”陆续抵汉_荔枝网新闻,央视新闻客户端,体外膜肺式氧合仪ECMO，俗称“人工肺”，对于新冠肺炎危重症患者救治起着重要作用。根据湖北省提出的需求，中央指导组物资保障组在全球紧急寻找货源，目前初步落实50余台，陆续运抵武汉。除了国外采购外，国家发改委、国家卫健委向委属医院发出紧急征调通知，这两天，从各地紧急支援的体外膜肺式氧合仪陆续运抵武汉。为了保障第一时间运送到最需要的医院，武汉邮区中心局开启了绿色通道，专人专车负责转运。央视记者王胜东：在华中科技大学附属同济医院里，工作人员正在对刚刚抵达的5台人工肺进行现场分配。华中科技大学附属同济医院后勤处处长涂宣成：我们收完货以后，马上签收以后就放到各个病区去使用。这些从各地紧急调运的体外膜肺式氧合仪已经分配给了同济医院、协和医院、雷神山医院等重症定点医院。（编辑宋云霄）
2020年02月26日,云会诊助力抗击新冠肺炎 南京专家远程为重症患者“开药方”_荔枝网新闻,江苏广电融媒体新闻中心,videocotrol=""durtio="0"fbl=""oter="htt:img.v.jtv.comimge2020225JSTV_JSWS_1582625308480_2Y2rSD_0.jg"rc="htt:vod.v.jtv.com20200225JSTV_JSWS_1582625308480_2Y2rSD_1536.m4"webkit-lyilie=""video江苏驰援湖北的医疗队正在前线奋战，其中，南京鼓楼医院的一支医疗队，接管的是武汉同济医院光谷院区的一个重症病区，共有52张病床。前两天，这个病区转来了两名新冠肺炎危重症患者，病程长、病情重。为了全力救治这两名患者，2月25日上午，武汉前线和南京后方的专家展开了一场远程会诊。上午8点30分，武汉华中科技大学同济医院光谷院区，这里即将进行的一场特殊的三方会诊，除了同济医院光谷院区的医生参加之外，还有援助武汉市第一医院的感染科专家吴超，以及鼓楼医院本部的多学科专家。江苏援湖北医疗队武汉同济医院光谷院区总领队、南京鼓楼医院副院长于成功介绍患者情况：患者是前天晚上紧急从外院转过来，一个73岁，一个58岁。病程都比较长，三周以上，病情都比较危重；其中一个特别危重，带着气管插管。我们在前线有一定的经验，但是还得更加多听听后方专家的意见，包括其他学科专家合理化的建议。在南京的鼓楼医院，从早上八点半开始，医院呼吸科、消化科、重症医学科、中医科，还有肾脏科的专家汇聚在一起，通过远程视频的方式跟武汉前方进行多学科会诊，为患者提供更加完善的治疗方案。南京鼓楼医院重症医学科主任顾勤介绍，大家讨论的主要目的是怎么来维护这样严重新冠肺炎的肺，怎样维护新冠肺炎严重缺氧所导致的其他器官的损伤，或者免疫攻击所导致的其他器官的损伤。这个过程当中从细节上做一些调整，做一些可能的预案。在武汉市第一医院，南京鼓楼医院副院长、感染科专家吴超建议，下一步对这两名危重症患者进行更精准的检查和治疗。明确真正造成感染的细菌是什么，然后针对性的治疗。如果大剂量的抗菌素使用，多重抗菌素使用，可能会导致后续的问题，正常的菌群完全没有的话，对患者的肺恢复其实是不利的。专家表示，远程会诊的方式能集中前后方多学科专家的意见，为抢救危重病人赢得时间。经过医护人员的精心救治，截至2月25日，南京鼓楼医院医护人员接管的武汉市第一医院重症病区，和武汉同济医院光谷院区重症病区，共有14名患者出院。江苏广电融媒体新闻中心记者王思翔邓曦范思成龚俊杰杨伟东编辑胡超（本条新闻版权归江苏省广播电视总台所有，转载请注明出处）
2020年02月26日,【国际锐评】中国抗疫做得怎么样？ 听听世卫专家的评价_荔枝网新闻,中央广电总台国际在线,“中国的方法是目前我们唯一知道的、被事实证明成功的方法。”世界卫生组织总干事高级顾问布鲁斯·艾尔沃德24日说的这番话，令人印象深刻。当天，中国—世卫组织新冠肺炎联合专家考察组在北京举行新闻发布会。考察组认为中国采取了前所未有的公共卫生应对措施，在减缓疫情扩散蔓延、阻断病毒的人际传播方面取得明显效果，避免或至少推迟了数十万新冠肺炎病例。他们还建议，其他国家应迅速重新评估对中国采取的措施。作为考察组外方组长，艾尔沃德在会上坦承，他曾经像其他人一样对非药物干预措施的态度模棱两可。而中国的做法是，既然没有药，没有疫苗，那么有什么就用什么，根据需要去调整，去适应，去拯救生命。这些客观中肯的评价，来自于对疫情防控一线的深入调研。9天时间里，由12位国际人士组成的世卫专家组，与中方同行一道，对北京、广东、四川、湖北等地进行了现场考察。中国抗疫做得怎么样？基于一线考察得出的结论，显然具有权威性和公信力。这次新冠肺炎疫情，是新中国成立以来面对的传播速度最快、感染范围最广、防控难度最大的一次重大突发公共卫生事件。对中国而言，这是一次危机，也是一次大考。而中国正在交出这样的答卷：中国最高领导人习近平亲自指挥部署，多次主持召开最高决策层会议，确定疫情防控的总要求和总目标；中国国务院成立联防联控机制；中央指导组赴疫情中心督战指挥……这些为打赢疫情防控阻击战提供了强大的领导力。从果断暂时关闭武汉对外通道，到各地统一行动、构建覆盖城乡基层的疫情防控网络；从武汉迅速建成一批集中收治医院，到各地和军方调派330多支医疗队、4万多名医护人员紧急支援；从组织医用物资生产企业迅速复工复产，到优先保障疫区各类物资供应，中国社会上下在抗击疫情面前，展现出了令人惊叹的中国速度、中国规模和中国效率。最新数据显示：24日这天，中国内地除湖北以外新增确诊病例降至个位数。中国多地已下调突发公共卫生事件应急响应级别。这正如中国最高领导人日前在一个面向约17万人的电视电话会议上所强调的，实践证明，中央对疫情形势的判断是准确的，各项工作部署是及时的，采取的举措是有力有效的，再次彰显了中国共产党领导和中国特色社会主义制度的显著优势。确实，对国际社会而言，中国用一个多月取得疫情防控明显成效，为分析社会制度与治理效能等问题提供了鲜活样本。美国政治作家萨拉·弗朗德斯日前撰文指出，中国针对新型冠状病毒所采取的措施，在资本主义国家是闻所未闻的。中国社会主义的根本属性决定了在危机中或紧急情况下，人民的福祉优先于资本主义利润。美国库恩基金会主席罗伯特·劳伦斯·库恩认为，中国政府展现出的组织动员能力在全球卫生史上没有先例，其他国家很难做到。中国及时遏制疫情蔓延，主要是因为有中国共产党的集中统一领导。艾尔沃德在24日的发布会上，则对中国领导人“了不起”的决定、中国抗击疫情时展现的协同优势以及全政府、全社会的集体意愿表示称赞，称之为“真正意义上的团结”。正是因为中国社会高度团结、充分发挥制度优势，历史上重大灾难和病疫往往导致社会混乱失序的情况，并没有在中国发生。很多外国网友评论说：“中国各地水不停，电不停，暖不停，通信不停，生活物资供应不停，社会秩序不乱，这在国外是不敢想象的。”这也从一个侧面展现了中国社会治理能力的提升。人们注意到，世卫组织总干事谭德塞24日宣布，中国疫情顶峰已过，尚未构成全球性大流行。国际抗病毒研究学会主席、比利时鲁汶大学病毒学教授约翰·内茨指出，中国采取的一系列措施果断有力，为国际社会有效应对这次疫情挑战赢得了宝贵时间。就像艾尔沃德所建议的，世界需要中国的经验来应对这场疫情。目前，一些被中国证明行之有效的举措，正在被其他出现疫情的国家借鉴采纳。比如意大利政府日前已宣布，对11个市镇采取封闭管理措施。由于新型冠状病毒是一种新的病原体，人类对其认识有一个完善的过程，疫情防控不能有丝毫松懈。但正如谭德塞所说，“应该给所有国家带来希望、勇气和信心的关键信息是，这种病毒能够被控制。”作为一个对全球公共卫生高度负责的国家，中国将继续发挥制度优势，全力抗击疫情，并与各方分享防控经验，加强抗病毒药物及疫苗研发合作，对外提供力所能及的援助。团结合作，坚定信心，世界就能早日渡过这场危机。（国际锐评评论员）
2020年02月26日,离退休还有两个半月 扬州医生三次主动请缨赴武汉前线_荔枝网新闻,江苏广电融媒体新闻中心,来自江苏省苏北人民医院的李允模，现在正在武汉市第一医院重症病区工作。其实，还有两个半月他就要退休了，但面对疫情，他三次主动请缨，坚持要到一线去。李允模说，钟南山院士都80多岁了，还在抗疫一线呢！2月13号，李允模跟随江苏医疗队准备出发，走得匆忙，忘带身份证了。他的妻子赶来送证件，这才得知丈夫要出征武汉，加上李允模的两根肋骨骨折还未痊愈，妻子十分担心。安抚好家人，李允模奔赴武汉。到达后，他一头扎进工作，每天查病房、看病情，有时还给年轻的同事做心理疏导。前两天，同组的医生手指意外划破，刚下白班的李允模听说后，担心她被感染，主动要求帮忙值班。李允模说，大家既是同事，也是战友，只有互相帮助，才能攻克难关！虽然每一位战“疫”前线的医护人员都说，这是他们应该做的。但在这场战“疫”中，他们都是让我们安心的守护者，谢谢你们的坚守，谢谢你们的付出。江苏广电融媒体新闻中心王芳胡超扬州台（本条新闻版权归江苏省广播电视总台所有，转载请注明出处）
