2020年02月26日,命运与共，中国向世界展现战“疫”中的大国担当_荔枝网新闻,央视新闻,新冠肺炎疫情发生后，中国怎么应对、应对效果如何，国际社会高度关注。2月24日晚，中国—世界卫生组织新冠肺炎联合专家考察组在北京举行新闻发布会。考察组外方组长、世界卫生组织总干事高级顾问布鲁斯·艾尔沃德在通报考察组现场调研情况时指出，面对未为人知的新型病毒，中国的反应和措施是恢宏的、是灵活的、是大踏步的。在全面有力防控疫情的同时，中国积极主动同世界卫生组织和国际社会开展合作和信息交流。习近平主席多次与外国政要及国际组织负责人通过会见、通电话、致函等方式进行沟通，向国际社会介绍中国抗击疫情的积极进展，表达中国战胜疫情的决心和信心。中国在阻击新冠肺炎疫情蔓延方面的努力和成效，充分彰显了中国维护全球公共卫生安全的责任感和使命感，体现负责任大国担当，获得国际社会高度赞誉。“我们坚决维护中国人民生命安全和身体健康，也坚决维护世界各国人民生命安全和身体健康，努力为全球公共卫生安全作出贡献。”习近平主席在与多个国家领导人的沟通中，都强调了中国采取最全面、最严格、最彻底举措，维护全球公共卫生安全，促进世界人民健康福祉的坚定决心与信心。新冠肺炎疫情发生后，按照“坚定信心、同舟共济、科学防治、精准施策”的总要求，中国采取了前所未有、世所罕见的防控与救治举措：第一时间启动疫苗研发工作，快速从样本中分离出新型冠状病毒并检测出病毒全基因组序列，并及时向全世界公开全部信息；组织29个省区市和新疆生产建设兵团、军队等调派330多支医疗队、41600多名医护人员驰援湖北；历时10多天建成火神山、雷神山两所专门医院；紧急建设多所方舱医院，大幅提升收治能力……一系列快速有力的措施筑牢控制疫情蔓延的防线，为其他国家防控疫情争取到宝贵时间。世界卫生组织总干事谭德塞表示，正是由于中方采取强有力防控措施以及中国人民作出的巨大牺牲，才有效阻遏了疫情向世界其他国家的蔓延，“如果没有中国努力，全球病例会远高于此”。“我一直讲，人类是一个命运共同体。战胜关乎各国人民安危的疫病，团结合作是最有力的武器。”在同印尼总统佐科、英国首相约翰逊、巴基斯坦总理伊姆兰·汗等国家领导人的通话，以及给比尔·盖茨的回信中，习近平主席都提到了人类命运共同体理念。全球化时代，世界各国、各地区之间的联系日益紧密，国际社会已成为你中有我、我中有你的命运共同体。中国从疫情一开始就采取公开、透明、负责的态度，与世界卫生组织及各国加强沟通、密切合作，及时通报信息，邀请世卫组织等相关专家前往武汉实地考察，并积极配合世卫组织专家考察组在北京、广东、四川等地考察，尽全力阻止疫情在全球传播。中国人民在疫情防控中展现的不仅是中国力量、中国精神、中国效率，更是对人类共同利益的价值追求。在得知日本新冠病毒核酸检测试剂不足后，中国在自身面临疫情严峻挑战的情况下，紧急向日本国立传染病研究所捐赠一批新冠病毒核酸检测试剂盒。在日本向中国捐助的医疗防护物资中，“山川异域，风月同天”的话语更是温暖了无数人。面对疫情挑战，几十个国家和国际组织为中国提供捐款和医疗防疫物资。一场突如其来的疫情，让世界各国真切体会到休戚与共、命运相连。中国与世界各国守望相助、共克时艰，生动诠释了习近平主席所倡导的人类命运共同体理念。“中华民族历史上经历过很多磨难，但从来没有被压垮过，而是愈挫愈勇，不断在磨难中成长、从磨难中奋起。”习近平强调，实践证明，党中央对疫情形势的判断是准确的，各项工作部署是及时的，采取的举措是有力有效的。在以习近平同志为核心的党中央坚强领导下，中国举全国之力，采取最全面、最严格、最彻底的防控举措，同时以公开、透明、负责的态度，与国际机构和世界各国共享疫情信息。对中国为防止疫情蔓延付出的巨大努力，多国领导人、国际组织负责人表示高度赞赏。国际社会普遍认为中国采取的坚决有力的防控措施，展现的出色的领导能力、应对能力、组织动员能力、贯彻执行能力，是其他国家做不到的，为世界防疫树立了典范。联合国秘书长古特雷斯表示，中国为控制新冠肺炎疫情并避免其蔓延作出了巨大努力，这种努力是“非凡的”。世界卫生组织总干事谭德塞前几日再次对中国抗击疫情的努力给予积极评价：“世卫组织一直呼吁各国领导人在公共卫生挑战面前展现足够的领导力和政治意愿，而中国在这方面的表现值得其他国家学习。”2月18日，英国首相约翰逊在与习近平主席通电话时，对中国采取全面有力措施防控疫情、及时同国际社会分享信息、努力防止疫情在世界蔓延表示高度赞赏。2月20日，巴基斯坦总理伊姆兰·汗在与习近平主席通电话时表示，由于中方的有效防控，疫情并未在世界蔓延。整个世界都感谢并赞赏中方应对疫情的努力和成效，没有任何国家可以做得比中国更好。目前，170多个国家领导人和40多个国际和地区组织负责人以电话、信函、声明等方式对我国表示慰问和支持。中国同世卫组织保持良好沟通，同有关国家分享防疫经验，加强抗病毒药物及疫苗研发国际合作，向其他出现疫情扩散的国家和地区提供力所能及的援助，凝聚起防控疫情的全球力量。中国战“疫”，一个负责任大国的勇气和担当。
2020年02月26日,汇聚决战决胜磅礴力量 万众一心夺取双胜利——习近平总书记在统筹推进新冠肺炎疫情防控和经济社会发展工作部署会议上的重要讲话引发强烈反响_荔枝网新闻,央视网,videocotrol=""durtio="0"fbl=""oter="htt:img.v.jtv.comimge2020226CCTV_CCTV1B_1582717612185_cmeoV0_0.jg"rc="htt:vod.v.jtv.com20200226CCTV_CCTV1B_1582717612185_cmeoV0_1670.m4"webkit-lyilie=""video央视网消息（新闻联播）：连日来，习近平总书记在统筹推进新冠肺炎疫情防控和经济社会发展工作部署会议上的重要讲话，在广大干部群众中引发强烈反响。大家纷纷表示，要在以习近平同志为核心的党中央坚强领导下，坚定信心，迎难而上，顽强拼搏，把党中央各项决策部署抓实抓细抓落地，一定能够战胜疫情，一定能够完成全年经济社会发展目标任务。习近平总书记的重要指示，为做好疫情防控工作指明了方向，为全面打赢疫情防控的人民战争、总体战、阻击战注入了必胜的决心。“沧海横流，方显英雄本色。”疫情面前，党员干部冲锋在前、人民群众众志成城，汇聚成强大合力！总书记要求，要关心关爱一线医务人员，大家都在抓落实。这是一次危机，也是一次大考。各地各部门更加要坚定必胜信念，咬紧牙关，继续毫不放松抓紧抓实抓细各项防控工作。加强宣传教育和舆论引导，及时回应社会关切，积极推动问题解决。新闻工作者不畏艰险、深入一线，为疫情防控营造了良好舆论氛围。打赢脱贫攻坚战是全面建成小康社会的硬任务。各地扎实推进脱贫攻坚各项工作，积极克服疫情给贫困群众发展产业、外出务工带来的不利影响。恢复生产生活秩序，关系到民生保障和社会稳定。要以“咬定青山不放松”的韧劲、“不破楼兰终不还”的拼劲，沉下心来、扑下身子，狠抓落实。
2020年02月26日,首例新冠肺炎病例解剖：要做分类 耗时是平日3倍_荔枝网新闻,新闻联播,（原标题：独家视频丨首例新冠肺炎逝者遗体解剖结果将公布，法医透露手术细节）videocotrol=""durtio="0"fbl=""oter="htt:img.v.jtv.comimge2020226jieou_m.jg"rc="htt:vod.v.jtv.comvideo202022620202261582673025585_58_1456.m4"webkit-lyilie=""videotrog遗体解剖的目的是什么？trog记者：解剖新冠肺炎逝者遗体，并对重要信息进行研究，是出于什么目的？刘良：目的是要搞清楚这个病毒伤害了病人的什么地方，我们叫“靶器官”。我们要探讨病毒的传播途径，还要针对这个地方研究用药。此外，还要弄明白这个病毒是通过什么机制让肺受到损伤的。如果找准的话，就可以针对性地采取保护性措施。如果没有解剖的话，基本上就搞不清楚对手，也搞不清楚它打击你的方向，是茫然的。trog首例解剖手术为何迟迟未进行？trog早在1月22日，刘良就呼吁对新冠肺炎逝者进行病理解剖，并联合团队向相关部门递交紧急报告，强调病理解剖的重要性。然而第一例新冠肺炎逝者遗体解剖手术直到2月16日才进行，这期间刘良团队遇到了什么难题？刘良：首先，场地保证不了，解剖场地必须是要负压的，但我们国家只有负压的实验室，没有负压的解剖室。此外，伦理方面，我们还要征求死者家属的同意，要面对面去沟通。这包括时间和空间上的问题，所以难度很大。记者：您在等待的过程中心态是怎样的？刘良：我着急，因为不断有人死去，然后都很茫然。如果早一天知道病变，对临床治疗是非常有价值的。trog家属同意捐献遗体trog手术室改造为解剖间2月15日下午，刘良接到通知，有家属同意捐献亲人的遗体做病理解剖，武汉金银潭医院同意将一间小手术室改造为解剖间。刘良：这个医院的手术室是一个带负压的空间，比较适合解剖。我们把里面非必要的东西全部清走了，还有一个要注意的是，不造成室内一些血迹的污染。因为除了空气以外，它还对地面和对下水有影响。记者：您进去之前要做什么样的防护？刘良：我们跟临床医生一样，要做各种防护，当然我们的防护级别要高。我们戴三层手套，两层口罩，帽子戴两层或者三层，然后护目镜加上防护屏。服装的规格也很高，密封性特别好，不透风不透气。这样就能把全身暴露的位置全部给封闭掉。2月16日凌晨一点左右，刘良团队三人进入解剖间，开始新冠肺炎逝者的第一例病理解剖。刘良：解剖前，我们集体给他鞠躬，鞠躬时间特别长。我们对这位逝者非常尊敬，发自内心非常感谢他们，他们是大爱。平时做一例解剖手术，刘良需要一个小时左右。而第一例新冠肺炎患者遗体解剖却持续了将近三个小时，几乎是平日的三倍，到凌晨三点五十分才结束。记者：这次时间长的原因是什么？刘良：第一是第一例，要谨慎小心一点；第二确实是很难受。人在里面缺氧，到后面缝一针就大喘气，腰也不舒服。穿上那个服装，就跟宇航员一样，闷在里面汗不停地往下掉，会有脱水的情况。下半夜，也有饥饿的状态。记者：从做第一例到现在，您觉得是多多益善，还是到了一定的需求就可以了？刘良：多多益善。记者：为什么？刘良：开始说病毒“欺负”老人，过了一段时间年轻人也有了，小孩也有了。所以它必须要按不同的年龄、不同的性别、自身有没有其他疾病做分类。这样就能把这个肺炎的一般规律找出来。如果不做分类，很容易产生新的问题。trog解剖结果近几天会公布trog由解剖获得的新冠肺炎病理已送检，有望寻找到新冠肺炎的致病性、致死性病理，给未来临床治疗危重症患者提供依据。刘良：24日早上钟南山院士给我打过电话，他说他们前线的医生就等我这个结果了，否则不知道治疗到底怎么办，治疗效果怎么评估。记者：您接到这个电话，心里怎么想？刘良：我着急，赶快抓紧时间，到24日其实已经开始有初步结果了。初步结果我们内部在讨论，形成一个共识，近几天就会发出来。发出来以后，会尽快给一线医生。
2020年02月26日,辟谣！网传武汉一小区有肺炎重症治愈病人上吊自杀：不属实_荔枝网新闻,荔枝新闻,trog荔枝新闻讯trog2月26日晚，据武汉市江岸区官方微博@武汉之心长江金岸通报，2月25日，有网友在网上反映武汉塔子湖锦绣家园一被治愈的新冠肺炎重症病人，回家后发现一家人都已去世，遂在楼顶上吊自杀，传播部分视频。经核实，近期江岸辖区内无类似警情，未处理过类似报警。视频中出现的小区并非塔子湖锦绣家园小区，通过楼房对比视频中出现的小区外观与塔子湖锦绣家园小区存在明显差异。视频中民警非江岸民警，疫情发生以来，江岸民警处理类似警情均穿戴防护服、护目镜等防护装备。网上视频中所反映的事件发生地并不是在江岸辖区。 
2020年02月26日,常州开通心理热线 为疫情阻击战打造“心理屏障”_荔枝网新闻,我苏网,trog我苏网讯 trog新冠肺炎疫情牵动人心，也冲击着很多人的神经。为了缓解市民的焦虑恐惧情绪、学生因居家学习而产生的不适应等心理问题，常州辖市区教育部门的心理咨询志愿者纷纷开通心理咨询热线，为有需要的市民提供帮助。“您好，这里是溧阳市未成年人成长指导中心心理热线,请问您有什么困惑？”在常州溧阳市未成年人成长指导中心，国家二级心理咨询师、防疫情心理危机干预小组志愿者吴艳正在为市民提供帮助。截至目前，溧阳市心理咨询热线接听来电200余个，涉及一线医务人员如何缓解情绪焦虑、普通市民居家生活如何释放情绪、家长怎样与长期居家学习的孩子沟通，以及开工时间未明确的餐饮、中小微企业负责人面临生活压力等一系列问题。武进区教育局也设立了阻击疫情期间未成年人指导中心，向未成年人及家长开通了24小时抗疫心理援助热线。因为疫情影响，学生都在居家学习，会导致许多心理问题的产生。小陈是一位高中生，曾经有很长一段时间沉迷于手机网络。通过家长和老师的共同督促，小陈沉迷网络的习惯渐渐得到了改善。但近阶段小陈父母发现，孩子经常会以上网课为借口玩手机游戏，家中时常发生争吵。无奈之下，父母只好打电话向心理咨询师吴艳求助。吴艳告诉小陈父母，疫情消息的反复刺激会让情绪敏感，再加上孩子正处于青春期，父母一定要营造良好家庭氛围，可以通过在家中布置绿植、与孩子聊些感兴趣的话题、开展一些互动性强且劳逸结合的活动，让孩子的情绪开朗起来；也可以借助老师的力量，请老师和孩子多沟通，劝导他不要花费太多时间游戏上。经过多次电话沟通和指导，父母改变了策略，小陈的情绪得到了极大改善。小陈父母告诉吴艳，现在孩子已经愿意跟他们平心静气地交流，认识到了沉迷手机游戏的危害，每天会按时投入学习。记者了解到，受疫情影响，学校延迟开学，学生居家学习会导致课业压力增加、心理负担加重、亲子矛盾激化、沉迷网络手机游戏等一系列问题。据统计，这些问题占到了咨询热线的6成，通过老师的引导大多能在短时间内得到缓解。溧阳市未成年人成长指导中心负责人汪小西建议，近阶段学生自主支配时间加长，除了要学好课本知识外，要通过看课外书、帮助父母分担家务等活动提高自身综合素质；家长要用好这段时间，与孩子一起参与一些互动性强、让孩子感兴趣的活动来改善亲子关系；家长要起到榜样表率作用，用实际行动引导孩子正确地学习生活。“不仅是溧阳本地市民咨询，甚至有来自武汉、广州、大连、上海等全国各地的群众来向我们咨询。”汪小西介绍，因为溧阳防疫心理咨询热线开通较早，许多外省市居民都会来电咨询。市民陈女士因与湖北返乡人员有过密切接触，被要求居家隔离。在家隔离一周后，陈女士既担心自己被传染，又闷得发慌，一直闷闷不乐。汪小西得知后，立即与她联系，经过多次开导，陈女士已开朗了许多。汪小西说，令他印象最深刻的是一位武汉社区医生的求助电话。那天凌晨1点，那位医生来电说，身处疫情最严重的地方，每天除了高强度工作外，时时刻刻都担心自己会被感染，家人也一直希望他能辞职，他的心理和身体承受着双重压力。了解情况后，汪小西耐心开导他：全国人民都理解你们医务工作者的辛苦付出，对你们有着崇高敬意，社会各界都会给予你们足够的支持和关心。同时，在工作和生活中一定要有足够的防护意识，做好个人防护工作，重视自我休息，保证充分的睡眠和均衡饮食。多了解正面、积极的治疗案例和防疫进展，适当与亲友沟通、倾诉，积极与同事分享防疫工作中的成功案例，多接收正能量信息，要坚信曙光就在前方。通过一段时间沟通与开导，这位医生的情绪得到了极大缓解，他也很感谢溧阳市的心理咨询热线让他有了可以倾诉的对象和解除疑惑的途径，他一定会重新坚定理想信念，用更饱满的精神投入疫情防控工作。（来源：江苏广电常州中心站汤琤谢博涵编辑徐金吉）
2020年02月26日,打击利用疫情诈骗！江苏警方一个月抓340名嫌疑人_荔枝网新闻,央视,原标题：打击利用疫情诈骗！江苏警方一个月抓340名嫌疑人新冠肺炎疫情发生后，全国上下同舟共济、奋勇拼搏，全力投入疫情防控阻击战。在这关键时刻，少数不法分子却利用疫情趁机实施诈骗犯罪，性质十分恶劣。据江苏警方今天（26日）通报，江苏各级公安机关闻警而动，省、市、县三级反通讯网络诈骗中心全面动员、全面部署、全面加强打击工作，掀起凌厉攻势，一个月来破获此类案件429起，抓获犯罪嫌疑人340名，止付冻结涉案账户5000多个、资金3000余万元。（总台央视记者唐高林）
2020年02月26日,多种方法、在线教学……居家科学健身呈现新亮点_荔枝网新闻,中国新闻网,中新网北京2月26日电“我闷在家里也可以有这么有意义的事情做”这是一名网友在“龙都运动家”全民战疫·健身达人赛网络端口的留言。自新冠肺炎疫情暴发以来，濮阳市将健身课办到了网上，极大丰富了居民居家生活，通过学习模仿专业人士的动作，与网友竞技比拼，加速了当地全民健身工作科学性。这样的故事，在全国各地纷纷上演。trog千种方法总有一款适合你trog为了避免疫情期间交叉感染，国家号召全国人民尽量减少外出，“宅在家里”。为了丰富全国人民居家生活，培养主动健康、主动锻炼的意识和习惯，增强身体免疫力、防病抗病能力，1月30日，国家体育总局下发了《关于大力推广居家科学健身方法的通知》。广播体操再一次回到大众视野，多家媒体再次发布国家体育总局创编的第九套广播体操视频。国家体育总局体育科学研究所创编的“科学健身18法”受到了普遍欢迎，不少省市均大力推广该方法。此外，体育系统还推出了各种健身操舞、专项练习方法等。随着中医更多介入新冠肺炎疫情治疗，以太极拳、八段锦为代表的我国传统武术、健身气功等健身方法也受到了普遍重视，医疗专家在不同场合都表达了太极拳、八段锦等功法的固本培元、强身健体的功效，全国各地的不少医院里也时常响起八段锦习练的悠扬乐声。以此为契机，国家体育总局武术运动管理中心、国家体育总局健身气功管理中心组织相关专家、学者，加大了太极拳、八段锦的推广力度，北京体育大学等全国各地专业体育院校也第一时间组织师资录制了教学视频，各地也利用自己的专家资源，让太极拳、八段锦走进寻常百姓家。一家人居家习练太极拳、健身气功已经成为疫情防控期间的一道风景。与此同时，各地也结合自身的文化特点、体育特点，推出了一系列接地气的居家健身项目，如“华佗故里”安徽亳州的五禽戏，贵州的苗族健身操等。根据国家体育总局群体司汇总的数字，截至2月25日，全国各省区市、体育总局系统共发布了1453条居家健身方法。trog媒体助力线上阵地大拓展trog居家科学健身方法推广过程中，各级体育部门与媒体积极对接。中国体育报、新体育网“报网端微”联动，从1月28日开始，率先发布居家健身类内容，并将“抗击疫情，居家科学健身”作为报道的重点，疫情防控期间采写、推出了大量科学健身、健康指导类内容，尤其发挥新媒体优势，发布国家体育总局各单位、各地体育局、全国各地体育院校推荐的各类科学健身视频近300条。互联网+、新媒体手段也催生居家健身的新方法，如在线远程体育教学，在线一对一体育教学，形式多样的在线全民健身活动、竞赛等。“龙都运动家”全民战疫·健身达人赛短时间内就收集了全民健身视频作品500余条；在国家体育总局群体司、宣传司的大力支持下，中体产业集团股份有限公司和“抖音”“快手”共同发起三个居家健身活动和赛事，其中抖音#居家健身都出花样#话题播放量12亿次，#运动也要带节奏#话题播放量5.9亿次，快手相关播放量8.1亿次，累计播放量26亿次。trog明星大咖在线零距离论道trog为了提升线上赛事活动的关注度、影响力，不少单位选择和奥运冠军、知名运动员合作，如国家体育总局社会体育指导中心联合了邢傲伟、黄旭、莫慧兰等人，拍摄了一组九套亲子趣味体育视频，通过线上亲子赛的平台，邀请家长和孩子共同魔方参与，倡导居家亲子体育活动，提升孩子体质，增强家庭凝聚力。乒乓球奥运冠军王楠则在由其发起的“国球舍”平台启动了“宅屋乒乓战”活动，吸引了数万家庭参与，简单的颠球挑战还延伸出诸如“谁输谁刷碗”之类的家庭化奖惩机制，进一步提升了活动的趣味性。王楠也和自己的孩子参与了本次活动，引发了网友的关注和模仿。此类赛事活动另一大特点就是互动性强，如中国象棋协会在“天天象棋”“虎牙直播”开设“棋心聚力”全国象棋冠军公开课，在邀请王天一、郑惟桐等象棋大师进行在线授课的同时，也与全国棋迷互动、答疑，难得的机会吸引了大量象棋爱好者关注，一堂45分钟的公开课，经常能收获300万人次以上的观看量。专家分析认为，本次疫情造成的精神创伤将唤醒大众健身意识的深度觉醒，重塑人们的生活方式，人们对于体育锻炼和强身健体的消费需求将会涌现出新动能，健康、体育锻炼将在大众以后的生活中扮演重要角色。(完)【编辑:苑菁菁】
