2020年02月26日,尼泊尔各界友人声援武汉，为中国加油！_荔枝网新闻,中国文化网,trog雪中送炭显真情中尼友谊暖人心trog为支援中国打赢新型冠状病毒肺炎疫情防控阻击战，2月7日，尼泊尔政府紧急向湖北武汉捐赠口罩10万只。捐赠仪式在尼泊尔外交部举行，中国驻尼泊尔大使侯艳琪出席并致辞。尼泊尔外交部长贾瓦利、卫生与人口部长达卡尔等政府官员出席。新型冠状病毒肺炎疫情的爆发，牵动着许多关心和热爱中国的尼泊尔朋友的心，他们时刻关注着疫情变化和中国的防控进展。近日，尼泊尔驻华大使鲍德尔携全体馆员在北京为武汉加油，在尼泊尔的阿尼哥协会成员、加德满都大学孔子学院师生等尼各界友好人士也自发拍摄视频声援武汉，纷纷喊出“中国加油，武汉加油”“中国武汉加油，你能行，我们和你在一起”等口号，为中国加油打气。博克拉的民众举行烛光守夜为中国祈祷，场面感人。在尼泊尔跨喜马拉雅发展中心举办的“支持中国抗击疫情，促进中尼民心相通”活动中，为声援中国抗击新冠肺炎疫情，尼泊尔知名艺术家巴拉腊姆·达哈尔和马诺斯·甘朱莱尔分别创作并朗诵诗歌《我们在一起》和《来自佛祖故里的祝福：中国不能则谁能》。部分尼泊尔小学生为支持中国抗击疫情创作了许多绘画作品，并在活动中表演了由尼友人填词作曲的尼中双语歌曲《当你痛苦的时候》：“我受难时，你为我负重前行；你战‘疫’时，我也愿与你并肩战斗！”“阴霾总会过去，春天必将到来；让我为你祈福，祝你平安！”这些情感真挚的表演让在场者深受感动。尼泊尔各界友好人士通过多种形式支持中国抗击疫情。
2020年02月26日,湖南：全省上下一盘棋 防疫生产两不误_荔枝网新闻,光明网-《光明日报》,【分区分级精准防控】光明日报记者龙军2月20日，500千伏望城变电站工程复工，标志着投资规模达146.6亿元的湖南电网主网建设工程全面复工。工程于今年全部建成后，湖南将成为华中地区特高压交流重要枢纽。返程返岗，复工复产，新增确诊新冠肺炎病例大幅减少，出院人数逐步增加。湖南坚持全省上下“一盘棋”，防疫生产“两不误”，三湘四水热气升腾，萌动着浓浓的春意。2月21日，湖南省卫健委在其官方网站上，首次发布了湖南省新冠肺炎疫情分区分级评估标准内容，明确指出11个县市区由中风险B类地区调低为中风险C类地区，4个县市区由中风险C类地区调低为低风险地区。2月18日上午，湖南省委副书记、省长许达哲主持召开会议，专题研究制定《湖南省新冠肺炎疫情分区分级精准防控实施方案》，强调要科学研判疫情防控和复工复产形势，统筹做好疫情防控和经济社会发展各项工作，突出重点、统筹兼顾、分类指导、分级施策，精准制定差异化防控策略，支持和推动各地各类企业复工复产，尽快恢复生产生活秩序。湖南把科学防疫的工作重点转到常态性预防为主上来，从打“遭遇战”转向打“主动战”。湖南省公安厅制定出台全省公安机关疫情防控期间服务管理“十项措施”，强化“城市快警”“一村一辅警”巡防作用，重点加强医院、学校、厂矿企业周边巡逻防控工作，确保交通安全与畅通。2月19日，湖南省大数据防控再升级，推出“三色电子健康卡”，运用大数据分析比对，为复工企业和民众提供疫情风险等级等防疫信息。2月18日和19日，湖南省委新冠肺炎疫情防控工作领导小组接连发布《关于进一步依法科学有序做好新冠肺炎疫情防控工作的通知》《致广大员工朋友的一封信》，要求各地各部门在指导企业做好疫情防控措施的同时，全力支持企业复工复产，不得对企业复工复产增设前置条件延缓开工。长沙市政府发布《长沙市有效降低疫情影响稳定经济运行实施方案》，对重点项目建设明确了时间节点：在做好疫情防控工作前提下，续建项目2月29日前尽快复工，新建项目确保按时开工，力争提前开工，不断推动重大项目招商引资、落地达效。2月20日，郴州市北湖机场项目建设现场机声隆隆，航站楼土石方施工有序推进。该项目施工单位负责人告诉记者，当地政府为项目复工提供了管家式服务，为项目协调解决员工生活、防疫等需求，项目进度没有耽误，力争今年完工进行试飞。《光明日报》（2020年02月26日10版）
2020年02月26日,湖北夷陵：“以书传话”暖心“约定”让独居老人不孤单_荔枝网新闻,人民网-湖北频道,“这是我送给您的，不要钱！”2月24日下午，湖北省宜昌市夷陵区小溪塔街道转岗党员彭玉琴来到金凤朝阳小区4栋4楼的一家住户门前，查看了门边留言条上的内容，掏出笔写下了这句温馨留言。彭玉琴是夷陵区农业农村局农技中心的一名职工。在新冠肺炎疫情防控中，她转岗至金凤朝阳小区，负责四号楼的包保工作。在包保过程中，她了解到4栋4楼的这家住户是一位独居老人杜国英，快80岁了，听力不好，独自隔离在家，子女无法前来探望照料。杜奶奶没有手机，敲门声基本听不到，这样一来，便与外界几乎失去了联系。怎么办？考虑到杜奶奶的实际困难，加上了解到杜奶奶识字会写，彭玉琴灵机一动，她在老人大门边设置了留言条，通过留言的方式来沟通交流，了解杜奶奶每天的情况。彭玉琴跟杜奶奶约定，如果老人每天觉得精神状况良好，就在留言条上打个勾；老人想吃什么或是想用什么，直接写在纸上，彭玉琴每天会至少两次上门，根据老人的需求购买回物资后就放在门口；老人没事的话就到阳台上转转，彭玉琴在小区值守巡逻的时候，也会下意识的眺望杜奶奶家的阳台，及时了解老人家的情况。前几天，彭玉琴为杜奶奶送去了一袋子青菜和鸡蛋。杜奶奶留言要付钱给彭玉琴，还一再感谢她。于是彭玉琴给杜奶奶留言不要钱。这段时间，彭玉琴天天牵挂着杜奶奶，每天只有看到杜奶奶在纸上打了勾，她的心才会稍稍放下。“疫情防控期间，一个都不能少，一个都不能落下。”彭玉琴坚定的说：“对于这些独居的老人，我们要想方设法的让她们不觉得孤单，要让他们感受到关爱和暖意。”隔离不隔爱，这个“以书传话”的暖心故事在金凤朝阳小区志愿者队伍和和小区业主当中成为了一段佳话。（袁平、赵衎）
2020年02月26日,巴西一男子在前往意大利旅行后被确诊新冠肺炎，系南美首例_荔枝网新闻,海外网,海外网据荷兰BNO新闻通讯社2月26日消息，巴西卫生部表示，一名男子在初步测试中被检测出新型冠状病毒阳性，但他们正在等待第二次测试的结果。如果确认，这将是南美的首例。另据美国《每日野兽》“DilyBet”报道，近日，一名巴西男子在前往意大利旅行后被检测出冠状病毒阳性，这是南美首例新冠肺炎病例。这名61岁男子在圣保罗的爱因斯坦医院被检测出病毒阳性后，巴西卫生部正在再次确认这一病例，该男子的第二次新冠肺炎核酸检测结果预计将于当地时间26日公布。据报道，这名男子在2月9日至2月21日期间前往意大利。目前，他有轻微的病毒症状，包括咳嗽。
2020年02月26日,尼泊尔各界友人声援武汉，为中国加油！_荔枝网新闻,中国文化网,为支援中国打赢新型冠状病毒肺炎疫情防控阻击战，2月7日，尼泊尔政府紧急向湖北武汉捐赠口罩10万只。捐赠仪式在尼泊尔外交部举行，中国驻尼泊尔大使侯艳琪出席并致辞。尼泊尔外交部长贾瓦利、卫生与人口部长达卡尔等政府官员出席。新型冠状病毒肺炎疫情的爆发，牵动着许多关心和热爱中国的尼泊尔朋友的心，他们时刻关注着疫情变化和中国的防控进展。近日，尼泊尔驻华大使鲍德尔携全体馆员在北京为武汉加油，在尼泊尔的阿尼哥协会成员、加德满都大学孔子学院师生等尼各界友好人士也自发拍摄视频声援武汉，纷纷喊出“中国加油，武汉加油”“中国武汉加油，你能行，我们和你在一起”等口号，为中国加油打气。博克拉的民众举行烛光守夜为中国祈祷，场面感人。在尼泊尔跨喜马拉雅发展中心举办的“支持中国抗击疫情，促进中尼民心相通”活动中，为声援中国抗击新冠肺炎疫情，尼泊尔知名艺术家巴拉腊姆·达哈尔和马诺斯·甘朱莱尔分别创作并朗诵诗歌《我们在一起》和《来自佛祖故里的祝福：中国不能则谁能》。部分尼泊尔小学生为支持中国抗击疫情创作了许多绘画作品，并在活动中表演了由尼友人填词作曲的尼中双语歌曲《当你痛苦的时候》：“我受难时，你为我负重前行；你战‘疫’时，我也愿与你并肩战斗！”“阴霾总会过去，春天必将到来；让我为你祈福，祝你平安！”这些情感真挚的表演让在场者深受感动。尼泊尔各界友好人士通过多种形式支持中国抗击疫情。（来源：中国驻尼泊尔大使馆文化组）▇欢迎扫码关注▇中国文化网（中文版）
2020年02月26日,关于新冠肺炎，中国-世界卫生组织联合专家考察组的N个最新论断_荔枝网新闻,中央纪委国家监委网站,（中央纪委国家监委网站张舒谊设计制作）中央纪委国家监委网站客户端新版上线敬请关注！更多内容，为您推荐牢牢守住社区这道防线我们回家去疫病的自述：和我打过架的人，都成长了疫情下的"朋友圈"气溶胶传播？别慌，听专家说清楚｜科学战疫"我有熔喷布，谁有口罩机？"中国企业组起口罩生产"英雄联盟"别来无恙：你别来，我无恙
2020年02月26日,国家发展改革委有关负责人就科学防治、精准施策、分区分级做好疫情防控等工作情况回答记者提问_荔枝网新闻,国家发展改革委,2月25日下午，国务院应对新型冠状病毒感染肺炎疫情联防联控机制举行新闻发布会。国家发展改革委社会司司长欧晓理出席发布会，就科学防治、精准施策、分区分级做好疫情防控相关工作回答记者提问。如何采取差异化的措施，分区分级，精准施策？低风险地区实施外防输入的策略，全面恢复生产生活秩序，取消道路通行限制，帮助企业解决用工、原材料、资金设备等方面的困扰和问题，不得对企业复工复产设置条件，不得以审批、备案等形式为借口，拖延企业复工复产的时间。中风险地区实施外防输入、内防扩散的策略，尽快有序恢复正常的生产生活秩序，组织人员有序返岗，指导用工企业严格执行消毒、通风、测温等要求，降低人员密度、减少人员聚集、加强人员防护、消除风险隐患，做到疫情防控与企业复工复产同步推进。高风险地区实行内防扩散、外防输出、严格管控策略。要继续集中精力做好疫情防控工作。在疫情得到有效控制后，再有序扩大复工复产的范围。当然这里有一个前提，高风险地区也要保障疫情防控、公共事业运行、群众生活必需及其他涉及重要国计民生企业的正常运转。推动生产企业复工复产取得哪些进展和成效？一是统筹研究加强疫情防控和有序复工复产的总体要求，研究起草了《关于切实加强疫情科学防控有序做好企业复工复产工作的通知》。二是会同财政部、人民银行等部门出台了一系列产业、财税、金融政策，对重点保障企业给予优惠贷款和政策贴息支持。出台阶段性的政策措施，降低企业用工用电用气成本，与减免企业社保费用政策形成合力，鼓励企业复工复产，共渡难关。三是协调推动分批有序错峰返程返岗，做好交通运输的保障。四是积极推动重大项目、重大工程和其他具备条件领域尽快复工。五是建立了全国复工复产日调度制度。随着口罩需求大量增加，现在口罩的生产能力是否能满足需要？目前全国口罩日产量超过了5400万只，比春节假期刚刚结束时提高了近3倍，部分缓解了紧张局面。医用N95口罩日产量已经超过了90万只，月底有望达到日产100万只，总量已经基本能够满足医护一线的需求。可以预见，随着复工复产有序推进和生活秩序逐步恢复，除N95以外的普遍口罩需求也会迅速增长，供需矛盾会有所增加。现在马上要达到口罩“要多少有多少”的状况是不现实的。所以科学按需使用口罩，减少不必要的浪费，在当前很有必要。请点击“阅读原文”查看原文
2020年02月26日,日本26日最新通报：新冠肺炎感染者达862人_荔枝网新闻,央视新闻,截至当地时间2月26日上午11点，日本新冠肺炎感染者达862人，其中包括在日本国内的感染者和中国游客等157人，“钻石公主”号邮轮的乘客和乘务人员691人，以及乘坐日本政府包机回到日本国内的14人。
2020年02月26日,微光 | 逆行者的脚步_荔枝网新闻,人民政协报,videocotrol=""durtio="0"fbl=""oter="htt:img.v.jtv.comimge202022620202261582683375644_24_m.jg"rc="htt:vod.v.jtv.comvideo202022620202261582683375644_24_1391.m4"webkit-lyilie=""videobr△人民政协网视频——微光特别节目《脚步》一场突如其来的新冠肺炎疫情打乱了我们生活原本的样子曾经热闹的街道安静得仿佛能听见脚步的声音病毒肆虐，疫情严峻但这阻挡不了“逆行者”们前进的脚步他们与时间赛跑用奉献的脚步守护防疫之路他们冲锋陷阵用坚韧的脚步诠释使命担当他们昼夜奋战用辛勤的脚步搭建“救命方舱”他们奔赴最前线用现场的脚步记录每个瞬间他们是一群志同道合的人疫情当前他们一步一个脚印，让爱和希望蔓延防护服下以生命救治生命的脚步待你们归来一起迎接繁华的春、热烈的夏、收获的秋和因为有你们而温暖的冬
2020年02月26日,日本政府：将禁止去过韩国大邱、庆尚北道的外国人入境_荔枝网新闻,海外网,海外网2月26日电为防止新冠肺炎进一步扩散，日本政府25日敲定方案，将禁止曾去过韩国大邱、庆尚北道的外国人入境日本。日本首相安倍晋三作为新冠病毒感染对策总部部长，将在26日的会议上正式做出决定。综合路透社、日本《产经新闻》消息，韩国的感染者人数超过日本，且大邱等地区感染人数急剧上升，鉴于此，日本设置了新的入境限制。2周内曾滞留过相关地区的外国人禁止进入日本。日本外务省25日，将大邱、庆尚北道的感染症危险信息级别提高至2级，也就是敦促民众不要因不重要、不着急的事情前往该地区的等级。日本外相茂木敏充在记者会上称：“据韩国政府数据，自2月19日起，大邱、庆尚北道的感染病例激增，至24日已确诊607例。”早在22日，日本外务省就已呼吁当地日本人及前往相关地区人士预防感染。据韩国疾病预防管理局（KCDC）数据，截至25日，韩国国内的新冠肺炎感染者达977人。
2020年02月26日,新冠肺炎遗体解剖主刀人：病毒或有损免疫系统_荔枝网新闻,中国科学报,自2月16日起，在国家法律政策的允许下，我国开始陆续进行了新冠肺炎患者的遗体解剖工作。其中全国首例新冠肺炎患者的遗体解剖，由华中科技大学同济医学院法医学系教授刘良作为主刀人，联合华中科大附属同济医院病理科科研团队共同完成。截至目前，刘良所在团队已完成3例新冠肺炎病例死亡遗体解剖后的病理检查诊断工作，目前还有6例的正在进行中。2月24日，刘良同华中科大附属同济医院病理科教授王国平，以及该院心内科教授周宁，共同接受了《中国科学报》等媒体的采访。trog问题：目前国内对于新冠肺炎患者遗体的解剖共完成了几例？这些捐献遗体患者的大致情况如何？trogtrog刘良：trog从2月16日至今，我所在的团队共解剖了9例新冠肺炎遗体。此外，来自上海瑞金医院的科研团队在武汉解剖了两例患者遗体。这些遗体的男女比例大致平衡，年龄都比较偏老，基本都维持在60岁以上，有的甚至达到80岁，年龄最低者也超过了50岁，其他信息不便透露。trog问题：通过遗体解剖，我们是否已经取得了一些相关发现？trogtrog刘良：trog对于我们前期解剖的三具遗体，其病理学诊断的初步结果已经得出，一些更加深入的检查，如免疫组化、特殊染色等，目前也正在加紧进行中。从结果上看，我们已经取得了一些重要发现，但按照规定不便透漏细节。未来，我们将会将此次尸检的相关检测结果与临床进行对接，研究某些病变究竟是由临床上的治疗行为造成的，还是疾病本身造成的。相信相关尸检报告结果应该在不久之后就能公布于众。trog问题：一般而言，需要经过多少例尸检的综合分析，才能得出比较科学的结论？trogtrog王国平：trog从科学的角度，尸检的病例当然是越多越好，但这并不容易做到。不过从目前的情况而言，我们与国内同行共同完成的11例尸检，在数字层面是能说明一定问题的。trog问题：从尸检结果上看，新冠病毒除了侵犯肺部组织外，是否还会损害其他器官？通过尸检，我们能否进一步明确对新冠病毒传播机制？trogtrog刘良：trog从目前的的结果来看，新冠肺炎病毒在人体内不仅会造成肺部组织的损害，还可能包括免疫系统及其他器官。当然，这一结论只是基于目前的三例尸体的解剖结果得出的，至于是否具有共性，还需要等其余6例尸体解剖结果出来后才能评估。至于病毒的传播途径，这并不是病理学的问题，但在进行尸检时，我们与合作单位一起，的确做了不同器官、组织的核酸测量，有些发现也有助于对病毒传播途径的分析。但我们还需要将不同检测结果进行综合分析，因为从目前来看，不同病例以及不同脏器的监测结果并不是十分一致。trog问题：之前有学者提出，可能在一些重症患者中会暴发心肌炎或“心碎综合征”，通过解剖分析，这种可能性是否存在？trogtrog周宁：trog从新冠肺炎危重症患者的心肌损伤情况看，部分死亡病例的确表现出了高度符合暴发性心肌炎的临床特征。比如心肌损伤标志物极度升高，心功能短时间内急剧恶化，以临床猝死为主要表现，而呼吸衰竭是无法解释这一临床现象的。对于这类患者，我们高度怀疑是爆发性心肌炎。至于心碎综合征，则是相对少见的一种心肌病变，也称为应激性心肌病。多见于老年女性，往往由急剧的情绪刺激等因素诱发，感染作为诱因是相对少见的，我个人不认为心碎综合征在新冠肺炎中扮演了重要角色。trog问题：此前，钟南山院士曾表示，通过解剖发现，新冠肺炎患者肺部的纤维化现象并不严重，反倒是有些肺泡存在有大量黏液。这反映出了什么问题？这些发现对临床治疗有什么帮助？trogtrog刘良：trog通过对新冠肺炎患者肺部切片的显微镜观察，我们的确发现了其中有一些粘液性分泌物。这些分泌物的出现，需要我们在临床治疗中提高警惕。因为人体正常呼吸的一个重要前提，便是肺部气道要通畅，肺泡功能也要要得到充分发挥。新冠肺炎会损伤气道功能，如果肺泡再被粘液堵塞，患者在临床上就会出现缺氧的表现。因此，我们要将肺泡粘液进行稀释和溶解。在临床上，我们已经采用了相关的药物治疗，但我认为还可以再多进行一些尝试，如对中药的运用。只有在肺部粘液被引流出来后，在给患者供氧才能产生效果。反之，如果在粘液成分没有被化解的情况下，盲目地使用氧气装置，不但达不到目的，甚至可能会适得其反——氧气的压力会将粘液推倒肺部的更深处，加重患者的缺氧症状。这个问题需要引起我们的重视。trog问题：在此次疫情中，多位业界人士呼吁国内各大中心城市应尽快建设符合甲级传染病标准的解剖室，控制及预防烈性传染病的规章制度也应进一步完善，对此您怎么看？trog
